"unique_id","id_auto","id","old_id","Name","Address","Category","Contributor","Number_old","Street_old","Zip Code_old","Latitude_old","Longitude_old","Instagram","Pickup Offered","Status","Open Time","Close Time","Notes","Spreadsheet Update Notes","Last Observed","Opening Date","Latitude","Longitude","All - Outdated","Sub Categories","Storefront","Last modified by","City","Last Modified","Number","Street","State","Zip Code","Source","New expression","Chain","Giftcard","Phone","Delivery Offered","Website","Latine Owned","Indoor Seating Offered","Unlicensed","Previous Business","AAPI Owned","Outside Seating Offered","Legacy business","Email","HBPR eligible","Closure Date","survey_only","Women Owned","Special Offers","LGBTQIA Owned","Fundraiser","Shipping Offered","Black Owned","Ukrainian Owned","Update Requests","M/WBE","Special Accommodation Hours"
"rects1aqL2YtH5V5d",2279,2279,,,,,,,,,,,,,,,,,,,,,,,,,,,,,,,,,,,,,,,,,,,,,,,,,,,,,,,,,,,
"103",2278,2278,103,"Blue Nile Convenience","66 Avenue C, New York, NY 10009","Groceries","EVCC","66","Avenue C","10009",40.722697,-73.979717," ","Yes","Opened","12:00 AM","12:00 AM","Open 24/7!
","Observed May 2024 in former Essa Deli location (longstanding business)
","2024-08-06","2024-01-01",40.72276784510224,-73.97980418431935,"recjTi6W7xsdlrAbr","Deli","North","{""id"":""usrSSqhKNrK05i823"",""email"":""Director@evccnyc.org"",""name"":""Laura Sewell""}","New York","2024-08-06T17:11:10.000Z","66","Avenue C","NY","10009",,,,,,,,,,,,,,,,,,,,,,,,,,,,
"1792",2277,2277,1792,"Hottie Lash","35 St. Mark's Place, New York, NY 10003","Services","EVCC","35","St. Marks Place","10003",40.72868,-73.98774,,,"Unknown",,,,"Opening soon in former Taiji Body Work location.
","2024-07-30",,40.72880335,-73.98793055,"rec9oUzUjDtdkUQX6","Eyelash Spa","2nd Floor","{""id"":""usrSSqhKNrK05i823"",""email"":""Director@evccnyc.org"",""name"":""Laura Sewell""}","New York","2024-07-30T17:29:44.000Z","35","St. Mark's Place","NY","10003","https://evgrieve.com/2024/07/hottie-lash-checks-into-2nd-avenue-and.html ","What's Open Filled",,,,,,,,,,,,,,,,,,,,,,,,,,
"rec2xD1Jzf6eD3foK",2274,2274,,"Whole Foods","409 E. 14th Street, New York, NY 10009","Groceries","EVCC",,,,,,,,"Unknown",,,,"Opening Soon in former Associated Supermarket Location
","2024-07-30",,,,,"Supermarket",,"{""id"":""usrSSqhKNrK05i823"",""email"":""Director@evccnyc.org"",""name"":""Laura Sewell""}","New York","2024-07-30T17:17:32.000Z","409","E. 14th Street","NY","10009","https://evgrieve.com/2024/07/report-whole-foods-leasing-former.html ",,true,,,,,,,,,,,,,,,,,,,,,,,,,
"553",2273,2273,553,"Boka & Shiro Kuro","103 2nd Avenue, New York, NY 10003","Restaurants","EVCC","103","2nd Avenue","10003",40.727606,-73.98866,,,"Unknown",,,"
","Opening soon in former Mighty Quinn location. Relocating? Check 6 St. Marks
","2024-07-30",,40.72756237,-73.98864196,"recAh324Gi1IxunYg",,,"{""id"":""usrSSqhKNrK05i823"",""email"":""Director@evccnyc.org"",""name"":""Laura Sewell""}","New York","2024-07-30T17:08:59.000Z","103","2nd Avenue","NY","10003","https://evgrieve.com/2024/07/a-new-restaurant-for-former-mighty.html ","What's Open Filled",,"
",,,,,,,,,,,,,,,,,,,,,,,,
"491",2272,2272,491,"Green World","115 Avenue A, New York, NY 10009","Retail","EVCC","115","Avenue A","10009",40.726298,-73.98352,,"Yes","Opened","8:00 AM","1:00 AM","THU - SAT: 8:00 AM - 3:00 AM
SUN: Closed
","Rebranded as smoke shop October 2023 (after rebranding as convenience store June 2023). 
","2024-07-26","2023-10-01",40.72632679,-73.98353866,"reczxRThLOUFY5uoT","Smoke Shop","South","{""id"":""usrSSqhKNrK05i823"",""email"":""Director@evccnyc.org"",""name"":""Laura Sewell""}","New York","2024-07-26T18:33:11.000Z","115","Avenue A","NY","10009","https://evgrieve.com/2023/11/everythings-gone-green.html","What's Open Filled",,,"(212) 533-2193",,,,,,,,,,,,,,,,,,,,,,,
"2068",2271,2271,2068,"Loong Noodles","28 St. Mark's Place, New York, NY 10003","Restaurants","OB","28","St. Mark's Place","10003",40.66716,-73.695862,"https://www.instagram.com/loong_noodle/",,"Unknown",,,"
","Opening soon in former Kung Fu Tea location
","2024-07-23",,40.72884386,-73.98856474,"recpt1C9zFBlDfIDn","Chinese,Taiwanese",,"{""id"":""usrSSqhKNrK05i823"",""email"":""Director@evccnyc.org"",""name"":""Laura Sewell""}","New York","2024-07-23T18:19:08.000Z","28","St. Mark's Place","NY","10003","https://evgrieve.com/2024/07/signage-alert-loong-noodles-on-st-marks.html ","What's Open Filled",,,,,,,,,,,,,,,,,,,,,,,,,,
"1700",2270,2270,1700,"Wayne & Sons","221 2nd Avenue, New York, NY 10009","Restaurants","TN","221","2nd Avenue","10009",40.73214,-73.98545,"https://www.instagram.com/wayneandsonsnyc?utm_source=ig_web_button_share_sheet&igsh=ZDNlZDc0MzIxNw==",,"Unknown",,,,"Opening soon in former Dear Rufino Taqueria location. 
","2024-07-19",,40.73206309,-73.98536149,"rec1MFr8YuEkxUzUi","Mexican","Front","{""id"":""usrSSqhKNrK05i823"",""email"":""Director@evccnyc.org"",""name"":""Laura Sewell""}","New York","2024-07-22T16:43:40.000Z","221","2nd Avenue","NY","10009","https://www.instagram.com/p/C9oIRTmxrNt/?utm_source=ig_web_copy_link

https://evgrieve.com/2024/07/a-new-taqueria-for-221-2nd-ave.html

","What's Open Filled",,,,,,,,,,,,,,,,,,,,,,,,,,
"858",2269,2269,858,"Moody Tongue?","123 St. Mark's Place, New York, NY 10009","Restaurants","TN","123","St. Mark's Place","10009",40.726891,-73.983353,,,"Unknown",,,"
","Need biz name. Opening Soon in Pop's Eat-Rite 
","2024-07-22",,40.7269011,-73.98338738,"recM6SZVDOc47vXCl","Japanese",,"{""id"":""usrSSqhKNrK05i823"",""email"":""Director@evccnyc.org"",""name"":""Laura Sewell""}","New York","2024-07-22T16:41:47.000Z","123","St. Mark's Place","NY","10009","https://evgrieve.com/2024/07/first-sign-of-moody-tongue-on-st-marks.html","What's Open Filled",,,,,,,,,,,,,,,,,,,,,,,,,,
"156",2268,2268,156,"Paradise Gourmet Deli & Grill","175 Avenue B, New York, NY 10009","Groceries","OB","175","Avenue B","10009",40.727482,-73.979191,,"Yes","Opened","6:00 AM","12:00 AM","
","Hours from Google. Opened in former Khiladi location.
","2024-07-18","2024-01-01",40.72751,-73.97927,"recs03cXcuZuG4ge3","Deli",,"{""id"":""usrSSqhKNrK05i823"",""email"":""Director@evccnyc.org"",""name"":""Laura Sewell""}","New York","2024-07-18T17:19:56.000Z","175","Avenue B","NY","10009","https://evgrieve.com/2023/11/a-little-piece-of-paradise-on-11th-and-b.html ","What's Open Filled",,"
","(646) 484-5059","Yes",,,,,,,,,,,,,,,,,,,,,,
"1340",2267,2267,1340,"Grillify-NYC","540 E. 5th Street, New York, NY 10009","Restaurants","OB","540","E. 5th Street","10009",40.72393,-73.98283,"https://www.instagram.com/grillifynyc/ ","Yes","Opened","11:00 AM","12:00 AM","SUN: Closed
","Hours on website. Opened in former Le Burger location 7/2/2024.
","2024-07-17","2024-07-02",40.72442899774341,-73.98339702390918,"rec9eLwCMY6kbhhKO","American,Mexican",,"{""id"":""usrSSqhKNrK05i823"",""email"":""Director@evccnyc.org"",""name"":""Laura Sewell""}","New York","2024-07-18T17:27:50.000Z","540","E. 5th Street","NY","10009","https://evgrieve.com/2024/07/grillify-nyc-opens-in-former-le-burger.html 
https://www.instagram.com/p/C83iZCCs8xn/ ","What's Open Filled",,,"(646) 448-4953",,"https://www.grillify-nyc.com/ ",true,"Yes",,,,,,,,,,,,,,,,,,,
"recEN0pCC27lCg6rq",2266,2266,,"VACANT","92 3rd Avenue, New York, NY 10003",,"EVCC",,,,40.732281,-73.988239,,,"Unknown",,,"
","Long-term vacancy (former The Joint location). 
","2024-07-16",,40.732281,-73.988239,,,"North","{""id"":""usrSSqhKNrK05i823"",""email"":""Director@evccnyc.org"",""name"":""Laura Sewell""}","New York","2024-08-06T22:42:06.000Z","92","3rd Avenue","NY","10003",,,,,,,,,,,,,,,,,,,,,,,,,,,,
"750",2265,2265,750,"Movin' Mobility ","95 Avenue B, New York, NY 10009","Retail","TN","95","Avenue B","10009",40.72453,-73.98127,,"Yes","Opened","10:00 AM","8:00 PM","
","E-Bike store opened in former East Side Ink location. ( Briefly Ed Varie ) 
","2024-07-16",,40.72459571,-73.98141926,"recoBrxh133AhOyDD","E-Bikes",,"{""id"":""usrSSqhKNrK05i823"",""email"":""Director@evccnyc.org"",""name"":""Laura Sewell""}","New York","2024-07-16T18:03:35.000Z","95","Avenue B","NY","10009","https://evgrieve.com/2024/07/e-bike-retailer-moves-into-this-avenue.html","What's Open Filled",,," (917) 992-3439",,,,,,,,,,,,,,,,,,,,,,,
"2017",2263,2263,2017,"Grocery & Coffee","193 Avenue C, New York, NY 10009","Groceries","OB","193","Avenue C","10009",40.72709,-73.97699,,,"Unknown",,,,"Opening soon in former (briefly) Crazy Burger location.
","2024-07-13",,40.726944790505875,-73.97675423425076,"recrbw6zaY6M49EAh",,,"{""id"":""usrSSqhKNrK05i823"",""email"":""Director@evccnyc.org"",""name"":""Laura Sewell""}","New York","2024-07-15T19:00:18.000Z","193","Avenue C","NY","10009","https://evgrieve.com/2024/07/crazy-burgers-short-tenure-has-come-to.html ",,,,,,,,,,,,,,,,,,,,,,,,,,,
"recyRghTcQw9EaPp4",2262,2262,,"High Hub NYC ","189 Avenue C, New York, NY 10009","Retail","EVCC",,,,,,"https://www.instagram.com/highhubnyc/?utm_source=ig_web_button_share_sheet","Yes","Opened","8:00 AM","1:00 AM",,"Opened 4/20/2024 in newly constructed building (2007) with no prior walk-in retail storefronts. No online presence.
","2024-07-26","2024-04-20",,,,"Cannabis",,"{""id"":""usrSSqhKNrK05i823"",""email"":""Director@evccnyc.org"",""name"":""Laura Sewell""}","New York","2024-08-01T19:05:50.000Z","189","Avenue C","NY","10009",,,,,,,,,,true,"Newly constructed building (2007) with no prior walk-in retail storefronts",,,,,,,,,,,,,,,,,
"rec27Wrznm54DfdlO",2261,2261,,"Layers Bakeshop","209 E. 14th Street, New York, NY 10003","Cafes and Desserts","OB",,,,,,"https://www.instagram.com/layersbakeshop.us/?hl=en ","Yes","Opened","10:00 AM","12:00 AM",,"Growing Pakistani chain with 6 local stores, does not yet meet NYS chain definition. IG is current, Hours from Google. Opened in former Whale Tea location. 
","2024-07-15","2024-07-14",40.73310560124204,-73.98671083808715,"recy1C4qWotFWO6Gu","Bakery,Cafe,Halal",,"{""id"":""usrSSqhKNrK05i823"",""email"":""Director@evccnyc.org"",""name"":""Laura Sewell""}","New York","2024-07-15T19:13:25.000Z","209","E. 14th Street","NY","10003","https://www.instagram.com/p/C9airiTuFZ5/?hl=en
https://evgrieve.com/search?updated-max=2024-07-11T05:20:00-04:00&max-results=20 ","What's Open Filled",,,"(646) 922-7862",,,,,,,true,,,,,,,,,,,,,,,,
"1730",2260,2260,1730,"Cecilia","97 St. Mark's Place, New York, NY 10009","Restaurants","EVCC","97","St. Mark's Place","10009",40.727505,-73.984582,"https://www.instagram.com/cecilia97nyc/",,,,,"
","Opening soon in former Luz Cafe/Taberna 97 location.
","2024-07-08",,40.72745174,-73.98459471,,,,"{""id"":""usrSSqhKNrK05i823"",""email"":""Director@evccnyc.org"",""name"":""Laura Sewell""}","New York","2024-07-09T01:00:49.000Z","97","St. Mark's Place","NY","10009","https://evgrieve.com/2024/07/a-new-mural-for-new-restaurant-opening.html","What's Open Filled",,,,,,,"Yes",,,,"Yes",,,,,,,,,,,,,,,
"recjNxvYh4mZ1Yp9i",2259,2259,,"Lower East Side Coalition for Housing Development","71 Avenue C, New York, NY 10009","Community Services","EVCC",,,,,,,,"Unknown","9:30 AM","5:30 PM","SAT & SUN: Closed
","\*\*\*\*\*Status? Laura ask Lyn, gated (except for front door) since pandemic
","2024-07-08","1968-01-01",,,,"Tenants",,"{""id"":""usrSSqhKNrK05i823"",""email"":""Director@evccnyc.org"",""name"":""Laura Sewell""}","New York","2024-07-31T01:32:38.000Z","71","Avenue C","NY","10009",,,,,"(212) 677-4772",,"https://www.lescoalition.org/",,,,,,,true,"info@LEScoalition.org",true,,,,,,,,,,,,
"1762",2258,2258,1762,"Bananas","174 1st Avenue, New York, NY 10009","Restaurants",,"174","1st Avenue","10009",40.729038,-73.983856,,,"Unknown","12:00 PM","12:00 AM","FRI & SAT: Noon - 1:00 AM
SUN: Noon - 11:00 PM
","Opening soon in former Emilia by Nai location (at CB 3 June 2024)
","2024-07-08",,40.7291171506806,-73.98416797382153,"reccHivJvRlgXifxn","Asian",,"{""id"":""usrSSqhKNrK05i823"",""email"":""Director@evccnyc.org"",""name"":""Laura Sewell""}","New York","2024-07-15T15:38:45.000Z","174","1st Avenue","NY","10009","https://www.nyc.gov/assets/manhattancb3/downloads/votereso/votereso2024-06.pdf",,,,,,,,"Yes",,,true,,,,,,,,,,,,,,,,
"1911",2257,2257,1911,"VACANT","256 E. 3rd Street, New York, NY 10009",,"EVCC","256","E. 3rd Street","10009",40.72176,-73.98105,,,"Unknown",,,"
","
","2024-07-03",,40.72188974770132,-73.98113206069527,"recxsw9HRFTwcCwiK",,"East","{""id"":""usrSSqhKNrK05i823"",""email"":""Director@evccnyc.org"",""name"":""Laura Sewell""}","New York","2024-08-06T22:55:49.000Z","256","E. 3rd Street","NY","10009",,,,,,,,,,,,,,,,,,,,,,,,,,,,
"1911",2256,2256,1911,"Sample Size Studios","258 E. 3rd Street, New York, NY 10009","Services","EVCC","256","E. 3rd Street","10009",40.72176,-73.98105,"https://www.instagram.com/samplesizestudiosnyc/",,"Unknown",,,"
","PERMANENTLY CLOSED? Observed signage/curtains. Last IG post 2/27/2023, linktree not working. Opened April 2022.
","2024-07-03","2022-04-01",40.72188974770132,-73.98113206069527,"recxsw9HRFTwcCwiK","Advertising",,"{""id"":""usrSSqhKNrK05i823"",""email"":""Director@evccnyc.org"",""name"":""Laura Sewell""}","New York","2024-07-03T21:51:54.000Z","258","E. 3rd Street","NY","10009","https://evgrieve.com/2022/12/jay-joes-classic-cuts-now-open-on-3rd.html",,,,,,,,,,,,,,,,"2023-03-01",,,,,,,,,,,
"recZk3bdh7TIXVFTE",2255,2255,,"A2Z in NYC","67 Avenue C, New York, NY 10009","Retail","EVCC",,,,,,,"No","Closed",,,,"PERMANENTLY CLOSED. Running club / pop-up in new construction 2017-2022.
","2023-01-01","2017-01-01",,,,,,"{""id"":""usrSSqhKNrK05i823"",""email"":""Director@evccnyc.org"",""name"":""Laura Sewell""}","New York","2024-07-03T20:46:17.000Z","67","Avenue C","NY","10009",,,,,,,,,,,,,,,,,"2023-01-01",,,,,,,,,,,
"177",2254,2254,177,"H Mart","45 3rd Avenue, New York, NY 10003","Groceries","EVCC","45","3rd Avenue","10003",40.730284,-73.988951,"https://www.instagram.com/asianmartofficial/",,"Unknown","8:00 AM","11:00 PM","
","CHAIN. Business expansion observed June 2024.
","2024-07-03",,40.73053293,-73.98891301,"rec5IsYcu56OFK52c","Specialty Market,Korean",,"{""id"":""usrSSqhKNrK05i823"",""email"":""Director@evccnyc.org"",""name"":""Laura Sewell""}","New York","2024-07-03T20:29:11.000Z","45","3rd Avenue","NY","10003","https://evgrieve.com/2024/07/h-mart-is-expanding-on-3rd-avenue.html","What's Open Filled",true,,"(646) 596-7755",,"https://asianmart.com/",,,,,true,,,,,,true,,,,,,,,,,
"1551",2253,2253,1551,"Mary O's Irish Soda Bread Shop","93 E. 7th Street, New York, NY 10009","Cafes and Desserts","EVCC","93","E. 7th Street","10009",40.72692,-73.98525,,,"Unknown",,,"
","Opening late July in former 75 Degrees Cafe location.
","2024-07-03",,40.72681719985243,-73.98533748091528,"rec9URGRaj1HbzJSl","Cafe,Bakery","East","{""id"":""usrSSqhKNrK05i823"",""email"":""Director@evccnyc.org"",""name"":""Laura Sewell""}","New York","2024-07-03T20:09:40.000Z","93","E. 7th Street","NY","10009","https://evgrieve.com/2024/07/mary-o-is-bringing-her-scones-to-7th.html",,,,,,,,,,,,,,,,,,true,,,,,,,,,
"rec6V0rzA9CYzh70s",2252,2252,,"Tend","24 2nd Avenue, New York, NY 10003","Health","OB",,,,40.724307,-73.990408,,,"Unknown",,,"
","Opening soon in newly constructed condo building, previously leased for high end pop ups (gallery showroom) .
","2024-07-15",,40.724307,-73.990408,,"Dental",,"{""id"":""usrSSqhKNrK05i823"",""email"":""Director@evccnyc.org"",""name"":""Laura Sewell""}","New York","2024-07-15T15:45:52.000Z","24","2nd Avenue","NY","10003","https://evgrieve.com/2024/07/smiles-everyone-new-age-dental-studio.html",,true,,,,"https://www.hellotend.com/studios/new-york-city/east-village",,,,,,,,,,,,,,,,,,,,,
"227",2251,2251,227,"Amara Coffee","534 E. 14th Street, New York, NY 10009","Cafes and Desserts","EVCC","534","E. 14th Street","10009",40.72953,-73.978837,"https://www.instagram.com/amaracoffeenyc/?hl=en","Yes","Opened","7:00 AM","5:00 PM","SAT & SUN: 8:00 AM - 5:00 PM
","Opened 6/28/2024 in former Perk location.
","2024-06-28","2024-06-28",40.72957201,-73.97878501,"recffE3fm81G2aHz7","Cafe,Sandwich","West","{""id"":""usrSSqhKNrK05i823"",""email"":""Director@evccnyc.org"",""name"":""Laura Sewell""}","New York","2024-06-29T22:59:04.000Z","534","E. 14th Street","NY","10009","https://www.instagram.com/p/C8fxZzpxJuH/?hl=en","What's Open Filled",,,"N/A",,"https://amaracoffeenyc.com/",,"Yes",,,,,,,,,,,,,,,,,,,
"1953",2250,2250,1953,"Crepe City","199 Avenue A, New York, NY 10009","Cafes and Desserts","OB","199","Avenue A","10009",40.729475,-73.981353,"https://www.instagram.com/crepecityyy/?hl=en","Yes","Opened","12:00 PM","4:00 AM",,"IG is current. Opened 7/6/2024 in former Mikey Likes It location (briefly Smileys / Green Cloud Wellness)
","2024-07-26","2024-06-29",40.729314321809454,-73.98116964692515,"recbNwBBDk1CCSstd","Cafe,Bubble Tea","North","{""id"":""usrSSqhKNrK05i823"",""email"":""Director@evccnyc.org"",""name"":""Laura Sewell""}","New York","2024-07-26T18:37:18.000Z","199","Avenue A","NY","10009","https://evgrieve.com/2024/07/signage-alert-crepe-city-on-avenue-a.html",,,,,,,,,,,,,,,,,,,"			",,,,,,,,
"1648",2249,2249,1648,"Tin Parlour","127 1st Avenue, New York, NY 10003","Restaurants","EVCC","125","1st Avenue","10003",40.727441,-73.985641,"https://www.instagram.com/tinparlour/","Yes","Opened","5:30 PM","10:00 PM","Enter thru Nudibranch
FRI & SAT: 5:00 PM - 11:30 PM
SUN & MON: Closed
","Conservas wine bar inside Nudibranch.
","2024-06-24","2024-01-01",40.72741,-73.98573,"recGoWasvxF3sJnUM","Spanish,Wine",,"{""id"":""usrSSqhKNrK05i823"",""email"":""Director@evccnyc.org"",""name"":""Laura Sewell""}","New York","2024-06-24T22:10:28.000Z","127","1st Avenue","NY","10003","https://www.instagram.com/p/C2-fIOru1OR/","What's Open Filled",,,,,"https://linktr.ee/tinparlournyc",,"Yes",,,true,,,"admin@nudibranchnyc.com",,,,,,,,,,,,,
"871",2248,2248,871,"The Wonderland Bar","96 2nd Avenue, New York, NY 10003","Restaurants","OB","96","2nd Avenue","10003",40.72701,-73.98843,,,"Unknown",,,"
","Opening soon in former Mermaid in location. 
","2024-06-24",,40.72704363,-73.98852894,"rececAmQXBa3CWLF6","Bar,Asian",,"{""id"":""usrSSqhKNrK05i823"",""email"":""Director@evccnyc.org"",""name"":""Laura Sewell""}","New York","2024-07-15T15:54:18.000Z","96","2nd Avenue","NY","10003","https://evgrieve.com/2024/06/wondering-about-wonderland-bar-on-2nd.html","What's Open Filled",,"
",,,"https://wonderlandbarnyc.com/ ",,,,,,,,,,,,,,,,,,,,,
"1724",2247,2247,1724,"Sour Aji","23 Avenue B, New York, NY 10009","Restaurants","OB","23","Avenue B","10009",40.72218,-73.98319,"https://www.instagram.com/sourajinyc/ ","Yes","Opened","5:30 PM","11:00 PM","Book with us on [Resy!](https://resy.com/cities/new-york-ny/venues/souraji?date=2024-07-15&seats=2) 
SUN: Closed
","Opened in former Domakase location (signage observed 4/20/2024)
","2024-06-24","2024-07-01",40.72226610767526,-73.98325325645892,"recjS27Q75tWgjkyA","Japanese","North","{""id"":""usrSSqhKNrK05i823"",""email"":""Director@evccnyc.org"",""name"":""Laura Sewell""}","New York","2024-07-15T20:15:51.000Z","23","Avenue B","NY","10009","https://instagram.com/sourajinyc/",,,,"(917) 561-0895",,,,,,,true,,,,,,,,,,,,,,,,
"899",2246,2246,899,"Schmuck","97 1st Avenue, New York, NY 10003","Restaurants",,"97","1st Avenue","10003",40.726376,-73.98651,,,"Unknown",,,"		
","Opening soon in former Mancora Pisco Bar location.
","2024-06-24",,40.72636238,-73.98643487,"recnoePqEY8gAjMqJ","Middle Eastern",,"{""id"":""usrSSqhKNrK05i823"",""email"":""Director@evccnyc.org"",""name"":""Laura Sewell""}","New York","2024-06-24T20:39:55.000Z","97","1st Avenue","NY","10003","https://evgrieve.com/2024/06/schmuck-announces-itself-on-1st-avenue.html","What's Open Filled",,,,,,,,,,,,,,,,,,,,,,,,,,
"942",2245,2245,942,"Time's Up NYC Bike Co-op","626 E. 14th Street, New York, NY 10009","Services","EVCC","626","E. 14th Street","10009",40.728686,-73.976978,"https://www.instagram.com/times_up_nyc/","Yes","Opened",,,"SUN & WED: 5:00 PM - 8:00 PM
","Opened May 2024 in former Sun's Laundry location (new space from legacy org). 
","2024-06-24","2024-05-01",40.72877758,-73.9768919,"recDn4jdYcgJ6Gnss","Bicycles",,"{""id"":""usrSSqhKNrK05i823"",""email"":""Director@evccnyc.org"",""name"":""Laura Sewell""}","New York","2024-06-24T20:14:00.000Z","626","E. 14th Street","NY","10009","https://www.instagram.com/p/C8j2okrucmS/","What's Open Filled",,,,"Yes","https://times-up.org/campaigns/bike-co-op/",,,,,,,true,,,,,,,,,,,,,,
"1437",2243,2243,1437,"VACANT","328 E. 14th Street, New York, NY 10003",,"EVCC","328","E. 14th Street","10003",40.7316,-73.98395,,,"Unknown",,,,"Expanded Artichoke Basil pizza location, vacant since 2016	
","2024-06-19",,40.73168496,-73.98378027,,,"Center","{""id"":""usrSSqhKNrK05i823"",""email"":""Director@evccnyc.org"",""name"":""Laura Sewell""}","New York","2024-07-08T23:05:58.000Z","328","E. 14th Street","NY","10003",,,,,,,,,,,,,,,,,,,,,,,,,,,,
"830",2242,2242,830,"The Hidden Rose","218 E. 5th Street, New York, NY 10003","Services","EVCC","218","E. 5th Street","10003",40.72716,-73.99043,"https://www.instagram.com/the_hidden_rose_nyc/","Yes","Opened","11:00 AM","7:00 PM","SUN & MON: Closed
","Hours from IG post. Opened 11/22/2022 in former The Cave location.
","2024-06-19","2022-11-22",40.7272559,-73.99037324,"recOIAspkIpIn6AI0","Tattoo,Cosmetic Tattoo","West","{""id"":""usrSSqhKNrK05i823"",""email"":""Director@evccnyc.org"",""name"":""Laura Sewell""}","New York","2024-06-20T00:06:58.000Z","218","E. 5th Street","NY","10003","https://www.instagram.com/p/ClRnywpju3u/","What's Open Filled",,,,,"https://www.thehiddenrosenyctattoostudio.com/",,,,,,,,"inquiretherose@gmail.com",,,,,,,,,,,,,
"1961",2241,2241,1961,"Kyuubi Omakase","102 St. Mark's Place, New York, NY 10009","Restaurants","OB","102","St. Mark's Place","10009",40.72708,-73.98469,"https://www.instagram.com/kyuubi.omakase/","Yes","Opened",,,,"Opened 6/1/2024 in (briefly) Sushi Fan location.
","2024-06-07","2024-06-01",40.72737431522261,-73.98479616830832,"recx7kJMfLqYlj4xa","Omakase","East","{""id"":""usrSSqhKNrK05i823"",""email"":""Director@evccnyc.org"",""name"":""Laura Sewell""}","New York","2024-07-12T18:33:28.000Z","102","St. Mark's Place","NY","10009","https://evgrieve.com/2024/06/openings-kyuubi-omakase-on-st-marks.html",,,,"(917) 848-5830",,,,"Yes",,,true,,,,,,,,,,,,,,,,
"1942",2240,2240,1942,"The Laurels","231 2nd Avenue, New York, NY 10003","Restaurants","EVCC","231","2nd Avenue","10003",40.73266,-73.98509,"https://www.instagram.com/thelaurelsnyc/","Yes","Opened","10:00 AM","2:00 AM","THU - SAT: 10:00 AM - 4:00 AM
MON: 3:00 PM - 2:00 AM
","Opened 5/31/2023 in former Bait & Hook location.
","2024-07-08","2023-05-31",40.73251799201182,-73.98483468502799,"recymVBXQi9IUbnQZ","American",,"{""id"":""usrSSqhKNrK05i823"",""email"":""Director@evccnyc.org"",""name"":""Laura Sewell""}","New York","2024-07-09T01:11:44.000Z","231","2nd Avenue","NY","10003","https://www.instagram.com/p/Cs7bvUNJgr_/?img_index=1",,,,"(646) 398-9002",,"https://thelaurelsnyc.com/",,"Yes",,,,"Yes",,"info@thelaurelsnyc.com",,,,,,,,,,,,,
"733",2239,2239,733,"Le Bouquet","338 E. 11th Street, New York, NY 10003","Services","EVCC","338","E. 11th Street","10003",40.72948,-73.98474,"https://www.instagram.com/lebouquetny/","Yes","Opened",,,"
","RELOCATED spring 2024 from Mono Mono into (briefly) Flamingo East/misc use location, formerly Tu-Lu's Bakery.
","2024-06-03","2024-04-01",40.7295498,-73.98468464,"recSUsBdMrJZf4AK7","Florist","East","{""id"":""usrSSqhKNrK05i823"",""email"":""Director@evccnyc.org"",""name"":""Laura Sewell""}","New York","2024-07-01T19:42:21.000Z","338","E. 11th Street","NY","10003",,"What's Open Filled",,,"(212) 268-7838","Yes",,,,,,true,,,"lebouquetny@gmail.com",,,,,,,,,,,,,
"824",2238,2238,824,"Bar TBD","206 Avenue A, New York, NY 10009","Restaurants","EVCC","206","Avenue A","10009",40.729431,-73.980746,"https://www.instagram.com/bar.tbd/","Yes","Opened",,,"THU - SAT ONLY: 5:00 PM - late 
","Rebrand soft-opened May 2024 in former Borrachito/Garrett East location
","2024-06-19",,40.72946916,-73.98083295,"recuVpQillIi20KYL","Bar",,"{""id"":""usrSSqhKNrK05i823"",""email"":""Director@evccnyc.org"",""name"":""Laura Sewell""}","New York","2024-06-19T22:29:51.000Z","206","Avenue A","NY","10009","https://www.instagram.com/p/C66kFR9uL5o/","What's Open Filled",,,"(646) 992-4743",,,,,,,,"Yes",,,,,,,,,,,,,,,
"1444",2236,2236,1444,"24 Rose Shop","24 Avenue A, New York, NY 10009","Retail","EVCC","24","Avenue A","10009",40.72304,-73.98544,,"No","Closed",,,,"PERMANENTLY CLOSED? Operation padlock 6/6/2024. Observed open May 2024 in former Sogie Mart location (different operation).
","2024-06-06",,40.72311808,-73.98548202,"rec0ky49awNWjUeQf","Smoke Shop,Cannabis","North","{""id"":""usrSSqhKNrK05i823"",""email"":""Director@evccnyc.org"",""name"":""Laura Sewell""}","New York","2024-07-29T20:15:18.000Z","24","Avenue A","NY","10009","https://evgrieve.com/2024/06/the-ongoing-efforts-to-shutter.html","What's Open Filled",,,,,,,,true,"Sogie Mart closed late 2023/early 2024.",,,,,,"2024-06-06",,,,,,,,,,,
"343",2235,2235,343,"Sip+Co","433 E. 9th Street, New York, NY 10009","Cafes and Desserts","OB","433","E. 9th Street","10009",40.727678,-73.983367,"https://www.instagram.com/sipandcoev.co/","Yes","Opened","9:00 AM","8:00 PM","FRI & SAT: 9:00 AM - 10:00 PM
","IG and Website are current with hours. Opened May 2024 in former Westville Bakery location (followed by pop-ups).
","2024-05-30","2024-05-01",40.72766098,-73.98335998,"rec5fB3LCYBQ0KG1x","Cafe,Sandwich",,"{""id"":""usrSSqhKNrK05i823"",""email"":""Director@evccnyc.org"",""name"":""Laura Sewell""}","New York","2024-07-12T18:27:30.000Z","433","E. 9th Street","NY","10009","https://evgrieve.com/2024/05/soft-openings-sip-co-on-9th-street.html","What's Open Filled",,,"(917) 717-9747",,"https://www.sipandcoev.co/",,,,,true,,,,,,,,,,,,,,,,
"2165",2234,2234,2165,"Graffiti Church","205 E. 7th Street, New York, NY 10009","Free Food","EVCC","430","E. 9th Street","10009",40.72739,-73.98357,"https://www.instagram.com/graffitichurchnyc/","Yes","Opened",,,"WED: 5:30 PM Community Meal

","Longstanding church offers free community meals 5:30 PM Wednesdays and free lunch in TSP 12:30 PM Saturdays (except the 1st Saturday)
","2024-06-17",,,,,,,"{""id"":""usrSSqhKNrK05i823"",""email"":""Director@evccnyc.org"",""name"":""Laura Sewell""}","New York","2024-06-17T23:58:58.000Z","205","E. 7th Street","NY","10009",,,,,,,"https://graffitichurch.org/get-involved/",,,,,,,,"info@graffitichurch.org",,,,,,,,,,,,,
"1572",2233,2233,1572,"Pourquoi Pas","219 E. 10th Street, New York, NY 10009","Retail","EVCC","219","E. 10th Street","10009",40.72955,-73.98561,,"No","Closed","1:00 PM","6:30 PM","MON: 1:00 PM - 4:00 PM
SAT & SUN: noon - 7:00 PM
TUE & WED: Closed
","FILL. Opened May 2024 in original Archie's Press location.
","2024-05-26","2024-05-01",40.72943732,-73.98564012,"recrPV0sKkwglWvYF","Fashion,Jewelry","East","{""id"":""usrSSqhKNrK05i823"",""email"":""Director@evccnyc.org"",""name"":""Laura Sewell""}","New York","2024-05-30T00:44:42.000Z","219","E. 10th Street","NY","10009","https://www.instagram.com/p/C1XPZQQry2Z/?img_index=1","What's Open Filled",,,,,,,,,,,,,,,,,,,,,,,,,,
"1309",2231,2231,1309,"Kosmic Community Anti-Bar","115 Avenue C, New York, NY 10009","Cafes and Desserts","TN","115","Avenue C","10009",40.72445,-73.97882,"https://www.instagram.com/kosmiccommunityantibar/","Yes","Opened","10:00 AM","12:00 AM","
","Opened spring 2024 in briefly Mug & Cup location, formerly Le Jardin Bistro
","2024-07-31",,40.72442836,-73.97882008,"recRRlKT3egF419TB","Cafe,Juice Bar",,"{""id"":""usrSSqhKNrK05i823"",""email"":""Director@evccnyc.org"",""name"":""Laura Sewell""}","New York","2024-07-31T17:19:14.000Z","115","Avenue C","NY","10009","https://evgrieve.com/2024/05/the-east-village-full-of-bars-gets-anti.html","What's Open Filled",,,"(646) 368-1230",,,,,,,,,,,,,,,,,,,,,,,
"823",2230,2230,823,"Salter House","34 E. 2nd Street, New York, NY 10003","Retail","EVCC","34","E. 2nd Street","10003",40.725203,-73.990502,"https://www.instagram.com/salter.house/?hl=en","Yes","Opened",,,,"Opened Spring 2024 in former Anyway Cafe location. Building on the E. 2nd Street design block.
","2023-02-27","1995-01-01",40.72512647,-73.99053595,"rectraz9yodUfMWDe","Fashion,Gifts & Home",,"{""id"":""usrSSqhKNrK05i823"",""email"":""Director@evccnyc.org"",""name"":""Laura Sewell""}","New York","2024-05-30T00:03:39.000Z","34","E. 2nd Street","NY","10003","https://www.facebook.com/story.php?story_fbid=pfbid02f4F4mus4f61hbABagJDQK5yieyuKvNdGmWGZ6irYDTTSrT3kHfPB2nwqWaj2rUnNl&id=100063595689584&mibextid=Nif5oz&_rdr","What's Open Filled",,,"(332) 330-5808",,"https://salter.house/",,"Yes",,,,"Yes",,"info@anywaycafe.nyc.com",,"2023-02-27",,,,,,,,,,,
"1782",2229,2229,1782,"Reflexology Spa","236 E. 6th Street, New York, NY 10003","Health","EVCC","236","E. 6th Street","10003",40.72744,-73.98921,,"Yes","Opened","9:00 AM","12:00 PM","
","Hours from sandwich board outside. Opened spring 2024 in former Ruby 6 location. 
","2023-09-25","2003-01-01",40.72807511,-73.99038295,"rec2zcg75m4Qt9uKZ","Natural & Alternative","Basement,West","{""id"":""usrSSqhKNrK05i823"",""email"":""Director@evccnyc.org"",""name"":""Laura Sewell""}","New York","2024-05-29T23:50:42.000Z","236","E. 6th Street","NY","10003",,"What's Open Filled",,,"(956) 614-4135",,,,,,,,,,"jiehe236@gmail.com",,"2024-01-01",,,,,,,,,,,
"2041",2228,2228,2041,"Tell Mama Chinese Health Salon ","208 E. 6th Street, New York, NY 10003","Health","EVCC","208","E. 6th Street","10003",40.72789,-73.99027,,"Yes","Opened","10:30 AM","11:00 AM","
","RELOCATED into former Honeymoon Antiques location spring 2024. Hours from sign in window. Very little information online: see Yelp and Groupon
","2024-05-25",,40.7280219,-73.99025246,"recfZlbldi7DVoGbv","Natural & Alternative","West","{""id"":""usrSSqhKNrK05i823"",""email"":""Director@evccnyc.org"",""name"":""Laura Sewell""}","New York","2024-05-29T23:48:56.000Z","208","E. 6th Street","NY","10003",,"What's Open Filled",,,"(347) 266-0880",,,,,,,true,,,,,"2024-01-31",,,,,,,,,,,
"recRhkxDnxR1xlu0K",2227,2227,,"VACANT","207 E. 4th Street, New York, NY 10009",,,,,,40.723954,-73.983708,,,"Unknown","1:00 PM","8:00 PM","FRI & SAT: 1:00 PM - 9:00 PM 
","VACANT. former Law Office of Kaplan & Chun (closed during pandemic). WRG Winnick Tom Galo Charles Rapuano 212.792.2600
","2024-05-22",,40.723954,-73.983708,,,"East","{""id"":""usrSSqhKNrK05i823"",""email"":""Director@evccnyc.org"",""name"":""Laura Sewell""}","New York","2024-08-06T22:56:23.000Z","207","E. 4th Street","NY","10009",,,,,,,,,,,,,,,,,,,,,,,,,,,,
"recLato8FahkxEfc1",2226,2226,,"Don Juan's Barbershop","303 E. 4th Street, New York, NY 10009","Services","EVCC",,,,,,"https://www.instagram.com/donjuan303/?hl=en",,"Opened",,,"EV location is closed, find us at Jay Joe's Classic Cuts!
","EV location PERMANENTLY CLOSED. Longstanding business closed due to rent hike 6/24/2024, temporarily relocating to Jay Joe's.
","2024-06-24","1999-01-01",40.72235,-7.97991,,"Hair",,"{""id"":""usrSSqhKNrK05i823"",""email"":""Director@evccnyc.org"",""name"":""Laura Sewell""}","New York","2024-06-24T21:47:54.000Z","303","E. 4th Street","NY","10009","https://evgrieve.com/2024/05/don-juans-barber-shop-closing-after-25.html",,,,,,,true,,,,,,,,,"2024-06-24",,,,,,,,,,,
"recMmULCbgaXuBiNF",2225,2225,,"Joe's Wine","113 3rd Avenue, New York, NY 10003","Retail","EVCC",,,,,,,,"Unknown",,,,"FILL. Opening soon 
","2024-06-05",,,,,"Wine",,"{""id"":""usrSSqhKNrK05i823"",""email"":""Director@evccnyc.org"",""name"":""Laura Sewell""}","New York","2024-07-22T16:31:00.000Z","113","3rd Avenue","NY","10003","https://evgrieve.com/2024/05/joes-wine-co-not-trader-joes-coming-to.html",,,,,,,,,,,,,,,,,,,,,,,,,,,
"686",2224,2224,686,"Smoke Shop (need biz name)","279 E. 10th Street, New York, NY 10009","Retail","EVCC","279","E. 10th Street","10009",40.72828,-73.98263,,"Yes","Opened",,,"
","Observed May 2024 in former Crops for Girls location.
","2024-05-09","2024-05-01",40.72822,-73.98266,"recKQwGrKsGqLM9jG","Smoke Shop","West","{""id"":""usrSSqhKNrK05i823"",""email"":""Director@evccnyc.org"",""name"":""Laura Sewell""}","New York","2024-05-09T23:56:40.000Z","279","E. 10th Street","NY","10009",,"What's Open Filled",,,,,,,,true,,,,,,,,,,,,,,,,,,
"reczzN1YSKl9Sw5WL",2223,2223,,"Smoke Shop (need biz name)","99 3rd Avenue, New York, NY 10003","Retail","EVCC",,,,,,,"No","Closed",,,,"PERMANENTLY CLOSED May 2024 (see evgrieve post attributing door to 97 3rd Ave, located on 99 side of lot line)
","2024-05-01","2023-05-15",40.73230071,-73.98769635,,"Smoke Shop",,"{""id"":""usrSSqhKNrK05i823"",""email"":""Director@evccnyc.org"",""name"":""Laura Sewell""}","New York","2024-07-30T20:48:54.000Z","99","3rd Avenue","NY","10003","https://evgrieve.com/2023/05/is-this-skinniest-smoke-shop-in-nyc.html",,,,,,,,,true,"Previously entrance to residential building. ",,,,,,"2024-05-01",,,,,,,,,,,
"reca97VMN1F9ZkRWN",2221,2221,,"Dunkin Donuts & Baskin Robins","100 1st Avenue, New York, NY 10009","Cafes and Desserts","SB",,,,,,,"Yes","Opened","5:30 AM","6:00 PM","SAT & SUN: 6:00 AM - 4:00 PM
","CHAIN. Corporate website is not up to date.  Google says biz updated hours 3/18/2024. 
",,,40.72698,-73.98568,,"Cafe",,"{""id"":""usrSSqhKNrK05i823"",""email"":""Director@evccnyc.org"",""name"":""Laura Sewell""}","New York","2024-05-06T20:59:47.000Z","100","1st Avenue","NY","10009",,,true,,"N/A",,"https://locations.dunkindonuts.com/en/ny/new-york/100-1st-ave/342968",,,,,,,,,,,,,,,,,,,,,
"154",2220,2220,154,"Dunkin Donuts","250 E. Houston Street, New York, NY 10009","Cafes and Desserts","SB","250","E. Houston Street","10009",40.722073,-73.984836,,"Yes","Opened","5:00 AM","7:00 PM","
","CHAIN. Corporate website is not up to date. Opened spring 2024 in newly renovated storefront. Dunkin Donuts Baskin Robbins at eastern section this address was displaced in 2021 by demolition of one-story spaces. 
","2024-04-15","2024-04-01",40.72179822,-73.9841122,"recqMptOsk3HvZeix","Bakery",,"{""id"":""usrSSqhKNrK05i823"",""email"":""Director@evccnyc.org"",""name"":""Laura Sewell""}","New York","2024-05-06T20:37:23.000Z","250","E. Houston Street","NY","10009",,"What's Open Filled",true,,"N/A",,"https://locations.dunkindonuts.com/en/ny/new-york/250-e-houston-st/363950?utm_source=google&utm_medium=local&utm_campaign=localmaps&utm_content=363950&y_source=1_NzUyMTQ0OTYtNzE1LWxvY2F0aW9uLndlYnNpdGU%3D",,,,,,,,,,,,,,,,,,,,,
"959",2219,2219,959,"The Boiler Room","45 2nd Avenue, New York, NY 10003","Restaurants","EVCC","45","2nd Avenue","10003",40.72542,-73.99036,"https://www.instagram.com/boiler_room_nyc/",,"Unknown",,,"
","RELOCATING from 86 E. 4th Street (2nd Avenue) 	June 2024.
","2024-06-29",,40.72537154,-73.99025222,"recshlTJAKMOGLeHV","Bar",,"{""id"":""usrSSqhKNrK05i823"",""email"":""Director@evccnyc.org"",""name"":""Laura Sewell""}","New York","2024-06-29T23:23:17.000Z","45","2nd Avenue","NY","10003","https://evgrieve.com/2024/06/the-all-new-boiler-room-announces.html","What's Open Filled",,,,,"https://www.facebook.com/boilerroomnyc/",,,,,,,true,,,,,,,true,,,,,,,
"reciyxioZdsbzkYqe",2218,2218,,"Blank Street Coffee","36 3rd Avenue, New York, NY 10003","Cafes and Desserts","JK",,,,,,,"No","Closed",,,"
","PERMANENTLY CLOSED 11/12/2023. CHAIN. 
","2023-11-12","2022-01-01",,,,"Cafe",,"{""id"":""usrSSqhKNrK05i823"",""email"":""Director@evccnyc.org"",""name"":""Laura Sewell""}","New York","2024-05-03T19:42:17.000Z","36","3rd Avenue","NY","10003","https://evgrieve.com/2023/11/blank-street-is-down-to-1-east-village.html",,true,,,,,,,,,,,,,,"2023-11-12",,,,,,,,,,,
"recChKfpYFIHV3PeU",2217,2217,,"Hidden Grounds Chai & Coffee House","36 3rd Avenue, New York, NY 10003","Cafes and Desserts","JK",,,,,,,"Yes","Opened","7:00 AM","6:00 PM","SAT & SUN: 8:00 AM - 6:00 PM
","Local chain 5 stores, does not meet NYS chain definition. Opened 4/29/2024 in former Blank Street location.
","2024-05-03","2024-04-29",,,,"Cafe",,"{""id"":""usrSSqhKNrK05i823"",""email"":""Director@evccnyc.org"",""name"":""Laura Sewell""}","New York","2024-05-03T19:36:57.000Z","36","3rd Avenue","NY","10003","https://evgrieve.com/2024/04/openings-hidden-grounds-chai-coffee.html",,,,"(832) 275-0678",,,,,,,,,,,,,,,,,,,,,,,
"1852",2216,2216,1852,"Luscious Market Deli","68 2nd Avenue, New York, NY 10003","Groceries","JK","68","2nd Avenue","10003",40.72595,-73.98923,,"Yes","Opened",,,,"Opened April 2024 in former Watering Hole (Queen Vic) location. 
","2024-05-03","2024-04-01",40.72602221,-73.98930904,"reczqqk9ByG2fDsRe","Deli","North","{""id"":""usrSSqhKNrK05i823"",""email"":""Director@evccnyc.org"",""name"":""Laura Sewell""}","New York","2024-05-03T19:21:22.000Z","68","2nd Avenue","NY","10003","https://evgrieve.com/2024/04/a-luscious-new-market-option-on-2nd.html","What's Open Filled",,,,,,,,,,,,,,,,,,,,,,,,,,
"685",2215,2215,685,"Rename Salon","116 E. 7th Street, New York, NY 10009","Services","JK","116","E. 7th Street","10009",40.72635,-73.98447,"https://www.instagram.com/renamehairsalon/","Yes","Opened","11:00 AM","8:00 PM","THU: Closed

","IG is current.  Biz updated Google hours 3/29/2024. Soft-opened in former Mochii location. 
","2024-05-29","2024-03-29",40.72632507,-73.98449553,"recD8aJ0jUMp0P1pu","Hair","East","{""id"":""usrSSqhKNrK05i823"",""email"":""Director@evccnyc.org"",""name"":""Laura Sewell""}","New York","2024-05-29T19:44:11.000Z","116","E. 7th Street","NY","10009","https://www.instagram.com/p/C5Cr2v0N4Ji/","What's Open Filled",,,"(646) 341-1809",,,,,,,,,,,,,,,,,,,,,,,
"999",2214,2214,999,"Lui and Lui NYC & Friends","191 E. 3rd Street, New York, NY 10009","Retail",,"191","E. 3rd Street","10009",40.72309,-73.9834,"https://www.instagram.com/luiandluinyc/","Yes","Opened","11:00 AM","8:00 PM","
","Year long takeover of 3rd & B'zaar (which will still have a presence in the store).
","2024-05-09","2024-05-09",40.72299642,-73.98346122,"rec5kc3P04XYfZtJH","Fashion",,"{""id"":""usrSSqhKNrK05i823"",""email"":""Director@evccnyc.org"",""name"":""Laura Sewell""}","New York","2024-05-09T23:15:41.000Z","191","E. 3rd Street","NY","10009","https://evgrieve.com/2024/05/lui-lui-takes-center-stage-at-next.html","What's Open Filled",,,,,"https://www.luiandluiofficial.com/",true,,,,,,,,,,,true,"



",,,,,,,,
"recCCgozxahUHBPTU",2213,2213,,"An Kang / New Yang Kang Bodywork","43 St. Mark's Place, New York, NY 10003","Health","EVCC",,,,,,,"Yes","Opened",,,,"Longstanding business (since 2013 or 2012 as per Google).
","2024-04-29",,40.72856,-73.98706,,"Natural & Alternative",,"{""id"":""usrSSqhKNrK05i823"",""email"":""Director@evccnyc.org"",""name"":""Laura Sewell""}","New York","2024-04-29T20:27:44.000Z","43","St. Mark's Place","NY","10003",,,,,"(212) 851-6436",,,,,,,true,,,,,,,,,,,,,,,,
"1057",2212,2212,1057,"Superbueno","13 1st Avenue, New York, NY 10003","Restaurants","EVCC","13","1st Avenue","10003",40.72349,-73.98864,"https://www.instagram.com/SuperBuenoNYC","Yes","Opened","4:00 PM","2:00 AM","SAT & SUN: 2:00 PM - 2:00 AM
","IG and website are current, hours from IG profile, website lists same phone as Boilermaker. Opened 4/21/2024 in former Boilermaker location. 
","2024-04-29","2024-04-21",40.72344366,-73.98857524,"rec73REd4zE8sNz9W","Bar,Mexican",,"{""id"":""usrSSqhKNrK05i823"",""email"":""Director@evccnyc.org"",""name"":""Laura Sewell""}","New York","2024-04-29T20:17:05.000Z","13","1st Avenue","NY","10003","https://www.instagram.com/p/CrJWI-dLKof/","What's Open Filled",,,"(347) 866-7739",,"https://www.superbuenonyc.com/",true,"Yes",,,,,,"info@superbuenonyc.com",,,,,,,,,,,,,
"712",2211,2211,712,"The East Village Basement","321 E. 9th Street, New York, NY 10003","Arts & Culture","EVCC","321","E. 9th Street","10003",40.72886,-73.98608,"https://www.instagram.com/theatrewritenow/","Yes","Opened",,,"
","Opened February 2024 in former Uliana Hair Salon
","2024-04-27","2024-02-15",40.7289013,-73.98605336,"recG1gxM5DCAEFoN8","Theater","Basement","{""id"":""usrSSqhKNrK05i823"",""email"":""Director@evccnyc.org"",""name"":""Laura Sewell""}","New York","2024-04-27T23:38:32.000Z","321","E. 9th Street","NY","10003","https://www.broadwayworld.com/off-off-broadway/article/Theatre-Write-Now-Announces-First-Cycle-Of-New-Plays-Beginning-April-27-20240328","What's Open Filled",,,,,"https://www.alexkopnick.com/theatre-write-now",,,,,,,,,,,,,,,,,,,,,
"1663",2210,2210,1663,"Smoke & Vape","226 E. 3rd Street, New York, NY 10009","Retail","EVCC","226","E. 3rd Street","10009",40.72201,-73.98226,,"Yes","Opened",,,"
","Opened April 2024 in former Gaia Italian Cafe location.
","2024-04-26","2024-04-01",40.72220027,-73.98211291,"rec6Um2Nl2HTEgtXj","Smoke Shop","West","{""id"":""usrSSqhKNrK05i823"",""email"":""Director@evccnyc.org"",""name"":""Laura Sewell""}","New York","2024-07-31T05:05:29.000Z","226","E. 3rd Street","NY","10009","https://evgrieve.com/2024/04/a-smoke-and-vape-shop-for-former-gaia.html","What's Open Filled",,,,,,,,true,"Gaia Italian Cafe closed (due to harassment issues) ",,,,,,,,,,,,,,,,,
"1759",2209,2209,1759,"Salon? Need Biz Name","516 E. 6th Street, New York, NY 10009","Services",,"516","E. 6th Street","10009",40.72487,-73.98314,,,"Unknown",,,,"Opening soon in former Wood Vibez location
","2024-04-25",,40.72520575728145,-73.983349928781,"recpNfHMxOVnJeXn5","Hair","East","{""id"":""usrSSqhKNrK05i823"",""email"":""Director@evccnyc.org"",""name"":""Laura Sewell""}","New York","2024-04-25T19:09:30.000Z","516","E. 6th Street","NY","10009",,,,,,,,,,,,,,,,,,,,,,,,,,,,
"775",2208,2208,775,"Pizza Pazzo","70 E. 1st Street, New York, NY 10003","Restaurants","EVCC","70","E. 1st Street","10003",40.7236,-73.98879,,"Yes","Opened","9:00 AM","5:00 PM","SAT & SUN: Closed
","Hours from website. Opened 4/20/2024 in former Pinky's Space location.
","2024-04-23","2024-04-20",40.72355,-73.9888,"recN906hYaMYAw0YB","Pizza",,"{""id"":""usrSSqhKNrK05i823"",""email"":""Director@evccnyc.org"",""name"":""Laura Sewell""}","New York","2024-04-23T17:10:06.000Z","70","E. 1st Street","NY","10003","https://evgrieve.com/2024/04/openings-pizza-pazzo-on-1st-street.html","What's Open Filled",,,"(347) 522-0909",,"https://pizzapazzo.nyc/",,,,,,,,,,,,,,,,,,,,,
"recIuqz6zRADugnCg",2207,2207,,"The MG Artistic Hair Salon","20 St. Mark's Place, New York, NY 10003","Services","SB",,,,40.728903,-73.988953,"https://www.instagram.com/mg_manhattan/","Yes","Opened","11:00 AM","8:00 PM","
","Hours from website. Opened April 2024 in former vacant location.
","2024-04-23","2024-04-01",40.728903,-73.988953,,"Hair","2nd Floor","{""id"":""usrSSqhKNrK05i823"",""email"":""Director@evccnyc.org"",""name"":""Laura Sewell""}","New York","2024-04-29T16:59:42.000Z","20","St. Mark's Place","NY","10003","https://www.instagram.com/p/C5BnUuAOvWZ/",,,,"(646) 398-7595",,"https://mghairartistic.com/",,,,,,,,"mghairartistic@gmail.com",,,,,,,,,,,,,
"1900",2206,2206,1900,"Lydia's","16 1st Avenue, New York, NY 10009","Restaurants","SB","16","1st Avenue","10009",40.723351,-73.987984,"https://www.instagram.com/lydiasnyc/","Yes","Opened",,,"
","IG is current. Opened 5/2/2024 in former The Grayson location.
","2024-04-22","2024-05-02",40.72346618785478,-73.98827490382985,"recpePBowrg8hyVSh","Bar",,"{""id"":""usrSSqhKNrK05i823"",""email"":""Director@evccnyc.org"",""name"":""Laura Sewell""}","New York","2024-05-03T21:06:43.000Z","16","1st Avenue","NY","10009","https://evgrieve.com/2024/04/a-changing-of-bar-at-16-1st-ave.html",,,,,,,,,,,,,,,,,,,,,,,,,,,
"recH7ec6F3CoK8YEO",2205,2205,,"VACANT?","531 E. 13th Street, New York, NY 10009","Services",,,,,40.72932,-73.979301,,,"Unknown",,,,"Laura ask Susan McK maybe office? 
","2024-04-29",,40.72932,-73.979301,,,,"{""id"":""usrSSqhKNrK05i823"",""email"":""Director@evccnyc.org"",""name"":""Laura Sewell""}","New York","2024-04-29T16:59:42.000Z","531","E. 13th Street","NY","10009",,,,,,,,,,,,,,,,,,,,,,,,,,,,
"239",2204,2204,239,"Il Gusto Pizza","50 2nd Avenue, New York, NY 10003","Restaurants","EVCC","50","2nd Avenue","10003",40.725364,-73.989744,"https://www.instagram.com/ilgustopizzanyc/","Yes","Opened","11:00 AM","10:00 PM","THU: 11:00 AM - 12:00 AM
FRI & SAT: 11:00 AM - 2:00 AM
SUN: 11:00 AM - 10:00 PM
","Hours from website, IG is current. Observed grand opening flags 4/17/2024 in former Proto's Pizza location.
","2024-04-29","2024-04-01",40.72539958,-73.98978463,"recsLGoNuajcK36O1","Pizza","Center","{""id"":""usrSSqhKNrK05i823"",""email"":""Director@evccnyc.org"",""name"":""Laura Sewell""}","New York","2024-07-08T19:48:49.000Z","50","2nd Avenue","NY","10003",,"What's Open Filled",,,"(646) 767-0056","Yes","https://ilgustopizzanyc.com/",,"Yes",,,,"Yes",,,,,,,,,,,,,,,
"1539",2203,2203,1539,"Bon Spa","100 St. Mark's Place, New York, NY 10009","Health","EVCC","100","St. Mark's Place","10009",40.72711,-73.98476,,,"Opened","5:00 PM","10:00 PM","Book hourly seating on **[Resy](https://resy.com/cities/new-york-ny/venues/KYUUBI?date=2024-07-12&seats=2)**!
","Observed in 2021 survey. 
","2024-04-15",,40.72722436,-73.98470245,"rec6Epm86c3l20uJl","Natural & Alternative","East","{""id"":""usrSSqhKNrK05i823"",""email"":""Director@evccnyc.org"",""name"":""Laura Sewell""}","New York","2024-07-12T18:32:43.000Z","100","St. Mark's Place","NY","10009","https://evgrieve.com/2024/04/cakes-by-klein-takes-102-st-marks-place.html","What's Open Filled",,,,,,,,,,,,,,,,,,,,,,,,,,
"2233",2202,2202,2233,"Cakes by Klein","102 St. Mark's Place, New York, NY 10009","Cafes and Desserts","EVCC","102","St. Mark's Place","10009",40.72708,-73.98469,"https://www.instagram.com/cakesbyklein/","Yes","Opened",,,"Custom cakes! [Follow our Instagram](https://www.instagram.com/cakesbyklein/?img_index=1) for weekend pop-up hours
","Custom cake bakery with weekend public pop-ups soft-opened June 2024 in former The Avenue Cafe.
","2024-07-03","2024-06-01",40.72737431522261,-73.98479616830832,"recFlpFnEKYxJ7DLC","Bakery","West","{""id"":""usrSSqhKNrK05i823"",""email"":""Director@evccnyc.org"",""name"":""Laura Sewell""}","New York","2024-07-03T20:53:53.000Z","102","St. Mark's Place","NY","10009","https://evgrieve.com/2024/07/a-visit-to-cakes-by-klein-on-st-marks.html",,,,,,,true,,,,,,,"Cakesbyklein@gmail.com",,,,,,,,,,,,,
"735",2201,2201,735,"Gnocchi on 9th","315 E. 9th Street, New York, NY 10003","Restaurants","OB","315","E. 9th Street","10003",40.72903,-73.98629,"https://www.instagram.com/gnocchinyc/","Yes","Opened","11:00 AM","9:00 PM","
","Opened 4/13/2024 in former Vearmeat location.
","2024-04-15","2024-04-13",40.72893886,-73.98632426,"reczg8cjnB4vc8FP0","Italian",,"{""id"":""usrSSqhKNrK05i823"",""email"":""Director@evccnyc.org"",""name"":""Laura Sewell""}","New York","2024-07-12T19:35:48.000Z","315","E. 9th Street","NY","10003","https://evgrieve.com/2024/04/openings-gnocchi-on-9th-on-9th.html","What's Open Filled",,,"(646) 858-0008",,"https://gnocchinyc.com/east-village/ ",,,,,,,,,,,,,,,,,,,,,
"686",2200,2200,686,"Need Biz Name","279 E. 10th Street, New York, NY 10009",,,"279","E. 10th Street","10009",40.72828,-73.98263,,"No","Unknown",,,"
","Observed renovation, smoke shop?
","2024-04-13",,40.72822,-73.98266,"recKQwGrKsGqLM9jG",,"West","{""id"":""usrSSqhKNrK05i823"",""email"":""Director@evccnyc.org"",""name"":""Laura Sewell""}","New York","2024-04-15T19:14:36.000Z","279","E. 10th Street","NY","10009",,"What's Open Filled",,,,,,,,,,,,,,,,,,,,,,,,,,
"1715",2199,2199,1715,"Kaliiva","11 Avenue B, New York, NY 10009","Retail","TN","11","Avenue B","10009",40.721848,-73.98355,,,"Unknown","12:00 PM","8:00 PM","FRI - SUN: 11:00 AM - 9:00 PM
","Temporarily Closed. Observed vacant? 7/25/2024. Hours from website. Opened 1/1/2024 in former Raul's Barber Shop location.
","2024-07-25","2024-01-01",40.72185992506341,-73.98354196932469,"recdhyjkABYWsgnvL","Cannabis",,"{""id"":""usrSSqhKNrK05i823"",""email"":""Director@evccnyc.org"",""name"":""Laura Sewell""}","New York","2024-07-31T18:28:15.000Z","11","Avenue B","NY","10009","https://www.kaliiva.com/dispensary-nyc/ 
https://evgrieve.com/2024/01/signage-alert-kaliiva-cannabis.html",,,,"(646) 370-3485",,"https://www.kaliiva.com/",,,true,"Raul's Barbershop (retired and relocated with nephews running business) in November 2022",,,,,,,,,,,,,,,,,
"2074",2198,2198,2074,"The Last Resort","432 E. 13th Street, New York, NY 10009","Restaurants","EVCC","432","E. 13th Street","10009",40.72991,-73.9819,"https://www.instagram.com/thelastresortnyc/","Yes","Opened","4:00 PM","2:00 AM","THU & FRI: 4:00 PM - 4:00 AM
SAT: 2:00 PM - 4:00 AM
SUN: 2:00 PM - 2:00 AM
","Hours from website, IG is current. Opened February 2024 in former Keybar location
","2024-04-15","2024-02-01",40.73029436918432,-73.98223736510921,"rec6JYA8y1r3KBzf6","Bar","West","{""id"":""usrSSqhKNrK05i823"",""email"":""Director@evccnyc.org"",""name"":""Laura Sewell""}","New York","2024-04-15T18:46:19.000Z","432","E. 13th Street","NY","10009",,,,,"(212) 933-1878",,"https://www.thelastresortnyc.com/",,"Yes",,,,,,,,,,,,,,,,,,,
"1868",2197,2197,1868,"Idaho","349 E. 13th Street, New York, NY 10003","Restaurants","EVCC","349","E. 13th Street","10003",40.73096,-73.98339,"https://www.instagram.com/idahobarnyc/","Yes","Opened","5:00 PM","1:00 AM","FRI: 5:00 PM - 4:00 AM
SAT: 1:00 PM - 4:00 AM
SUN: 1:00 PM - 12:00 AM
MON: Closed
","Hours from website. Opened January 2024 in former Hermana/Sister Jane location.
","2024-04-12","2024-01-01",40.73088791,-73.98339084,"rec7SIVFfyePO6BxS","Bar",,"{""id"":""usrSSqhKNrK05i823"",""email"":""Director@evccnyc.org"",""name"":""Laura Sewell""}","New York","2024-04-15T18:46:15.000Z","349","E. 13th Street","NY","10003",,"What's Open Filled",,,"(646) 755-8209",,"https://www.idahobarnyc.com/",,"Yes",,,,,,,,,,,,,,,,,,,
"51",2196,2196,51,"Carnitas Ramirez","210 E. 3rd Street, New York, NY 10009","Restaurants","EVCC","210","E. 3rd Street","10009",40.722424,-73.982899,"https://www.instagram.com/p/C7nGKBgsZJ6/","Yes","Opened","11:00 AM","10:00 PM","FRI - SUN ONLY!
SUN: 11:00 AM - 9:00 PM
","Soft-opened June 2024 in former Cafe Cortadito location.
","2024-06-19",,40.72249145,-73.98282936,"rec6x8erZfAWTrZuY","Mexican",,"{""id"":""usrSSqhKNrK05i823"",""email"":""Director@evccnyc.org"",""name"":""Laura Sewell""}","New York","2024-06-19T22:30:11.000Z","210","E. 3rd Street","NY","10009","https://evgrieve.com/2024/05/a-look-at-carnitas-ramirez-opening-soon.html","What's Open Filled",,,,,,true,"Yes",,,,"Yes",,,,,,,,,,,,,,,
"1553",2195,2195,1553,"Utshob","130 1st Avenue, New York, NY 10009","Restaurants","OB","130","1st Avenue","10009",40.727349,-73.98519,"https://www.instagram.com/utshob_restaurant/","Yes","Opened","10:00 AM","4:00 AM","
","Business updated Google hours 6/21/24. Opened in former Wild Son lunch counter location. 
","2024-03-28","2024-05-16",40.72743477738561,-73.98539507202098,"recxKFsGZT13qaQUI","Bangladeshi,Indian,Pakistani,Halal",,"{""id"":""usrSSqhKNrK05i823"",""email"":""Director@evccnyc.org"",""name"":""Laura Sewell""}","New York","2024-07-12T18:13:28.000Z","130","1st Avenue","NY","10009","https://evgrieve.com/2024/03/signage-alert-utshob-restaurant-on-1st.html",,,,"(646) 370-3392",,,,"Yes",,,true,,,,,,,,,,,,,,,,
"725",2194,2194,725,"Live at the Barber Shop","174 E. 2nd Street, New York, NY 10009","Arts & Culture","EVCC","174","E. 2nd Street","10009",40.72269,-73.98457,,"Yes","Opened",,,"FRI & SAT: shows at 8:30 and 10:30 PM
","Afterhours comedy club in Original Barber Shop
","2024-04-12",,40.72262982,-73.98462271,"recQ9SUwH5ddApYo9","Comedy",,"{""id"":""usrSSqhKNrK05i823"",""email"":""Director@evccnyc.org"",""name"":""Laura Sewell""}","New York","2024-04-13T00:19:06.000Z","174","E. 2nd Street","NY","10009",,"What's Open Filled",,,,,"https://greatestshowever.com/",,,,,,,,,,,,,,,,,,,,,
"1884",2193,2193,1884,"VACANT","170 E. 2nd Street, New York, NY 10009",,"EVCC","170","E. 2nd Street","10009",40.72278,-73.98465,,,"Unknown",,,,"Observed empty with Palm Reader flyer in window 4/9/2024 (917) 622-3383
","2024-04-12",,40.722606670971,-73.98479004060967,,,"East","{""id"":""usrSSqhKNrK05i823"",""email"":""Director@evccnyc.org"",""name"":""Laura Sewell""}","New York","2024-08-06T22:26:37.000Z","170","E. 2nd Street","NY","10009",,,,,,,,,,,,,,,,,,,,,,,,,,,,
"159",2192,2192,159,"Pasta de Pasta","192 1st Avenue, New York, NY 10009","Restaurants","EVCC","192","1st Avenue","10009",40.729678,-73.983447,"https://www.instagram.com/pastadepastany/","Yes","Opened","12:00 PM","11:00 PM","
","Opened June 11 in former Koko Wings location (Turkish pasta from the owners of Gelatoville)
","2024-06-19","2024-06-11",40.72971941,-73.98350509,"recNmnzSBs8Sq6fUS","Mediterranean","North","{""id"":""usrSSqhKNrK05i823"",""email"":""Director@evccnyc.org"",""name"":""Laura Sewell""}","New York","2024-06-24T19:19:36.000Z","192","1st Avenue","NY","10009","https://evgrieve.com/2024/04/pasta-for-former-koko-wings-on-1st.html","What's Open Filled",,,,,,,"Yes",,,,,,,,,,,,,,,,,,,
"493",2191,2191,493,"Wonder","8 Stuyvesant Street, New York, NY 10003","Restaurants","EVCC","8","Stuyvesant Street","10003",40.729766,-73.989189,"https://www.instagram.com/wonder/?hl=en","Yes","Opened","10:30 AM","10:30 PM","
","CHAIN. Hours from website. IG and website are current. Food hall opened 5/16/2024 in former Panya, Angel's Share and Village Yokocho locations (followup: evgrieve reports 8-14 Stuy; website has 2 Stuy)
","2024-05-16","2024-05-16",40.72979765,-73.98916564,"recgOzs9ShyMIuz5p",,,"{""id"":""usrSSqhKNrK05i823"",""email"":""Director@evccnyc.org"",""name"":""Laura Sewell""}","New York","2024-05-16T19:44:01.000Z","8","Stuyvesant Street","NY","10003","https://evgrieve.com/2024/05/wonder-debuts-its-new-kind-of-food-hall.html","What's Open Filled",,,,"Yes","https://www.wonder.com/food-delivery-locations/east-village",,"Yes",,,,,,,,,,,,,,,,,,,
"1227",2190,2190,1227,"Red Beard Coffee & Bakery","194 1st Avenue, New York, NY 10009","Cafes and Desserts","EVCC","194","1st Avenue","10009",40.72974,-73.98339,"https://www.instagram.com/redbeardcoffeebakery/","Yes","Opened","8:00 AM","9:30 PM","
","Lazy Llama partners opened 6/22/2024 in former Cafe Sandra location, hours from IG post.
","2024-06-24","2024-06-22",40.72975349,-73.98347379,"recwuaMuxhwYtkBwM","Cafe,Bakery","South","{""id"":""usrSSqhKNrK05i823"",""email"":""Director@evccnyc.org"",""name"":""Laura Sewell""}","New York","2024-06-29T23:40:53.000Z","194","1st Avenue","NY","10009","https://evgrieve.com/2024/06/3-new-bakeries-cafes-have-opened-in.html","What's Open Filled",,,,,,,"Yes",,,,,,,,,,,,,,,,,,,
"1518",2189,2189,1518,"Pimbeche Vintage","90 E. 3rd Street, New York, NY 10003","Retail","EVCC","90","E. 3rd Street","10003",40.72477,-73.98805,"https://www.instagram.com/pimbechevintage/","Yes","Opened","12:00 PM","7:00 PM","SUN: Noon - 6:00 PM
MON & TUE: Closed
","IG and website are current, hours from IG. Opened 4/5/2024 in former Village Works location. 
","2024-06-24","2024-04-05",40.72462616,-73.98786808,"reccCSrGLJlUvkUmA","Fashion,Vintage,Jewelry","West","{""id"":""usrSSqhKNrK05i823"",""email"":""Director@evccnyc.org"",""name"":""Laura Sewell""}","New York","2024-06-24T22:28:43.000Z","90","E. 3rd Street","NY","10003","https://www.instagram.com/p/C5jIpd_OI3J/l","What's Open Filled",,,,,"https://pimbechevintage.com/",,,,,,,,,,,,true,,,"
",,,,,,
"2080",2188,2188,2080,"Cello's Pizzeria","36 St. Mark's Place, New York, NY 10003","Restaurants","TN","36","St. Mark's Place","10003",40.66708,-73.69559,"https://www.instagram.com/cellosnyc/?hl=en","Yes","Opened","12:00 PM","9:30 PM","THU - SAT: Noon - 10:30 PM
","Hours from website 7/22/24. Soft-opened 5/22/24 in revolving door location by Larry Kramer of Whitman's (St Marks Pizzeria Nov 2023, Funzi's 06/26/23, oh-k dog, Joe's steam rice roll).
","2024-07-22","2024-05-22",40.728733349457855,-73.98801420056265,"recebkdf4y8WqwAr1","Pizza","West","{""id"":""usrSSqhKNrK05i823"",""email"":""Director@evccnyc.org"",""name"":""Laura Sewell""}","New York","2024-07-22T16:57:18.000Z","36","St. Mark's Place","NY","10003","https://evgrieve.com/2024/05/cellos-pizzeria-now-in-soft-open-mode.html",,,,,"Yes","https://slicelife.com/restaurants/ny/new-york/10003/cello-s-pizza/menu?button_type=view_menu&format=banner&utm_term=banner&position=top&variant=dark&breakpoint=desktop&button_text=view_menu&color=green&theme=minimal&utm_campaign=order_now_button&utm_content=widget&utm_medium=referral&utm_source=cellosnyc.com&value_message=discount&own_web_referrer=l.instagram.com
",,,,,,,,,,,,,,,,,,,,,
"1907",2187,2187,1907,"Rice Thief","95 2nd Avenue, New York, NY 10003","Restaurants","EVCC","95","2nd Avenue","10003",40.727234,-73.989002,,,"Unknown",,,,"Opening soon in former Wild Mirrors location
","2024-04-03",,40.72719986,-73.98891199,"recM2DOw65AU1lQ9y","Korean",,"{""id"":""usrSSqhKNrK05i823"",""email"":""Director@evccnyc.org"",""name"":""Laura Sewell""}","New York","2024-04-08T20:22:03.000Z","95","2nd Avenue","NY","10003","https://evgrieve.com/2024/04/on-april-cb3-sla-docket-rice-thief-for.html","What's Open Filled",,,,,,,,,,true,,,,,,,,,,,,,,,,
"recLoQk1EJBcikOQT",2186,2186,,"The Onion Tree Pizza Co.","214 1st Avenue, New York, NY 10009","Restaurants","EVCC",,,,40.730423,-73.982898,"https://www.instagram.com/theoniontreepizzaco/","Yes","Opened","2:00 PM","10:00 PM","FRI: 2:00 PM - Midnight
SAT:  Noon - Midnight
SUN: Noon - 10:00 PM
MON & TUE: Closed
","Hours from evgrieve post, IG is current. Opened 4/25/2024 in former Koko Sushi location.
","2024-04-29","2024-04-25",40.730423,-73.982898,,"Pizza,Indian",,"{""id"":""usrSSqhKNrK05i823"",""email"":""Director@evccnyc.org"",""name"":""Laura Sewell""}","New York","2024-05-23T21:28:44.000Z","214","1st Avenue","NY","10009","https://evgrieve.com/2024/05/openings-onion-tree-pizza-co-on-1st-ave.html",,,,"(646) 809-3266",,"https://theoniontreepizzaco.com/",true,,,,,,,,,,,,,,,,,,,,
"1784",2185,2185,1784,"Romeo's","118 St. Mark's Place, New York, NY 10009","Restaurants","EVCC","118","St. Mark's Place","10009",40.72692,-73.98405,"https://www.instagram.com/romeosnyc/","Yes","Opened","4:00 PM","2:00 AM","FRI: 4:00 PM- 4:00 AM
SAT: 2:00 PM - 4:00 AM
SUN: 2:00 PM - 2:00 AM
","Hours from website, IG is current. Opened April 2024 in former St. Dymphna's location (briefly Canna Culture)
","2024-08-07","2024-04-01",40.72727821851316,-73.98456889074869,"recgSTdrtr09LYm3A","Bar",,"{""id"":""usrSSqhKNrK05i823"",""email"":""Director@evccnyc.org"",""name"":""Laura Sewell""}","New York","2024-08-07T16:47:38.000Z","118","St. Mark's Place","NY","10009","https://www.instagram.com/p/C4tL11CO5fv/?hl=en",,,,"N/A",,"https://www.romeosnyc.com/",,"Yes",,,,"Yes",,"drinks@romeosnyc.com",,,,,,,,,,,,,
"948",2184,2184,948,"Royal Convenience","214 E. 9th Street, New York, NY 10003","Retail","EVCC","214","E. 9th Street","10003",40.7296,-73.98869,,"Yes","Opened",,,"
","Observed 2/18/2024, no information online
","2024-07-26","2024-02-01",40.72969096,-73.98866921,"recaeiHkjFh6xfO3W","Smoke Shop","West","{""id"":""usrSSqhKNrK05i823"",""email"":""Director@evccnyc.org"",""name"":""Laura Sewell""}","New York","2024-07-26T18:47:00.000Z","214","E. 9th Street","NY","10003",,"What's Open Filled",,,,,,,,true,,,,,,,,,,,,,,,,,,
"reces2An78wTDRmz5",2183,2183,,"Paradise Lost","100 2nd Avenue, New York, NY 10003","Restaurants","EVCC",,,,40.727112,-73.98836,"https://www.instagram.com/paradiselostnyc","Yes","Opened","5:00 PM","2:00 AM",,"Opened 10/13/2023 in former Haveli location.
","2023-10-13","2023-10-13",40.727112,-73.98836,,"Bar",,"{""id"":""usrSSqhKNrK05i823"",""email"":""Director@evccnyc.org"",""name"":""Laura Sewell""}","New York","2024-04-29T16:59:42.000Z","100","2nd Avenue","NY","10003",,,,,"N/A",,"https://www.paradiselost.nyc/",,,,,,,,"lost@paradiselost.nyc",,,,,,,,,,,,,
"recr0eJahiPwgziyo",2182,2182,,"Kobo by Nai","202 Avenue A, New York, NY 10009","Restaurants","EVCC",,,,40.596388,-73.976677,,"No","Closed","5:30 PM","9:30 PM","FRI & SAT: 5:30 PM - 10:30 PM
SUN & MON: Closed 
","PERMANENTLY CLOSED May 2024. Hours from website. Opened late fall 2022 in gut-renovated building (former Bright Audio location).
","2024-05-09","2022-12-01",40.72949,-73.98079,,"Mediterranean",,"{""id"":""usrSSqhKNrK05i823"",""email"":""Director@evccnyc.org"",""name"":""Laura Sewell""}","New York","2024-05-10T00:04:34.000Z","202","Avenue A","NY","10009","https://evgrieve.com/2024/05/kobo-by-nai-has-not-been-open-lately.html",,,,"(212) 677-1030",,"https://www.nairestaurant.com/kobo",true,,,,,,,"info@nairestaurant.com",,"2024-05-01",,,,,,,,,,,
"843",2181,2181,843,"Bad Hombre","29 2nd Avenue, New York, NY 10003","Restaurants","EVCC","29","2nd Avenue","10003",40.724695,-73.990877,"https://www.instagram.com/badhombrenyc/","Yes","Opened","5:30 PM","10:00 PM","Make a [reservation](https://resy.com/cities/ny/bad-hombre-ny?date=2024-03-29&seats=2)!
FRI & SAT: 5:30 PM - Late 
SUN & MON: Closed 	
","Hours from website. IG and website are current. New concept by Ruben Rodriguez opened January 2024 in former Amigo by Nai location.
","2024-03-25","2024-01-01",40.72464435,-73.99077809,"recbixhdFweW9PDtW","Mexican",,"{""id"":""usrSSqhKNrK05i823"",""email"":""Director@evccnyc.org"",""name"":""Laura Sewell""}","New York","2024-05-21T15:14:29.000Z","29","2nd Avenue","NY","10003","https://evgrieve.com/2024/02/closings-emilia-by-nai-on-1st-ave.html","What's Open Filled",,"
","(212) 677-1030",,"https://www.badhombrenyc.com/",true,"Yes",,,,,,"events@badhombrenyc.com",,,,,"


",,,,,,,,
"638",2180,2180,638,"Monkey Thrift & Upcycling Design","440 E. 9th Street, New York, NY 10009","Retail","EVCC","440","E. 9th Street","10009",40.72734,-73.98307,"https://www.instagram.com/monkeythriftnyc/","Yes","Opened","11:00 AM","8:00 PM","MON & TUE: 12:00 PM - 8:00 PM
","Opened November 2023 in former SneakEz location.
","2024-02-01","2023-11-01",40.72733236,-73.98310475,"rechEJSlud6Mh9j5b","Fashion,Vintage","Center","{""id"":""usrSSqhKNrK05i823"",""email"":""Director@evccnyc.org"",""name"":""Laura Sewell""}","New York","2024-04-08T20:15:23.000Z","440","E. 9th Street","NY","10009","https://www.nbcnewyork.com/entertainment/the-scene/new-york-live/upcycle-at-this-trendy-east-village-vintage-store/4940148/","What's Open Filled",,,"(917) 780-8967",,"https://www.monkeythriftnyc.com/",,,,,true,,,"creativemonkey440@gmail.com",,,,,,true,,,,,,,
"994",2179,2179,994,"Throwback Two","428 E. 9th Street, New York, NY 10009","Retail","EVCC","428","E. 9th Street","10009",40.72742,-73.98365,"https://www.instagram.com/throwbacktwo/","Yes","Opened","12:00 PM","8:00 PM","SUN: 12:00 PM - 6:00 PM
MON & TUE: Closed 
","IG and website are current. Hours from website. Soft opened 5/4/2024. Mr. Throwback expanding into original EV location (2012-2017) vacated by Tribes of Morocco spring 2024 as per 9a1 Block Association, non-sports related as per evgrieve.
","2024-05-09","2024-05-04",40.72751691,-73.98356915,"recbaTVUcOBneQJeC","Fashion,Vintage",,"{""id"":""usrSSqhKNrK05i823"",""email"":""Director@evccnyc.org"",""name"":""Laura Sewell""}","New York","2024-05-09T22:58:32.000Z","428","E. 9th Street","NY","10009","https://evgrieve.com/2024/05/spin-offs-throwback-two-debuts-on-9th.html","What's Open Filled",,,"(646) 833-7351",,"https://mrthrowback.com/",,,,,,,,,,,,,,,,,,,,,
"rec3RvpXDfBk8osUY",2178,2178,,"East Village Tattoo","207 E. 4th Street, New York, NY 10009","Services","SB",,,,40.723954,-73.983708,"https://www.instagram.com/eastvillagetattoo","Yes","Opened","1:00 PM","8:00 PM","FRI & SAT: 1:00 PM - 9:00 PM 
","IG is current. Hours from EV Grieve. Opened 3/16/2024.
","2024-03-13","2024-03-16",40.723954,-73.983708,,"Tattoo","West","{""id"":""usrSSqhKNrK05i823"",""email"":""Director@evccnyc.org"",""name"":""Laura Sewell""}","New York","2024-05-22T23:40:43.000Z","207","E. 4th Street","NY","10009","https://evgrieve.com/2024/03/east-village-tattoo-debuts-on-4th-street.html",,,,"(347) 616-7507",,,,,,,,,,,,,,,,,,,,,,,
"1461",2177,2177,1461,"iGirl","150 E. 3rd Street, New York, NY 10003","Retail","SB","150","E. 3rd Street","10003",40.72351,-73.9852,"https://www.instagram.com/igirl/","Yes","Opened","12:00 PM","7:00 PM","
","Opened 5/11/2024 in former East Village Buyers location.
","2024-05-09",,40.72346671,-73.98512737,"recitV6Tss83bVetg","Fashion",,"{""id"":""usrSSqhKNrK05i823"",""email"":""Director@evccnyc.org"",""name"":""Laura Sewell""}","New York","2024-05-14T19:58:32.000Z","150","E. 3rd Street","NY","10003","https://evgrieve.com/2024/05/bella-mcfaddens-igirl-storefront-opens.html","What's Open Filled",,,,,"https://igirlworld.com/",,,,,,,,"support@igirlworld.com",,,,true,,,,,,,,,
"879",2176,2176,879,"No More Cafe","352 E. 13th Street, New York, NY 10003","Restaurants","EVCC","352","E. 13th Street","10003",40.730679,-73.983704,"https://www.instagram.com/nomore_cafe","Yes","Opened","11:00 AM","11:00 PM","MON: Closed 
","Hours from website. Soft opened 4/20/2024 in former Tease Salon location (after relocated to Ming's Tease).
","2024-04-23","2024-04-20",40.73075606,-73.98360099,"reczU8PFX9coxo4xF","Non-Alcoholic",,"{""id"":""usrSSqhKNrK05i823"",""email"":""Director@evccnyc.org"",""name"":""Laura Sewell""}","New York","2024-04-23T16:17:58.000Z","352","E. 13th Street","NY","10003","https://www.instagram.com/p/C59CgocOeCb/","What's Open Filled",,,"N/A",,"https://nomorecafe.com/",true,,,,,,,"nogueira@nomorecafe.com",,,,,,,,,,,,,
"2058",2175,2175,2058,"Art Gotham","4 St. Mark's Place, New York, NY 10003","Arts & Culture","SB","4","St. Mark's Place","10003",40.713242,-73.967369,"https://www.instagram.com/artgotham/","Yes","Opened","11:00 AM","6:00 PM","MON: Closed
","Hours from website, IG is current. Opened 3/28/2024 in location briefly occupied by Lava Ground (previously Weed World Candies) in newly renovated building. 
","2024-08-07","2024-03-28",40.729367533495484,-73.98950420759826,"recbw8zgxoTcWqi7p","Gallery","2nd Floor","{""id"":""usrSSqhKNrK05i823"",""email"":""Director@evccnyc.org"",""name"":""Laura Sewell""}","New York","2024-08-07T16:25:28.000Z","4","St. Mark's Place","NY","10003","https://www.instagram.com/p/C5DrMubBh3f/",,,,"N/A",,"https://artgotham.com/",,,,,,,,,,,,true,,,,,,,,,
"1590",2174,2174,1590,"Spoils & Oils","63 Avenue D, New York, NY 10009","Retail","EVCC","63","Avenue D","10009",40.722152,-73.977442,,"Yes","Opened",,,,"Opened winter 2024 in former SuperVape licensed smoke shop location, no online info
","2024-03-20","2024-01-01",40.72213532,-73.97736088,"rec9zR3JhNpCEU9Ch","Smoke Shop","South","{""id"":""usrSSqhKNrK05i823"",""email"":""Director@evccnyc.org"",""name"":""Laura Sewell""}","New York","2024-07-29T20:26:25.000Z","63","Avenue D","NY","10009",,"What's Open Filled",,,"(212) 510-8056",,,,,,"Super Vape closed 2023.",,,,,,,,,,,,,,,,,
"reciLzqnlepRiVR15",2173,2173,,"Crystal Nail Salon","69 Avenue D, New York, NY 10009","Services","EVCC",,,,40.722298,-73.977395,,"Yes","Opened","10:00 AM","8:00 PM","SUN: 10:00 AM - Noon
MON: Closed
","Longstanding business. 
","2024-03-20",,40.722298,-73.977395,,"Nail Salon",,"{""id"":""usrSSqhKNrK05i823"",""email"":""Director@evccnyc.org"",""name"":""Laura Sewell""}","New York","2024-04-29T16:59:42.000Z","69","Avenue D","NY","10009",,,,,"(646) 719-1125",,,,,,,,,,,,,,,,,,,,,,,
"recOj1LpQK0FfUpvr",2172,2172,,"Magham Deli","67 Avenue D, New York, NY 10009","Groceries","EVCC",,,,40.722298,-73.977395,,"Yes",,,,,"Longstanding business, no online presence. Opened 2019 in former D-Stop Deli location. 
","2024-03-20",,40.722298,-73.977395,,"Deli",,"{""id"":""usrSSqhKNrK05i823"",""email"":""Director@evccnyc.org"",""name"":""Laura Sewell""}","New York","2024-04-29T16:59:42.000Z","67","Avenue D","NY","10009",,,,,"(646) 559-5882","Yes",,,,,,,,,,,,,,,,,,,,,,
"recHzq9rnGuHH9Nz8",2171,2171,,"H&R Block","355 E. 4th Street, New York, NY 10003","Services","EVCC",,,,40.721497,-73.978012,,"Yes","Opened","9:00 AM","7:00 PM","SUN: Noon - 4:00 PM 
","Entrance on Avenue D. Longstanding business (since at least 2007), not recorded in 2019 or 2021 survey.
","2024-03-20",,40.721497,-73.978012,,"Tax Prep",,"{""id"":""usrSSqhKNrK05i823"",""email"":""Director@evccnyc.org"",""name"":""Laura Sewell""}","New York","2024-04-29T16:59:42.000Z","355","E. 4th Street","NY","10003",,,true,,"(212) 673-9075",,"https://www.hrblock.com/tax-offices/?otppartnerid=9171&campaignid=ps_mcm_9171_7004_fy24_lob-gct_104_p01_a08_71700000089572403_58700007588933830_h+and+r+block+accountant&gad_source=1&gclid=CjwKCAjwkuqvBhAQEiwA65XxQOXoLr1jE4mf16lb9naTcvj5_E8FSTkwNzKoXCQrOPVyHUGJfkj_TBoCvIcQAvD_BwE&gclsrc=aw.ds",,,,,,,,,,,,,,,,"Yes",,,,,
"recg8Ga5mpyAH3rBn",2169,2169,,"J&M Deli ","33 Avenue D, New York, NY 10009","Groceries","EVCC",,,,40.721166,-73.978133,,"Yes","Opened",,,,"Opened 2023-4 in former longstanding Lamine Deli location. 
","2024-03-01",,40.721166,-73.978133,,"Deli","North","{""id"":""usrSSqhKNrK05i823"",""email"":""Director@evccnyc.org"",""name"":""Laura Sewell""}","New York","2024-06-24T20:20:22.000Z","33","Avenue D","NY","10009",,,,,"(212) 228-2180","Yes",,,,,,,,,,,,,,,,,,,,,,
"321",2168,2168,321,"Tom & Jerry's","403 E. 8th Street, New York, NY 10009","Groceries","EVCC","403","E. 8th Street","10009",40.723882,-73.976132,,"Yes","Opened","7:00 AM","1:00 AM",,"Google listing updated by business 1/24/2024. Opened winter 2024 in former M. E. S. Tropical location.
","2024-03-20","2024-01-01",40.723799198852475,-73.97626467880804,"recbFSVhLE2HQSgON","Deli",,"{""id"":""usrSSqhKNrK05i823"",""email"":""Director@evccnyc.org"",""name"":""Laura Sewell""}","New York","2024-03-28T00:18:15.000Z","403","E. 8th Street","NY","10009",,,,,"(646) 988-2580",,,,,,,,,,,,,,,,,,,,,,,
"1944",2166,2166,1944,"Daniel's Bike Shop","313 E. 14th Street, New York, NY 10003","Retail",,"313","E. 14th Street","10003",40.73233,-73.98412,,"Yes","Opened","10:00 AM","9:00 PM",,"Google says biz updated hours on 3/8/24. Opened 3/1/2024 in former The Tree Shop location. 
","2024-02-15","2024-03-01",40.73210895792491,-73.98434406429587,"recTbVrDpgqccUVrA","Bicycles",,"{""id"":""usrSSqhKNrK05i823"",""email"":""Director@evccnyc.org"",""name"":""Laura Sewell""}","New York","2024-03-28T00:18:15.000Z","313","E. 14th Street","NY","10003","https://evgrieve.com/2024/02/an-e-bike-shop-for-1st-street.html",,,,"(347) 883-0662",,,,,,,,,,,,,,,,,,,,,,,
"recfoc2g7tiudWUce",2165,2165,,"52V Primo E-Bike","44 E. 1st Street, New York, NY 10003","Retail","JK",,,,40.724013,-73.989787,,"Yes","Opened","10:00 AM","7:30 PM",,"Biz updated Google hours on 3/8/24. Opened February 2024 in West Store, not recorded in 2019 or 2021 survey.
","2024-02-26","2024-02-01",40.724013,-73.989787,,"E-Bikes","East","{""id"":""usrSSqhKNrK05i823"",""email"":""Director@evccnyc.org"",""name"":""Laura Sewell""}","New York","2024-07-29T17:53:02.000Z","44","E. 1st Street","NY","10003","https://evgrieve.com/2024/02/an-e-bike-shop-for-1st-street.html",,,,"(516) 666-6228",,,,,,,,,,,,,,,,,,,,,,,
"rec7pMofYy58LJivD",2164,2164,,"YGF Malatang","92 3rd Avenue, New York, NY 10003","Restaurants","EVCC",,,,40.732281,-73.988239,"https://www.instagram.com/ygfmalatangusa","Yes","Opened","11:30 AM","12:00 AM","SUN: 11:30 AM - 9:00 PM
No reservations!
","Google says biz updated hours on 3/15/24. Fifth US Store of large Asian CHAIN (does not meet NYS definition).  Opened 2/26/2024 in long-vacant location
","2024-07-16","2024-02-26",40.732281,-73.988239,,"Chinese","South","{""id"":""usrSSqhKNrK05i823"",""email"":""Director@evccnyc.org"",""name"":""Laura Sewell""}","New York","2024-07-16T18:23:03.000Z","92","3rd Avenue","NY","10003","https://evgrieve.com/2024/02/openings-ygf-malatang-on-3rd-avenue.html",,,,"(646) 860-8838",,,,,,,true,,,,,,,,,,,,,,,,
"1348",2162,2162,1348,"Okiboru House of Udon","124 2nd Avenue, New York, NY 10003","Restaurants","EVCC","124","2nd Avenue","10003",40.72813,-73.98756,"https://www.instagram.com/okiboru_udon/","Yes","Opened","4:00 PM","10:00 PM","MON: Closed
","Hours from IG post. Opened 3/19/2024 in former Mochinut location.	
","2024-04-27","2024-03-19",40.72818795,-73.987721,"recDboa4GUlqdTbbG","Japanese","South","{""id"":""usrSSqhKNrK05i823"",""email"":""Director@evccnyc.org"",""name"":""Laura Sewell""}","New York","2024-04-27T23:12:17.000Z","124","2nd Avenue","NY","10003","https://www.instagram.com/p/C4lds9UOINO/","What's Open Filled",,,,,,,,,,true,,,,,,,,,,,,,,,,
"1021",2161,2161,1021,"Headine Barbers","217 Avenue A, New York, NY 10009","Services","EVCC","217","Avenue A","10009",40.73007,-73.98078,,"Yes","Opened","9:00 AM","7:00 PM","SUN: 10:00 AM - 5:00 PM
MON: 10:00 AM -7:00 PM
","Boris rebranded Ben's December 2023 
",,"2023-12-01",40.73007907,-73.98077102,"recLEYpCbtPUJHl04","Hair","North","{""id"":""usrSSqhKNrK05i823"",""email"":""Director@evccnyc.org"",""name"":""Laura Sewell""}","New York","2024-03-28T00:18:15.000Z","217","Avenue A","NY","10009",,"What's Open Filled",,,"(212) 679-7250",,"https://headlinebarber.com/",,,,,,,,,,,,,,,,,,,,,
"849",2159,2159,849,"B Lounge","77 E. 7th Street, New York, NY 10003","Restaurants","EVCC","77","E. 7th Street","10003",40.72746,-73.9863,"https://www.instagram.com/bloungenyc/","Yes","Opened","4:00 PM","12:00 AM",,"Klimat rebranded summer 2022, informed CB 3 of SLA approval of DBA change December 2022, license effective 9/1/2023.
","2024-03-18","2023-09-01",40.72738151,-73.98634536,"rec3j34YwzSvmacUL","Bar,Gallery",,"{""id"":""usrSSqhKNrK05i823"",""email"":""Director@evccnyc.org"",""name"":""Laura Sewell""}","New York","2024-03-28T00:18:15.000Z","77","E. 7th Street","NY","10003",,"What's Open Filled",,,"(917) 214-0589",,"https://www.bloungenyc.com/",,"Yes",,,,"Yes",,,,,,,,,,,,,,,
"832",2158,2158,832,"Sweet Cake","215 1st Avenue, New York, NY 10003","Cafes and Desserts","EVCC","215","1st Avenue","10003",40.7307,-73.98347,"https://www.instagram.com/sweetcakenewyork/","Yes","Opened",,,,"Opened 6/16/2024 in former E.V.A.C location 
","2024-06-19","2024-06-16",40.73051683629556,-73.98318262897284,"rec1o7UBAdLBxMENL","Cafe,Gallery",,"{""id"":""usrSSqhKNrK05i823"",""email"":""Director@evccnyc.org"",""name"":""Laura Sewell""}","New York","2024-06-29T23:31:57.000Z","215","1st Avenue","NY","10003","https://www.instagram.com/p/C8SLryYgZld/",,,,,,,,"Yes",,,true,,,,,,,true,,,,,,,,,
"2045",2157,2157,2045,"Crispy Burger","137 1st Avenue, New York, NY 10003","Restaurants","EVCC","137","1st Avenue","10003",40.727953,-73.985337,"https://www.instagram.com/crispyburger_official/?hl=en","Yes","Opened","2:00 PM","1:00 AM","THU: 2:00 PM - 2:00 AM
FRI & SAT: 2:00 PM - 3:00 AM		
","Google says biz updated hours 4/5/2024. Soft opened 4/12/2024 in former Davey's Ice Cream location (briefly Dolly Llama) 
","2024-04-12","2024-04-12",40.72782175477323,-73.98513521425272,"recGV70420FFGkXEV","American","South","{""id"":""usrSSqhKNrK05i823"",""email"":""Director@evccnyc.org"",""name"":""Laura Sewell""}","New York","2024-04-12T18:41:52.000Z","137","1st Avenue","NY","10003","https://evgrieve.com/2024/04/openings-crispy-burger-on-1st-avenue.html",,,,"(646) 656-2023",,,,,,,,,,,,,,,,,,,,,,,
"recon5VDdf4WHgDxv",2156,2156,,"Storage Post","444 E. 10th Street, New York, NY 10009","Services",,,,,40.724944,-73.975871,,"Yes","Opened",,,,"CHAIN. Took over longstanding business Keepers Storage June 2022, kept Keepers staff.
","2024-03-18","2022-06-01",40.724944,-73.975871,,,,"{""id"":""usrSSqhKNrK05i823"",""email"":""Director@evccnyc.org"",""name"":""Laura Sewell""}","New York","2024-04-29T16:59:42.000Z","444","E. 10th Street","NY","10009",,,true,,,,,,,,,,,,,,,,,,,,,,,,,
"622",2155,2155,622,"Area 140 First","140 1st Avenue, New York, NY 10009","Restaurants","EVCC","140","1st Avenue","10009",40.727837,-73.984873,"https://www.instagram.com/area140first/","Yes","Opened","12:00 PM","4:00 AM","SAT & SUN: 1:00 PM - 4:00 AM
","Soft-opened December 2023 by silent partner of The Hard Swallow. 
","2024-01-11","2023-12-01",40.72783519,-73.98489091,"recEiNUhq6rhEyXSp","Bar",,"{""id"":""usrSSqhKNrK05i823"",""email"":""Director@evccnyc.org"",""name"":""Laura Sewell""}","New York","2024-03-28T00:18:15.000Z","140","1st Avenue","NY","10009","https://evgrieve.com/2024/01/a-look-at-area-140-first-on-1st-avenue.html?fbclid=IwAR3qNhWEOWYYfFglv1XVr6-D4XQO7S0WOVp-AJCnUy1KUYMBiYDhn3fsRDY","What's Open Filled",,,"(212) 256-0124",,"https://www.area140first.com/",,"Yes",,,,,,,,,,,,,,,,,,,
"1700",2154,2154,1700,"Dear Rufino Taqueria","221 2nd Avenue, New York, NY 10009","Restaurants","EVCC","221","2nd Avenue","10009",40.73214,-73.98545,"https://www.instagram.com/dearrufinotaquerianyc/","No","Closed",,,,"PERMANENTLY CLOSED May 2024. Opened briefly spring 2024 in former Chicken and the Egg location.
","2024-02-15","2024-03-01",40.73206309,-73.98536149,"rec1MFr8YuEkxUzUi","Mexican","Front","{""id"":""usrSSqhKNrK05i823"",""email"":""Director@evccnyc.org"",""name"":""Laura Sewell""}","New York","2024-05-30T19:54:26.000Z","221","2nd Avenue","NY","10009","https://evgrieve.com/2024/05/dear-rufino-has-apparently-moved-on.html","What's Open Filled",,,,,,,,,,,,,,,"2024-05-31",,,,,,,,,,,
"1921",2153,2153,1921,"Nan Xiang Xiao Long Bao","15 St. Mark's Place, New York, NY 10003","Restaurants","OB","15","St. Mark's Place","10003",40.667358,-73.696243,,"Yes","Opened","11:00 AM","2:00 AM",,"Growing local CHAIN (does not meet NYS definition). Hours from website. Opened 3/12/2024 in former BT Boxed To-Go location. 
","2024-08-07","2024-03-12",40.72923703,-73.98892187,"recPfOfh7Gyo4DjBZ","Chinese",,"{""id"":""usrSSqhKNrK05i823"",""email"":""Director@evccnyc.org"",""name"":""Laura Sewell""}","New York","2024-08-07T17:40:06.000Z","15","St. Mark's Place","NY","10003","https://evgrieve.com/2024/03/openings-nan-xiang-xiao-long-bao-on-st.html","What's Open Filled",,,"(212) 970-8788",,"https://nanxiangxiaolongbao.com/",,,,,true,,,,,,,,,,,,,,,,
"271",2151,2151,271,"Not As Bitter","241 E. 10th Street, New York, NY 10003","Cafes and Desserts","JK","241","E. 10th Street","10003",40.729016,-73.984674,"https://www.instagram.com/notasbitter/","Yes","Opened","8:00 AM","6:00 PM",,"Hours from website. IG is current. Opened 3/12/2024 in former Snowdays Shavery location.
","2024-03-12","2024-03-12",40.72900764,-73.98469755,"recoLSzEqu08coTMQ","Cafe","East","{""id"":""usrSSqhKNrK05i823"",""email"":""Director@evccnyc.org"",""name"":""Laura Sewell""}","New York","2024-05-30T20:12:47.000Z","241","E. 10th Street","NY","10003","https://evgrieve.com/2024/03/openings-not-as-bitter-brings-fresh.html","What's Open Filled",,,"(646) 939-3129",,"https://www.notasbitter.com/",,,,,,,,"hello@notasbitter.com",,,,,,,,,,,,,
"rec6NOjwGsriWxfBl",2150,2150,,"G's Cheesesteaks","6 Avenue B, New York, NY 10009","Restaurants","TN",,,,40.721729,-73.98386,,"Yes","Opened","10:00 AM","11:00 PM","
","FILL. Check back for extended hours and website. Soft Opened 7/22/24 in recently renovated long vacant building. Local chain with 5 stores, does not fit NYS CHAIN definition. 
","2024-07-22","2024-07-22",40.721729,-73.98386,,"American",,"{""id"":""usrSSqhKNrK05i823"",""email"":""Director@evccnyc.org"",""name"":""Laura Sewell""}","New York","2024-07-22T16:39:04.000Z","6","Avenue B","NY","10009","https://evgrieve.com/2024/07/openings-gs-cheesesteaks-on-houston-and.html",,,,"(646) 386-7915",,"https://gscheesesteaks.com/",,,,,,,,,,,,,,,,,,,,,
"239",2149,2149,239,"Pak Punjab Deli","50 2nd Avenue, New York, NY 10003","Groceries","EVCC","50","2nd Avenue","10003",40.725364,-73.989744,,"Yes","Opened","12:00 AM","12:00 AM","Open 24/7!
","Longstanding business
","2024-07-26",,40.72539958,-73.98978463,"recsLGoNuajcK36O1","Deli,Smoke Shop","North","{""id"":""usrSSqhKNrK05i823"",""email"":""Director@evccnyc.org"",""name"":""Laura Sewell""}","New York","2024-07-31T04:49:32.000Z","50","2nd Avenue","NY","10003","https://evgrieve.com/2022/07/shopping-pp-strip-on-2nd-avenue.html","What's Open Filled",,,"(212) 614-0107",,,,,,"Longstanding business",,,,,,,,,,,,,,,,,
"759",2148,2148,759,"Tribes of Morocco","346 E. 9th Street, New York, NY 10003","Retail","EVCC","346","E. 9th Street","10003",40.72827,-73.98561,"https://www.instagram.com/tribesofmorocco/?hl=en","Yes","Opened","12:00 PM","8:30 PM","
"," IG is current. Hours updated by phone 3/22/2024. RELOCATED from E. 9th Street March 2024.
","2024-07-26","2024-03-01",40.72836943,-73.98555318,"rece5B5Ek8G1v1Ved","Gifts & Home","West","{""id"":""usrSSqhKNrK05i823"",""email"":""Director@evccnyc.org"",""name"":""Laura Sewell""}","New York","2024-07-26T18:55:02.000Z","346","E. 9th Street","NY","10003","https://evgrieve.com/2022/10/village-grannies-is-closing-on-9th.html","What's Open Filled",,,"(347) 415-3834",,,,,,,,,,,,,,,,,,,,,,,
"905",2146,2146,905,"Nosh Up","24 St. Mark's Place, New York, NY 10003","Groceries",,"24","St. Mark's Place","10003",40.728913,-73.988751,,,"Unknown","12:00 PM","10:00 PM",,"Opening soon in former Ben & Jerrys, Pink Berry & Caffe Bene), briefly occupied by Jewels (after pandemic relocation from 32)
","2024-03-05",,40.72891383,-73.98873624,"recipH7xLOO6rNVsI","Deli",,"{""id"":""usrSSqhKNrK05i823"",""email"":""Director@evccnyc.org"",""name"":""Laura Sewell""}","New York","2024-03-28T00:18:15.000Z","24","St. Mark's Place","NY","10003","https://evgrieve.com/2024/03/signage-alert-nosh-up-on-st-marks-place.html","What's Open Filled",,,,,,,,,,,,,,,,,,,,,,,,,,
"1851",2145,2145,1851,"55 Express Tailor","246 E. 4th Street, New York, NY 10009","Services","JK","246","E. 4th Street","10009",40.72311,-73.98235,,"Yes","Opened","9:00 AM","7:00 PM","Tailoring while you wait! (cash only)
","Hours from article in source column. Opened fall 2023 in former Gern en Regalia location.
","2023-11-30","2023-10-01",40.72308283,-73.98232155,"recP2d7K6MOXyRntZ","Tailor,Cleaners",,"{""id"":""usrSSqhKNrK05i823"",""email"":""Director@evccnyc.org"",""name"":""Laura Sewell""}","New York","2024-03-28T00:18:15.000Z","246","E. 4th Street","NY","10009","https://evgrieve.com/2023/12/a-look-at-new-home-of-55-express-tailor.html","What's Open Filled",,,"(212) 228-8909",,,,,,,,,,"rafaelexpresstailor@gmail.com",,,,,,,,,,,,,
"231",2143,2143,231,"Apollo Bagels","242 E. 10th Street, New York, NY 10003","Cafes and Desserts","JK","242","E. 10th Street","10003",40.728761,-73.984796,"https://www.instagram.com/apollobagels/","Yes","Opened",,,"FRI - SUN; 8:00 AM - 2:00 PM or until sold out
","Hours from IG. Opened 3/1/2024 in former Pink's location.
","2024-03-01","2024-03-01",40.72880592,-73.98475318,"rec3cNbnbkmv6wtXK","Deli,Bakery",,"{""id"":""usrSSqhKNrK05i823"",""email"":""Director@evccnyc.org"",""name"":""Laura Sewell""}","New York","2024-03-28T00:18:15.000Z","242","E. 10th Street","NY","10003","https://evgrieve.com/2024/03/apollo-bagels-opens-today.html","What's Open Filled",,,,,,,"No",,,,"Yes",,,,,,,,,,,,,,,
"recK8UV8RsptkcdiA",2142,2142,,"Populares ","51 Avenue B, New York, NY 10009","Restaurants","JK",,,,40.723047,-73.982442,"https://www.instagram.com/popularesny/?hl=en","Yes","Opened","4:00 PM","12:30 AM","FRI: 4:00 PM - 1:00 AM
SAT: 11:00 PM - 1:00 AM
SUN: 11:00 AM - 11:00 AM
","Hours from website, IG is current. Opened February 2024 in long vacant location.
","2024-03-01","2024-02-01",40.723047,-73.982442,,"Mexican",,"{""id"":""usrSSqhKNrK05i823"",""email"":""Director@evccnyc.org"",""name"":""Laura Sewell""}","New York","2024-04-29T16:59:42.000Z","51","Avenue B","NY","10009","https://www.instagram.com/p/C3N4es4vaDX/?hl=en",,,," (212) 777-3912",,"https://www.popularesny.com/",,,,,,,,,,,,,,,,,,,,,
"1723",2140,2140,1723,"Terminal B Mart","21 Avenue B, New York, NY 10009","Groceries","EVCC","23","Avenue B","10009",40.72218,-73.98319,"https://www.instagram.com/terminalbmart/","Yes","Opened","9:00 AM","9:00 PM",,"Hours from evgrieve article. Soft opened 3/21/2024.
","2024-03-21","2024-03-21",40.72221396251049,-73.98328934610372,,"Asian","North","{""id"":""usrSSqhKNrK05i823"",""email"":""Director@evccnyc.org"",""name"":""Laura Sewell""}","New York","2024-06-24T20:51:15.000Z","21","Avenue B","NY","10009","https://evgrieve.com/2024/03/openings-terminal-b-on-avenue-b.html",,,,"N/A",,"https://www.terminalbmart.com/",,,,,true,,,,,,,,,,,,,,,,
"1724",2139,2139,1724,"Grab & Go Convenience NY","23 Avenue B, New York, NY 10009","Retail","EVCC","23","Avenue B","10009",40.72218,-73.98319,,"No","Closed",,,,"PERMANENTLY CLOSED, multi-agency raid 5/20/2024. Opened December 2023 in former Cafe on Deck location.
","2024-05-20","2023-12-01",40.72226610767526,-73.98325325645892,"recr7rn6EOMbV2tAs","Smoke Shop","South","{""id"":""usrSSqhKNrK05i823"",""email"":""Director@evccnyc.org"",""name"":""Laura Sewell""}","New York","2024-07-29T20:21:35.000Z","23","Avenue B","NY","10009","https://evgrieve.com/2024/05/busted-shuttered-at-grab-go-on-avenue-b.html",,,,,,,,,true,"Cafe on Deck cannabis related business in newly constructed storefront closed April 2022.",,,,,,"2024-05-20",,,,,,,,,,,
"1511",2138,2138,1511,"Greenline Smoke Shop","42 Avenue B, New York, NY 10009","Retail","JK","42","Avenue B","10009",40.72297,-73.98304,,"Yes","Opened",,,,"Operating with gate down July 2024. Opened late fall 2023 in former The Main Event location. No online info.
","2024-07-26","2023-12-01",40.72294112,-73.98290304,"recPPMbOwVWQjTcug","CBD","North","{""id"":""usrSSqhKNrK05i823"",""email"":""Director@evccnyc.org"",""name"":""Laura Sewell""}","New York","2024-07-31T18:32:47.000Z","42","Avenue B","NY","10009","https://traded.co/deals/new-york/retail/lease/42-avenue-b/","What's Open Filled",,,,,,,,true,"The Main Event cannabis-friendly ""gallery"" closed December 2022, previously Stage Salon closed 2020",,,,,,,,,,,,,,,,,
"982",2137,2137,982,"High Demand Social Club","516 E. 11th Street, New York, NY 10009","Services","EVCC","516","E. 11th Street","10009",40.72789,-73.98107,"https://www.instagram.com/highdemandsocialclub/","Yes","Opened","12:00 PM","8:00 PM","Members Only!
","Hours from website. Members only barber lounge opened January 2023 in former Come Back Daily location. 
","2024-07-26","2024-01-01",40.72799504,-73.98098959,"recoKSMJl6QQEJp3R","Hair,Cannabis",,"{""id"":""usrSSqhKNrK05i823"",""email"":""Director@evccnyc.org"",""name"":""Laura Sewell""}","New York","2024-07-29T20:42:20.000Z","516","E. 11th Street","NY","10009",,"What's Open Filled",,,"(631) 810-9343",,"https://highdemandsocialclub.com/",,,,"Come Back Daily closed September 2023.",,,,"Highdemandmembersonly516@gmail.com",,,,,,,,,true,,,,
"273",2135,2135,273,"Pearl & the Beast","380 E. 10th Street, New York, NY 10009","Retail","JK","380","E. 10th Street","10009",40.72605,-73.97851,"https://www.instagram.com/pearlandthebeastnyc/","No","Closed","12:00 PM","8:00 PM",,"PERMANENTLY CLOSED, moving to SoHo. Observed for rent sign 5/30/2024. Opened September 2023 in former Soma Cakes location.
","2024-04-01","2023-09-01",40.72611781,-73.97843584,"recbfoVzjAd7levhY","Jewelry","West","{""id"":""usrSSqhKNrK05i823"",""email"":""Director@evccnyc.org"",""name"":""Laura Sewell""}","New York","2024-06-08T00:23:41.000Z","380","E. 10th Street","NY","10009",,"What's Open Filled",,,"(929) 640-8119",,"https://pearlandthebeast.com/",,,,,,,,"pearlandthebeast@gmail.com",,"2024-05-01",,,,,,,,,,,
"617",2134,2134,617,"The Lions Bar & Grill","132 1st Avenue, New York, NY 10009","Restaurants","EVCC","132","1st Avenue","10009",40.727409,-73.985137,"https://www.instagram.com/thelionsbarnyc/","Yes","Opened","5:00 PM","1:00 AM","SUN & MON: 5:00 PM - 12:00 AM
","Opened March 2024 in former Bar Lula location (rebrand).		
","2024-02-09","2024-03-01",40.72749515652458,-73.98535176350751,"reczDgaicwmSDcOpk","Bar,American",,"{""id"":""usrSSqhKNrK05i823"",""email"":""Director@evccnyc.org"",""name"":""Laura Sewell""}","New York","2024-03-28T00:18:15.000Z","132","1st Avenue","NY","10009","https://evgrieve.com/2024/02/lions-for-lula-at-132-st-1st-ave.html?m=1",,,,,,"https://www.thelionsbar.com/",,"Yes",,,,"Yes (Heated)",,,,,,,,,,,,,,,
"rec2zKBLKZZsQZQsA",2133,2133,,"Neighborhood Barbers","439 E. 9th Street, New York, NY 10009","Services","EVCC",,,,40.727608,-73.98308,"https://www.instagram.com/neighborhoodbarbers/?hl=en","Yes","Opened","8:00 AM","8:00 PM","SUN: 10:00 AM - 7:00 PM
","Hours from website. Longstanding Business
","2023-11-30",,40.727608,-73.98308,,"Hair","West","{""id"":""usrSSqhKNrK05i823"",""email"":""Director@evccnyc.org"",""name"":""Laura Sewell""}","New York","2024-04-29T16:59:42.000Z","439","E. 9th Street","NY","10009",,,,," (212) 777-0798",,"https://neighborhoodbarbers.com/",,,,,,,,,,,,,,,,,,,,,
"recZ2iLvIg08YZext",2132,2132,,"VACANT","238 E. 14th Street, New York, NY 10003",,,,,,40.732428,-73.985764,,,"Unknown",,,,"VACANT. Received email solicitation for ""330"" 2/15/2024. Former (expanded) Artichoke Pizza location. 
",,,40.732428,-73.985764,,,"Center","{""id"":""usrSSqhKNrK05i823"",""email"":""Director@evccnyc.org"",""name"":""Laura Sewell""}","New York","2024-04-29T16:59:42.000Z","238","E. 14th Street","NY","10003",,,,,,,,,,,,,,,,,,,,,,,,,,,,
"recv7Lmf9Bns1rgqR",2131,2131,,"Archie's Press","220 E. 10th Street, New York, NY 10003","Retail","JK",,,,40.729135,-73.985789,"https://www.instagram.com/archiespress/","Yes","Opened","12:00 PM","6:00 PM","Weekends only for now!
","Opened 2/3/24 in former private art studio space in co-op building.
","2024-02-03","2024-02-03",40.729135,-73.985789,,"Gifts & Home,Gallery","West","{""id"":""usrSSqhKNrK05i823"",""email"":""Director@evccnyc.org"",""name"":""Laura Sewell""}","New York","2024-04-29T16:59:42.000Z","220","E. 10th Street","NY","10003","https://www.instagram.com/p/C25hlhNvLjk/?img_index=1",,,,"N/A",,"https://archiespress.com/",,,,,,,,,,,,,,,,,,,,,
"1297",2127,2127,1297,"H&R Block","310 E. Houston Street, New York, NY 10002","Services","JK","310","E. Houston Street","10002",40.72152,-73.98321,,"Yes","Opened","9:00 AM","7:00 PM","TUE & THU: 9:00 AM - 8:00 PM
SAT: 9:00 AM - 5:00 PM
SUN: 12:00 PM - 4:00 PM
","CHAIN. Hours from website. Relocated from 250 E. Houston in part of former Banco Popular location (corner remains vacant?) by July 2022.
","2023-11-30","2022-01-01",40.72151,-73.98322,"recSA2utpFNoP4oGA","Tax Prep",,"{""id"":""usrSSqhKNrK05i823"",""email"":""Director@evccnyc.org"",""name"":""Laura Sewell""}","New York","2024-03-28T00:18:15.000Z","310","E. Houston Street","NY","10002",,"What's Open Filled",true,," (212) 253-2569",,"https://www.hrblock.com/local-tax-offices/new-york/new-york/310-e-houston/30229/?otppartnerid=9308&campaignid=pw_mcm_9308_9762&utm_medium=local",,,,,,,,,,,,,,,,,,,,,
"2143",2126,2126,2143,"Chick-N-Smash","231 1st Avenue, New York, NY 10003","Restaurants","SB","231","1st Avenue","10003",40.731147,-73.983024,"https://www.instagram.com/chicknsmash231/","Yes","Opened","11:00 AM","11:00 PM",,"Opened December 2023 in former Deli Convenience / Dispensary / Deli Convenience location (briefly Tony's famous, former long time Vinny Vincenz location)
","2023-12-16","2023-12-01",40.73108493870012,-73.98276394200298,"recfpLCuBBSSDL4w9","American,Sandwich,Halal",,"{""id"":""usrSSqhKNrK05i823"",""email"":""Director@evccnyc.org"",""name"":""Laura Sewell""}","New York","2024-03-28T00:18:15.000Z","231","1st Avenue","NY","10003","https://evgrieve.com/2023/12/openings-chick-n-smash-on-1st-avenue.html",,,,"(646) 398-7018",,,,,,,,,,,,,,,,,,,,,,,
"recOILTvQPVdSQq1R",2124,2124,,"Hen House ","120 1st Avenue, New York, NY 10009","Restaurants","JK",,,,40.727025,-73.985417,"https://www.instagram.com/henhousenyc/?hl=en","Yes","Opened","12:00 PM","10:00 PM","FRI & SAT: 12:00 PM - 1:00 AM 
SUN: 12:00 PM - 8:00 PM MON: Closed
","Biz updated hours on Google 2/1/24. Opened December 2023 in former Raiz location.
","2023-12-01","2023-12-01",40.727025,-73.985417,,"Middle Eastern",,"{""id"":""usrSSqhKNrK05i823"",""email"":""Director@evccnyc.org"",""name"":""Laura Sewell""}","New York","2024-04-29T16:59:42.000Z","120","1st Avenue","NY","10009",,,,," (646) 360-4833",,,,,,,true,,,,,,,,,,,,,,,,
"recZo1eu88mXnu2kG",2123,2123,,"Serenity Spa","33 1st Avenue, New York, NY 10003","Health",,,,,40.724151,-73.988153,,"No","Closed",,,,"PERMANENTLY CLOSED. Entrance on E. 2nd Street. Still operating as of March 2023. demo permit filed 07/20/23
","2023-07-20",,40.724151,-73.988153,,"Natural & Alternative",,"{""id"":""usrSSqhKNrK05i823"",""email"":""Director@evccnyc.org"",""name"":""Laura Sewell""}","New York","2024-04-29T16:59:42.000Z","33","1st Avenue","NY","10003","https://evgrieve.com/2023/03/serenity-spa-remains-open-on-corner.html",,,,"(212) 777-3283",,,,,,,,,,,,"2023-07-31",,,,,,,,,,,
"recZ0gB3UIBUyWa3J",2122,2122,,"Oasis Cafe","198 Avenue A, New York, NY 10009","Cafes and Desserts","EVCC",,,,40.729214,-73.980927,"https://www.instagram.com/oasiscafenyc/?hl=en","Yes","Opened","7:30 AM","12:00 AM","FRI & SAT: 7:30 AM - 1:00 AM
","Small local chain (does not meet NYS chain definition). Soft-opened 6/2024 in former Auriga Cafe location (never got off the ground in 2020).
","2024-06-29","2024-06-30",40.729214,-73.980927,,"Cafe,Bakery",,"{""id"":""usrSSqhKNrK05i823"",""email"":""Director@evccnyc.org"",""name"":""Laura Sewell""}","New York","2024-06-29T23:31:23.000Z","198","Avenue A","NY","10009","https://evgrieve.com/2024/06/3-new-bakeries-cafes-have-opened-in.html",,,,,,"https://theoasiscafe.com/pages/locations",,"Yes",,,,,,,,,,,,,,"Yes",,,,,
"recxtGPS0Sd7fhuj3",2121,2121,,"Spice Brothers","110 St. Mark's Place, New York, NY 10009","Restaurants","EVCC",,,,,,"https://www.instagram.com/spicebrothersny/","Yes","Opened","12:00 PM","10:00 PM","MON: Closed
","Website and IG are current. Opened September 2023 in former Isabella location. 
","2023-09-27","2023-09-01",40.72705054,-73.98426629,,"Middle Eastern",,"{""id"":""usrSSqhKNrK05i823"",""email"":""Director@evccnyc.org"",""name"":""Laura Sewell""}","New York","2024-03-28T00:18:15.000Z","110","St. Mark's Place","NY","10009","https://evgrieve.com/2023/09/openings-spice-brothers-on-st-marks.html",,,,"N/A",,"https://spicebrothersny.com/",,,,,,,,"info@spicebrothersny.com",,,,,,,,,,,,,
"recWmuFxgV8KeUzQR",2120,2120,,"Tina's Cuban Cuisine","238 E. 14th Street, New York, NY 10003","Restaurants","SB",,,,,,"https://www.instagram.com/tinascubannyc/","Yes","Opened","11:00 AM","8:00 PM","SAT & SUN: Closed 
","Hours from website. Opened January 2024 in former Bagel Market/Boss location. IG is for all locations.
","2024-01-17","2024-01-17",40.7325213,-73.98575939,,"Cuban",,"{""id"":""usrSSqhKNrK05i823"",""email"":""Director@evccnyc.org"",""name"":""Laura Sewell""}","New York","2024-03-29T18:18:27.000Z","238","E. 14th Street","NY","10003","https://evgrieve.com/2024/01/openings-tinas-cuban-cuisine-on-14th.html",,,,"(646) 692-3414",,"https://tinascubancuisine.com/",,,,,,,,,,,,,,,,,,,,,
"recvqgWXFw3Sur5YV",2119,2119,,"Twigs Hair Salon","212 Avenue B, New York, NY 10009","Services","EVCC",,,,40.728695,-73.978822,"https://www.instagram.com/twigs_salon_nyc/","Yes","Opened",,,,"Opened 10/01/2023 in long-vacant former H&R Block seasonal location.
","2023-10-01",,40.728695,-73.978822,,"Hair",,"{""id"":""usrSSqhKNrK05i823"",""email"":""Director@evccnyc.org"",""name"":""Laura Sewell""}","New York","2024-04-29T16:59:42.000Z","212","Avenue B","NY","10009","https://www.instagram.com/p/Cxzcg2Qse3p/",,,,,,"http://www.twigsalon.com",,,,,,,,,,,,true,,,,,,,,,
"recVaxwMgdvgbQd3e",2118,2118,,"I-Convenience / Starlight ","110 3rd Avenue, New York, NY 10003","Groceries","JK",,,,40.732941,-73.987808,,"Yes","Opened","9:00 AM","2:00 AM",,"Hours as per sign on window 5/12/2024. I-Convenience rebranded Starlight Convenience 3/13/2024. (Observed papered over with aka 108 3rd Avenue on door). Has food. 
Google observed I-Convenience opened June 2022. No online presence. Smoke accessories.
","2024-05-12","2022-01-01",40.732941,-73.987808,,"Deli","South","{""id"":""usrSSqhKNrK05i823"",""email"":""Director@evccnyc.org"",""name"":""Laura Sewell""}","New York","2024-05-13T20:11:37.000Z","110","3rd Avenue","NY","10003",,,,,,,,,,,,,,,,,,,,,,,,,,,,
"recus7Q6RR6f87iQL",2117,2117,,"Eighths","240 E. 4th Street, New York, NY 10009","Restaurants","EVCC",,,,40.723237,-73.982831,"https://www.instagram.com/eighthspizza/",,"Unknown",,,,"Opening soon in long-vacant Johnny Favorite's pizza location (Stoned Pizza slice joint), pick-up available at Stoned Pizza
","2024-07-25",,40.723237,-73.982831,,"Pizza,Cannabis","West","{""id"":""usrSSqhKNrK05i823"",""email"":""Director@evccnyc.org"",""name"":""Laura Sewell""}","New York","2024-07-31T05:06:37.000Z","240","E. 4th Street","NY","10009",,,,,,,"https://thepizzapusha.com/eighths-pizza/",,,true,"VACANT. Previously Johnny's Favorite Slice location.",,,,,,,,,,,,,,,,,
"recUaTHJEBAv5QQOu",2116,2116,,"Five Guys","188 2nd Avenue, New York, NY 10009","Restaurants","EVCC",,,,40.730769,-73.985698,,,"Unknown",,,,"Opening soon in former Strings Ramen, latest in series of failed asian restaurants after Shima was booted in 2014).
","2023-12-07",,40.730769,-73.985698,,"American",,"{""id"":""usrSSqhKNrK05i823"",""email"":""Director@evccnyc.org"",""name"":""Laura Sewell""}","New York","2024-04-29T16:59:42.000Z","188","2nd Avenue","NY","10009",,,true,,,,,,,,,,,,,,,,,,,,,,,,,
"recswjwWH8vsVzH3o",2115,2115,,"Cafe Chrystie NYC","184 E. 7th Street, New York, NY 10009","Cafes and Desserts",,,,,,,"https://www.instagram.com/cafe.chrystie/","Yes","Opened","8:00 AM","6:00 PM",,"IG and website are current. Opened August 2023 in former Ed Varie location.
","2024-01-03","2023-08-01",40.72488931,-73.98102977,,"Cafe,Fashion,Gifts & Home,Gallery",,"{""id"":""usrSSqhKNrK05i823"",""email"":""Director@evccnyc.org"",""name"":""Laura Sewell""}","New York","2024-04-08T20:16:24.000Z","184","E. 7th Street","NY","10009","https://evgrieve.com/2023/08/openings-cafe-chrystie-and-chrystie-nyc.html",,,,,,"https://shop.chrystienyc.com/collections/cafe-chrystie-1",,,,,true,,,,,,,,,,,,,,,,
"recsf4aSTVAmeSoM0",2114,2114,,"Bank of America","72 2nd Avenue, New York, NY 10003","Services","JK",,,,40.726153,-73.989036,,"Yes","Opened","10:00 AM","4:00 PM","SAT & SUN: Closed
","Branch closing 3/8/2024, relocating to 119 2nd Avenue.
","2023-11-20",,40.726153,-73.989036,,"Bank",,"{""id"":""usrSSqhKNrK05i823"",""email"":""Director@evccnyc.org"",""name"":""Laura Sewell""}","New York","2024-04-29T16:59:42.000Z","72","2nd Avenue","NY","10003","https://evgrieve.com/2023/11/in-2024-bank-of-america-will-be-moving.html",,true,," (212) 505-9242",,"https://locators.bankofamerica.com/ny/newyork/financial-centers-new-york-15230.html?utm_source=GMBlisting&utm_medium=organic",,,,,,,,,,"2024-03-08",,,,,,,,,,,
"recRQSM0FzwUGZzCJ",2113,2113,,"Downtime","25 Avenue B, New York, NY 10009","Restaurants","SB",,,,40.722242,-73.983019,"https://www.instagram.com/downtimenyc/","Yes","Opened",,,"THU: 9:00 PM - 2:00 AM
FRI & SAT: 11:00 PM - 4:00 AM
","Hours from website. Longstanding weekends only club underneath Eastpoint. 
","2023-11-21",,40.722242,-73.983019,,"Bar","Basement","{""id"":""usrSSqhKNrK05i823"",""email"":""Director@evccnyc.org"",""name"":""Laura Sewell""}","New York","2024-04-29T16:59:42.000Z","25","Avenue B","NY","10009",,,,," (646) 882-0593",,"https://www.downtimebarnyc.com/",,,,,,,,"rsvp@downtimebarnyc.com",,,,,,,,,,,,,
"recqBNSwcHjSsJEu0",2111,2111,,"Bank of America","110 3rd Avenue, New York, NY 10003","Services","JK",,,,40.732941,-73.987808,,"Yes","Opened",,,,"FILL. 
",,,40.732941,-73.987808,,"Bank","North","{""id"":""usrSSqhKNrK05i823"",""email"":""Director@evccnyc.org"",""name"":""Laura Sewell""}","New York","2024-08-06T22:31:08.000Z","110","3rd Avenue","NY","10003",,,true,,"(844) 401-8500",,,,,,,,,,,,,,,,,,,,,,,
"recqa0V3P8jtwt0Cd",2110,2110,,"Village Craft Beer & Smoke","136 1st Avenue, New York, NY 10009","Retail","JK",,,,40.727679,-73.985005,,"Yes","Opened","9:00 AM","2:00 AM","THU: 9:00 AM - 3:00 AM FRI & SAT: 9:00 AM - 4:00 AM
","Laura accepted hours from Google. Longstanding business.
","2024-07-25",,40.727679,-73.985005,,"Smoke Shop",,"{""id"":""usrSSqhKNrK05i823"",""email"":""Director@evccnyc.org"",""name"":""Laura Sewell""}","New York","2024-07-25T21:08:13.000Z","136","1st Avenue","NY","10009",,,,,"(646) 590-3744",,,,,,,,,,,,,,,,,,,,,,,
"recohLTWweS2nqrqD",2109,2109,,"Nine Cases","86 E. 3rd Street, New York, NY 10003","Restaurants","SB",,,,40.724677,-73.988205,"https://www.instagram.com/ninecasesnyc/","Yes","Opened","5:00 PM","12:00 AM","Walk in only! 
MON: Closed
","Opened 
","2023-11-28","2023-08-01",40.724677,-73.988205,,"American,Wine","West","{""id"":""usrSSqhKNrK05i823"",""email"":""Director@evccnyc.org"",""name"":""Laura Sewell""}","New York","2024-04-29T16:59:42.000Z","86","E. 3rd Street","NY","10003","https://www.instagram.com/p/CvgKXLxPvis/",,,,"(917) 232-9395",,"https://www.ninecasesnyc.com/",,"Yes",,,,,," ninecasesnyc@gmail.com ",,,,,,,,,,,,,
"recl4LTh4acIQF7AK",2108,2108,,"Sunday Dreamin","80 2nd Avenue, New York, NY 10003","Restaurants","EVCC",,,,40.726389,-73.988916,"https://www.instagram.com/sunday.dreamin/","Yes","Opened","11:00 AM","10:00 PM","MON: Closed
","Opened 5/16/2024 in former Cacio e Vino location. 
","2024-07-23","2024-05-16",40.726389,-73.988916,,"American",,"{""id"":""usrSSqhKNrK05i823"",""email"":""Director@evccnyc.org"",""name"":""Laura Sewell""}","New York","2024-07-23T18:20:42.000Z","80","2nd Avenue","NY","10003","https://evgrieve.com/2024/05/openings-sunday-dreamin-on-2nd-avenue.html",,,,"(646) 360-3805",,"https://www.sundaydreamin.com/",,,,,true,,,,,,,,,,,,,,,,
"reckdbB7L1sGYucJV",2107,2107,,"Buy Me Flowers","102 E. 7th Street, New York, NY 10009","Retail","EVCC",,,,40.726499,-73.985069,,"Yes","Opened",,,,"Observed open 3/8/2024.
","2024-03-08","2024-01-01",40.726499,-73.985069,,"Cannabis","East","{""id"":""usrSSqhKNrK05i823"",""email"":""Director@evccnyc.org"",""name"":""Laura Sewell""}","New York","2024-07-31T05:10:19.000Z","102","E. 7th Street","NY","10009","https://evgrieve.com/2023/10/a-cannabis-dispensary-is-first-tenant.html",,,,,,,,,true,"VACANT. Longterm vacancy previously occupied by resident who lived in a pretend vintage store. Gotta love the EV!",,,,,,,,,,,,,,,,,
"recFoMdjhrBk7iJa2",2106,2106,,"La Mama","74 E. 4th Street, New York, NY 10003","Arts & Culture","EVCC",,,,40.726327,-73.990198,"https://www.instagram.com/lamamaetc/?hl=en","Yes","Opened",,,,"Reopened fall 2023 after extensive building renovation 
","2024-01-31",,40.726327,-73.990198,,"Theater",,"{""id"":""usrSSqhKNrK05i823"",""email"":""Director@evccnyc.org"",""name"":""Laura Sewell""}","New York","2024-04-29T16:59:42.000Z","74","E. 4th Street","NY","10003",,,,,"(646) 430-5374",,"http://lamama.org/",,,,,,,,,,,,,,,,,,,,,
"receYVQvsfpqZCXXX",2105,2105,,"Connelly Upstairs","220 E. 4th Street, New York, NY 10009","Arts & Culture","JK",,,,40.723458,-73.983534,"https://www.instagram.com/connellytheater/","Yes","Opened",,,,"Opened October 2023 in former Metropolitan Playhouse location.
","2023-10-10",,40.723458,-73.983534,,"Theater","2nd Floor","{""id"":""usrSSqhKNrK05i823"",""email"":""Director@evccnyc.org"",""name"":""Laura Sewell""}","New York","2024-04-29T16:59:42.000Z","220","E. 4th Street","NY","10009","https://evgrieve.com/2023/10/whats-going-on-at-connelly-theater.html",,,,"(646) 343-1584",,"https://www.connellytheater.org/",,,,,,,,,,,,,,,,,,,,,
"receYmq5H9Uxt9LtK",2104,2104,,"Kush Factory","422 E. 9th Street, New York, NY 10009","Retail","EVCC",,,,40.727587,-73.983857,"https://www.instagram.com/kush_factory__/?hl=en",,"Unknown",,,,"Opened 2023 in former Good Beer location. <https://t.me/kushfactory21>
","2024-07-26",,40.727587,-73.983857,,"Cannabis",,"{""id"":""usrSSqhKNrK05i823"",""email"":""Director@evccnyc.org"",""name"":""Laura Sewell""}","New York","2024-07-31T18:36:40.000Z","422","E. 9th Street","NY","10009",,,,,,,,,,,"Good Beer closed September 2022",,,,"info@kushfactory.com",,,,,,,,,,,,,
"recdSHsoIBDHsP56P",2103,2103,,"Jones Street Wine Bar","122 E. 7th Street, New York, NY 10009","Restaurants","OB",,,,40.726183,-73.984272,"https://www.instagram.com/jonesstreetwinebar/?hl=en ","Yes","Opened","5:00 PM","12:00 AM","THURS - SAT Only
","IG and Website are current. Soft opened 3/27/24, event space opened in east storefront  5/10/24
","2024-07-15","2024-03-29",40.726183,-73.984272,,"Wine","West","{""id"":""usrSSqhKNrK05i823"",""email"":""Director@evccnyc.org"",""name"":""Laura Sewell""}","New York","2024-07-15T20:48:54.000Z","122","E. 7th Street","NY","10009","https://www.nyc.gov/assets/manhattancb3/downloads/minutes/2023/minutes2023-11.pdf",,,,,"Yes","https://www.jonesstreetwine.com/",,,,,true,,,,,,,,,,,,,,,,
"recdEZ9WRaaRaHJsZ",2102,2102,,"Hiddenleaf","181 Avenue B, New York, NY 10009","Retail","EVCC","181","Avenue B","10009",40.72765,-73.979073,,"Yes","Opened",,,,"UNLICENSED Cannabis dispensary. Mary Jane Lane RELOCATED in October 2023 to former Villainess location as per sign on door (formerly Mary Jane Ln)
","2024-07-26","2023-10-01",40.72770831492975,-73.97927953407485,"recOvoMMdKeFJwbXA","Smoke Shop",,"{""id"":""usrSSqhKNrK05i823"",""email"":""Director@evccnyc.org"",""name"":""Laura Sewell""}","New York","2024-07-31T18:33:31.000Z","181","Avenue B","NY","10009",,,,,,,,,,true,"Villainess closed August 2022",,,,,,,,,,,,,,,,,
"recbxTtzBojElEeG2",2101,2101,,"Matto Espresso","110 3rd Avenue, New York, NY 10003","Cafes and Desserts","JK",,,,40.732941,-73.987808,"https://www.instagram.com/Matto/","Yes","Opened",,,,"CHAIN. Observed open 10/2/2023 in former Isaac Gabai Salon.
","2023-10-02","2023-10-01",40.732941,-73.987808,,"Cafe","Center","{""id"":""usrSSqhKNrK05i823"",""email"":""Director@evccnyc.org"",""name"":""Laura Sewell""}","New York","2024-04-29T16:59:42.000Z","110","3rd Avenue","NY","10003","https://evgrieve.com/2023/11/openings-matto-espresso-on-3rd-avenue.html",,true,," (347) 882-8000",,"https://www.matto.com/",,,,,,,,,,,,,,,,,,,,,
"recBhXMIeT3AqirbT",2100,2100,,"Loisaida Foundry","251 E. 3rd Street , New York, NY 10009","Community Services","EVCC",,,,40.722186,-73.981236,,,"Opened",,,,"Not a storefront, survey only.
","2023-10-03",,40.722186,-73.981236,,,,"{""id"":""usrSSqhKNrK05i823"",""email"":""Director@evccnyc.org"",""name"":""Laura Sewell""}","New York","2024-04-29T16:59:42.000Z","251","E. 3rd Street ","NY","10009",,,,,,,,true,,,,,,,"theloisaidafoundryinc@gmail.com",,,,true,,,,"Yes",,,,,
"recb66akOGAteOapt",2099,2099,,"Manhattan Pawffice","20 St. Mark's Place, New York, NY 10003","Services","JK",,,,40.728903,-73.988953,"https://www.instagram.com/manhattanpawffice/","Yes","Opened","6:00 AM","6:00 PM","SAT & SUN: 8:00 AM - 6:00 PM
[Boarding ](https://manhattanpawffice.com/boarding/)available!
","Doggy daycare opened 11/1/2023 in long-vacant former Grassroots Tavern location. IG and website are current, hours from website.
","2023-11-01","2023-11-01",40.728903,-73.988953,,"Doggy Daycare",,"{""id"":""usrSSqhKNrK05i823"",""email"":""Director@evccnyc.org"",""name"":""Laura Sewell""}","New York","2024-05-21T15:52:04.000Z","20","St. Mark's Place","NY","10003","https://evgrieve.com/2023/11/openings-pawffice-on-st-marks-place.html",,,,"(929) 777-5320",,"https://manhattanpawffice.com/",,,,,,,,,,,,,,,,,,,,,
"recAUIi4bMIxS1U3Y",2098,2098,,"Crepe Master","123 E. 7th Street, New York, NY 10009","Cafes and Desserts","EVCC",,,,40.726502,-73.98412,"https://www.instagram.com/crepemasternyc/","Yes","Opened","11:00 AM","11:00 PM","FRI: 11:00 AM - 1:00 AM
SAT: 10:00 AM - 1:00 AM
SUN: 10:00 AM - 11:00 PM
","Hours from website. Opened April 2024 in former Butter Lane location.
","2024-04-15","2024-04-01",40.726502,-73.98412,,"Cafe,Gluten Free,Ice Cream",,"{""id"":""usrSSqhKNrK05i823"",""email"":""Director@evccnyc.org"",""name"":""Laura Sewell""}","New York","2024-04-29T16:59:42.000Z","123","E. 7th Street","NY","10009","https://evgrieve.com/2023/11/signage-alert-crepe-master-on-7th-street.html",,,,"(646) 398-8001",,"https://www.crepemasternyc.com/",,,,,true,,,,,,,,,,,,,,,,
"recaO0etSTSJpbvPt",2097,2097,,"Yokox Omakase","41 Avenue B, New York, NY 10009","Restaurants","JK",,,,40.722829,-73.98259,"https://www.instagram.com/yokox.nyc/?hl=en","Yes","Opened","5:00 PM","10:00 PM","FRI: 5:00 PM - 11:00 PM
SAT: 3:00 PM - 11:00 PM
SUN: 3:00 PM - 10:00 PM
","Google says biz updated hours on 4/5/2024. Opened April 2024 in long vacant former Montessori Preschool location. 
","2024-04-12","2024-04-01",40.722829,-73.98259,,"Japanese,Omakase",,"{""id"":""usrSSqhKNrK05i823"",""email"":""Director@evccnyc.org"",""name"":""Laura Sewell""}","New York","2024-04-29T16:59:42.000Z","41","Avenue B","NY","10009","https://evgrieve.com/2024/04/openings-yokox-omakase-on-avenue-b.html",,,,"(646) 689-3997",,"https://resy.com/cities/new-york-ny/venues/yokox-omakase?date=2024-04-03&seats=2",,,,,true,,,,,,,,,,,,,,,,
"rec44QhwqyCzhj6Tx",2096,2096,,"Bank of America","119 2nd Avenue, New York, NY 10003","Services","JK",,,,40.728247,-73.988332,,"Yes","Opened","9:00 AM","5:00 PM","SAT: 9:00 AM - 2:00 PM
SUN: Closed
","CHAIN. Hours from website. Opened 3/8/2024. 
","2023-11-20","2024-03-08",40.728247,-73.988332,,"Bank",,"{""id"":""usrSSqhKNrK05i823"",""email"":""Director@evccnyc.org"",""name"":""Laura Sewell""}","New York","2024-04-29T16:59:42.000Z","119","2nd Avenue","NY","10003","https://evgrieve.com/2023/11/in-2024-bank-of-america-will-be-moving.html",,true,,"(212) 457-8461",,"https://locators.bankofamerica.com/ny/newyork/financial-centers-new-york-18113.html?utm_source=GMBlisting&utm_medium=organic",,,,,,,,,,,,,,,,,,,,,
"rec9f7zMOzOLnywGH",2095,2095,,"LES Fine Wines & Spirits","58 Avenue A, New York, NY 10009","Retail",,,,,,,"https://www.instagram.com/lesfinewines/","Yes","Opened","12:00 PM","9:00 PM","FRI & SAT: 11:00 AM - 10:00 PM
SUN: 12:00 PM - 8:00 PM
","Rebranded as LES Fine Wines after new building owner standardized signage
","2023-09-03",,40.72429722,-73.98462971,,"Wine,Liquor",,"{""id"":""usrSSqhKNrK05i823"",""email"":""Director@evccnyc.org"",""name"":""Laura Sewell""}","New York","2024-04-08T20:20:59.000Z","58","Avenue A","NY","10009","https://evgrieve.com/2023/10/whatever-happened-to-champagnes-of-east.html",,,,"(212) 420-1449","Yes","https://www.lesfinewines.com/",,,,,,,true,"lesfinewine@gmail.com",,,,,,,,,,,,,
"rec8yKOBgPbMd5wZ1",2094,2094,,"La Vera Pizza","67 2nd Avenue, New York, NY 10003","Restaurants","OB",,,,40.726191,-73.989755,,"Yes","Opened","9:45 AM","1:30 AM","THU: 9:45 AM - 2:30 AM
FRI: 9:45 AM - 4:30 AM 
SAT: 10:30 AM - 4:30 AM 
SUN: 10:30 AM - 1:30 AM
","Hours from website. Opened on 12/9/2023 in former Sestina location. 
","2023-12-06","2023-12-09",40.726191,-73.989755,,"Pizza",,"{""id"":""usrSSqhKNrK05i823"",""email"":""Director@evccnyc.org"",""name"":""Laura Sewell""}","New York","2024-07-08T19:25:43.000Z","67","2nd Avenue","NY","10003","https://evgrieve.com/2023/12/signage-alert-la-vera-pizza-on-2nd.html",,,,"(212) 994-7221","Yes","https://www.laverapizzanewyorkcity.com/?utm_source=gbp",,,,,,,,,,,,,,,,,,,,,
"rec8QhJdnsEKhL1LS",2093,2093,,"Total by Verizon","199 Avenue A, New York, NY 10009","Services","EVCC",,,,40.728259,-73.978647,,"Yes","Opened","10:00 AM","8:00 PM","SUN: 11:00 AM - 7:00 PM
","Opened November 2023 in former Psychic location
","2023-11-01","2023-11-01",40.728259,-73.978647,,"Computer & Phone Repair","South","{""id"":""usrSSqhKNrK05i823"",""email"":""Director@evccnyc.org"",""name"":""Laura Sewell""}","New York","2024-06-29T22:24:20.000Z","199","Avenue A","NY","10009",,,true,,"(212) 498-9252",,"https://www.totalbyverizon.com/stores/ny/new-york/199-ave-a",,,,,,,,,,,,,,,,,,,,,
"rec8pULiAAKIPI5nB",2092,2092,,"Grams","520 E. 11th Street, New York, NY 10009","Retail","EVCC",,,,40.727888,-73.980863,,"Yes","Opened",,,,"UNLICENSED. Opened 10/1/2023 in longtime Twigs Hair Salon (relocated to 212 Avenue B).
","2024-07-26","2023-10-01",40.727888,-73.980863,,"Cannabis","East","{""id"":""usrSSqhKNrK05i823"",""email"":""Director@evccnyc.org"",""name"":""Laura Sewell""}","New York","2024-07-31T18:42:43.000Z","520","E. 11th Street","NY","10009",,,,,,,,,,true,"Twigs Hair Salon relocated to Ave B October 2023",,,,,,,,,,,,,,,,,
"rec8lMwNoCTrbJ9O8",2091,2091,,"Psychic Readings","60 E. 3rd Street, New York, NY 10003","Services",,,,,,,,"Yes","Opened",,,,"Opened January 2022 in former Sunrise Cleaners location.
","2023-09-03","2022-01-21",40.72513122,-73.98911477,,"Psychic","West","{""id"":""usrSSqhKNrK05i823"",""email"":""Director@evccnyc.org"",""name"":""Laura Sewell""}","New York","2024-03-28T00:18:15.000Z","60","E. 3rd Street","NY","10003","https://evgrieve.com/2022/01/this-block-of-3rd-street-gets-psychic.html",,,,"(917) 449-2361",,,,,,,,,,,,,,,,,,,,,,,
"rec5BzRbQ04yH1N1b",2090,2090,,"Rakka Cafe","156 1st Avenue, New York, NY 10009","Restaurants","EVCC",,,,40.728392,-73.984342,,"Yes","Opened","11:00 AM","10:00 PM","FRI & SAT: 11:00 AM - 11:00 PM
","Legacy business RELOCATED from St. Mark's Place, opened November 2023 in former Hello Banana location
","2023-11-20","2023-11-20",40.728392,-73.984342,,"Middle Eastern,Juice Bar",,"{""id"":""usrSSqhKNrK05i823"",""email"":""Director@evccnyc.org"",""name"":""Laura Sewell""}","New York","2024-04-29T16:59:42.000Z","156","1st Avenue","NY","10009","https://evgrieve.com/2023/11/openings-rakka-on-1st-avenue.html",,,,"(934) 217-4719","Yes","https://rakka1985.square.site/",,"No",,,,,true,,,,,,,,,,,,,,
"rec4MlPhRsYLvTl0l",2089,2089,,"House of Munchies","111 1st Avenue, New York, NY 10003","Groceries","JK",,,,,,,"Yes","Opened",,,,"Opened October 2023 in former Village Smoke & Vape location, signage observed on Google May 2024.
","2023-10-01","2023-10-01",40.72691528,-73.98607586,,"Deli","South","{""id"":""usrSSqhKNrK05i823"",""email"":""Director@evccnyc.org"",""name"":""Laura Sewell""}","New York","2024-07-29T19:07:19.000Z","111","1st Avenue","NY","10003","https://evgrieve.com/2023/10/house-of-munchies-debuts-on-1st-avenue.html",,,,,,,,,,,,,,,,,,,,,,,,,,,
"1750",2088,2088,1750,"Gemina Coffee Shop","424 E. 14th Street, New York, NY 10009","Cafes and Desserts","EVCC",,,,,,"https://www.instagram.com/geminacoffeeshop/","Yes","Opened","7:00 AM","5:00 PM","SAT & SUN: 8:00 AM - 5:00 PM
","IG is current. Opened November 2024 in former Akina Sushi location, Lazy Llama sister business
","2023-11-09",,40.73070338,-73.98143045,"reccaPpWCRt17dKzF","Cafe","East","{""id"":""usrSSqhKNrK05i823"",""email"":""Director@evccnyc.org"",""name"":""Laura Sewell""}","New York","2024-04-08T20:12:54.000Z","424","E. 14th Street","NY","10009","https://evgrieve.com/2024/03/the-lazy-llama-has-closed-in-first-park.html","What's Open Filled",,,,,,,,,,true,,,,,,,true,,,,,,,,,
"rec1g0pbnWGMv6GIM",2087,2087,,"Babs Home and Pantry","149 Avenue A, New York, NY 10009","Retail","JK",,,,,,,"Yes","Opened","11:00 AM","7:00 PM",,"Opened 10/1/2023 in former DLALA location (moved in with Redge) 
","2023-10-01","2023-10-01",40.72752857,-73.98264318,,"Gifts & Home","North","{""id"":""usrSSqhKNrK05i823"",""email"":""Director@evccnyc.org"",""name"":""Laura Sewell""}","New York","2024-04-08T20:20:40.000Z","149","Avenue A","NY","10009","https://evgrieve.com/2023/10/openings-babs-home-and-pantry-on-avenue.html",,,,,,,,,,,,,,,,,,true,,,,,,,,,
"rec0wQlKQUOk2kKkH",2086,2086,,"Liftonic","24 2nd Avenue, New York, NY 10003","Health","JK",,,,40.724307,-73.990408,"https://www.instagram.com/liftonicnyc/","Yes","Opened","6:30 AM",,"Lifters: [book a bench!](https://eastvillage.liftonic.com/book-a-bench)
New to lifting? [try a class!](https://clients.mindbodyonline.com/ASP/main_shop.asp?stype=41&pMode=4&reSchedule=&origId=&recType=&recNum=)
SAT: 10:00 AM - 
SUN: 11:00 AM - 
","Opened 1/1/2024 in newly constructed condo building, previously leased for high end pop ups (gallery showroom) .
","2024-03-25","2024-01-01",40.724307,-73.990408,,"Gym",,"{""id"":""usrSSqhKNrK05i823"",""email"":""Director@evccnyc.org"",""name"":""Laura Sewell""}","New York","2024-04-29T16:59:42.000Z","24","2nd Avenue","NY","10003","https://evgrieve.com/2023/11/liftonic-bringing-group-weight-training.html",,,,"(917) 678-9785",,"https://eastvillage.liftonic.com/",,,,,,,,"bowery@liftonic.com",,,,,,,,,,,,,
"20231889",2085,2085,20231889,"VACANT","41 Cooper Square, New York, NY 10003",,,,,,40.72857,-73.99035,,,"Unknown",,,,,"2024-03-20",,40.72857,-73.99035,,,,"{""id"":""usrSSqhKNrK05i823"",""email"":""Director@evccnyc.org"",""name"":""Laura Sewell""}","New York","2024-08-06T22:28:07.000Z","41","Cooper Square","NY","10003",,,,,,,,,,,,,,,,,,true,,,,,,,,,,
"20231825",2084,2084,20231825,"2nd Street NYU Dorm ","321 Bowery, New York, NY 10003","Other",,,,,40.72543037,-73.99185659,,"Yes","Opened",,,,"Survey Only do not fill
","2023-11-14",,40.72543037,-73.99185659,,,,"{""id"":""usrSSqhKNrK05i823"",""email"":""Director@evccnyc.org"",""name"":""Laura Sewell""}","New York","2024-03-28T00:18:15.000Z","321","Bowery","NY","10003",,,,,,,,,,,,,,,,,,true,,,,,,,,,,
"20231593",2083,2083,20231593,"VACANT","513 E. 12th Street, New York, NY 10009",,,,,,40.72886393,-73.98055572,,,"Unknown",,,,"VACANT. Former graphic design office, gate hasnt been up since before pandemic.
","2023-11-14",,40.72886393,-73.98055572,,,,"{""id"":""usrSSqhKNrK05i823"",""email"":""Director@evccnyc.org"",""name"":""Laura Sewell""}","New York","2024-08-06T23:07:48.000Z","513","E. 12th Street","NY","10009",,,,,,,,,,,,,,,,,,,,,,,,,,,,
"20231582",2082,2082,20231582,"VACANT","187 Avenue A, New York, NY 10009","Vacant",,,,,40.72888,-73.98169,,"No","Closed",,,,"New development with multiple never-occupied store fronts
","2023-11-14",,40.72888,-73.98169,,,,"{""id"":""usrSSqhKNrK05i823"",""email"":""Director@evccnyc.org"",""name"":""Laura Sewell""}","New York","2024-03-28T00:18:15.000Z","187","Avenue A","NY","10009",,,,,,,,,,,,,,,,,,true,,,,,,,,,,
"20231507",2081,2081,20231507,"St. George Ukrainian Church","30 E. 7th Street, New York, NY 10003","Nonprofits, Houses of Worship, & Education","EVCC",,,,40.72837842,-73.98931146,,"Yes","Opened",,,,"Website is current, not much information.
","2024-01-05","1976-01-01",40.72837842,-73.98931146,,,,"{""id"":""usrSSqhKNrK05i823"",""email"":""Director@evccnyc.org"",""name"":""Laura Sewell""}","New York","2024-05-31T21:10:38.000Z","30","E. 7th Street","NY","10003",,,,,"(212) 674-1615",,"https://stgeorgechurch.us/",,,,,,,,"osbmnyc@gmail.com",,,true,,,,,,,true,,,
"20231451",2080,2080,20231451,"LaSalle Parking ","220 E. 9th Street, New York, NY 10003","Other",,,,,40.72952958,-73.98828841,,"No","Closed",,,,"PERMANENTLY CLOSED. FULL VACATE ORDER 05/02/2023, building sold April 2024.
","2023-11-14",,40.72952958,-73.98828841,,,,"{""id"":""usrSSqhKNrK05i823"",""email"":""Director@evccnyc.org"",""name"":""Laura Sewell""}","New York","2024-04-03T22:34:57.000Z","220","E. 9th Street","NY","10003","https://evgrieve.com/2024/04/vacated-9th-street-parking-garage.html",,,,,,,,,,,,,,,,"2023-05-04",true,,,,,,,,,,
"20231433",2079,2079,20231433,"Cornerstone First Ukrainian Assembly of God","59 Cooper Square, New York, NY 10003","Nonprofits, Houses of Worship, & Education",,,,,40.72897575,-73.99009738,,,"Opened",,,,,"2024-03-27",,40.72897575,-73.99009738,,,,"{""id"":""usrSSqhKNrK05i823"",""email"":""Director@evccnyc.org"",""name"":""Laura Sewell""}","New York","2024-08-06T22:28:33.000Z","59","Cooper Square","NY","10003",,,,,,,,,,,,,,,,,,true,,,,,,true,true,,,
"20231402",2078,2078,20231402,"7Eleven","170 Avenue A, New York, NY 10009","Groceries",,,,,40.72827995,-73.98173115,,"Yes","Opened","12:00 AM","12:00 AM","Open 24/7!
","CHAIN. Longstanding business opened in former Bar on A location.
","2023-11-14",,40.72827995,-73.98173115,,"Deli",,"{""id"":""usrSSqhKNrK05i823"",""email"":""Director@evccnyc.org"",""name"":""Laura Sewell""}","New York","2024-03-28T00:18:15.000Z","170","Avenue A","NY","10009",,,true,," (212) 673-6489",,"https://www.7-eleven.com/locations/ny/new-york/170-ave-a-36678",,,,,,,,,,,true,,,,,,,,,,
"20231391",2077,2077,20231391,"Town and Village Synagogue ","334 E. 14th Street, New York, NY 10009","Nonprofits, Houses of Worship, & Education","EVCC",,,,40.73161174,-73.98359803,,"Yes","Opened","7:00 AM","9:00 PM","SAT: 9:00 AM - 3 PM
SUN: 9:30 AM - 5 PM
","Website is current. Congregation took over former Ukrainian Orthodox Church in 1962.
","2023-11-14","1962-01-01",40.73161174,-73.98359803,,,,"{""id"":""usrSSqhKNrK05i823"",""email"":""Director@evccnyc.org"",""name"":""Laura Sewell""}","New York","2024-07-31T02:04:33.000Z","334","E. 14th Street","NY","10009",,,,,"(212) 677-8090",,"https://www.tandv.org/",,,,,,,,"office@tandv.org",true,,true,,,,,,,,,,
"20231304",2076,2076,20231304,"Immaculate Conception Church","414 E. 14th Street, New York, NY 10009","Nonprofits, Houses of Worship, & Education","JK",,,,40.7308166,-73.98197308,,"Yes","Opened",,,,"Longstanding church. 
","2023-11-14","1855-01-01",40.7308166,-73.98197308,,,,"{""id"":""usrSSqhKNrK05i823"",""email"":""Director@evccnyc.org"",""name"":""Laura Sewell""}","New York","2024-07-31T02:04:43.000Z","414","E. 14th Street","NY","10009",,,,," (212) 254-0200",,"https://immaculateconception-nyc.org/",,,,,,,,,true,,true,,,,,,,,,,
"20231300",2075,2075,20231300,"The New York Eye and Ear Infirmary of Mt. Sinai","310 E. 14th Street, New York, NY 10003","Health",,,,,40.73198737,-73.98449484,,"Yes","Opened","8:00 AM","4:00 PM","Walk-ins welcome!
","Longstanding business 
","2024-01-03","1820-01-01",40.73198737,-73.98449484,,"Medical",,"{""id"":""usrSSqhKNrK05i823"",""email"":""Director@evccnyc.org"",""name"":""Laura Sewell""}","New York","2024-07-31T01:35:09.000Z","310","E. 14th Street","NY","10003",,,,,"(212) 979-4000",,"https://www.nyee.edu/",,,,,,,true,,true,,,,,,,,,,,,
"20231207",2074,2074,20231207,"NYU Langone Gastroenterology","232 E. 12 Street, New York, NY 10003","Doctor, Dentist, & Medical Services",,,,,40.73119285,-73.98661708,,,"Opened",,,,,,,40.73119285,-73.98661708,,,,"{""id"":""usrSSqhKNrK05i823"",""email"":""Director@evccnyc.org"",""name"":""Laura Sewell""}","New York","2024-04-03T20:59:40.000Z","232","E. 12 Street","NY","10003",,,,,,,,,,,,,,,,,,true,,,,,,,,,,
"20231146",2073,2073,20231146,"Project Renewal Kenton Hall Mens Shelter","333 Bowery, New York, NY 10003","Other","JK",,,,40.72591483,-73.99170304,,"Yes","Opened",,,,"Longstanding men's shelter facility opened 1991.
","2023-11-14","1991-01-01",40.72591483,-73.99170304,,,,"{""id"":""usrSSqhKNrK05i823"",""email"":""Director@evccnyc.org"",""name"":""Laura Sewell""}","New York","2024-03-28T00:18:15.000Z","333","Bowery","NY","10003","https://evgrieve.com/2018/01/project-renewal-holding-community.html",,,,"(212) 473-1140",,,,,,,,,,,,,true,,,,,,,,,,
"20231108",2072,2072,20231108,"Manhattan Institute for Psychoanalysis","245 E. 13th Street, New York, NY 10003","Nonprofits, Houses of Worship, & Education",,,,,40.73196041,-73.98591353,,"Yes","Opened",,,,"EVCC: this is not a medical office as reported in 2019, its a school offering certificate programs 
","2302-12-20",,40.73196041,-73.98591353,,,,"{""id"":""usrSSqhKNrK05i823"",""email"":""Director@evccnyc.org"",""name"":""Laura Sewell""}","New York","2024-03-28T00:18:15.000Z","245","E. 13th Street","NY","10003",,,,,,,,,,,,,,,,,,true,,,,,,,,,,
"20231097",2071,2071,20231097,"Chase Bank","305 Bowery, New York, NY 10003","Services","JK",,,,40.72496975,-73.99204357,,"Yes","Opened","9:00 AM","5:00 PM","SAT & SUN: Closed
","Website is current.
","2023-11-14",,40.72496975,-73.99204357,,"Bank",,"{""id"":""usrSSqhKNrK05i823"",""email"":""Director@evccnyc.org"",""name"":""Laura Sewell""}","New York","2024-03-28T00:18:15.000Z","305","Bowery","NY","10003",,,true,,"(866) 915-7122",,"https://locator.chase.com/ny/new-york/305-bowery?jp_cmp=rb%2FLocalListings%2Faff%2Fbranch%2Fna&y_source=1_MjAzODM4MC03MTUtbG9jYXRpb24ud2Vic2l0ZQ%3D%3D",,,,,,,,,,,,,,,,,,,,,
"2023984",2070,2070,2023984," All Saints Ukrainian Orthodox Church","206 E. 11th Street, New York, NY 10003","Nonprofits, Houses of Worship, & Education",,,,,40.73096199,-73.9880644,,"Yes","Opened",,,,"Website is current.
","2024-01-05",,40.73096199,-73.9880644,,,,"{""id"":""usrSSqhKNrK05i823"",""email"":""Director@evccnyc.org"",""name"":""Laura Sewell""}","New York","2024-03-28T00:18:15.000Z","206","E. 11th Street","NY","10003",,,,,"(914) 208-5197",,"https://www.allsaintschurchny.org/",,,,,,,,,,,true,,,,,,,true,,,
"2023908",2069,2069,2023908,"St. Marks Hotel","2 St. Mark's Place, New York, NY 10003","Other","EVCC",,,,40.72928693,-73.9896226,,"Yes","Opened",,,"Call us to book a room!
","Website is current.
","2024-08-07",,40.72928693,-73.9896226,,,"2nd Floor","{""id"":""usrSSqhKNrK05i823"",""email"":""Director@evccnyc.org"",""name"":""Laura Sewell""}","New York","2024-08-07T16:21:36.000Z","2","St. Mark's Place","NY","10003",,,,,"(212) 674-0100",,"http://stmarkshotel.net/",,,,,,,,,,,true,,,,,,,,,,
"2023879",2068,2068,2023879,"New York Theatre Workshop","72 E. 4th Street, New York, NY 10009","Nonprofits, Houses of Worship, & Education","EVCC",,,,40.72641928,-73.99023608,,"Yes","Opened",,,"By appointment only! 
","Office for New York Theatre Workshop 
","2023-11-14",,40.72641928,-73.99023608,,,,"{""id"":""usrSSqhKNrK05i823"",""email"":""Director@evccnyc.org"",""name"":""Laura Sewell""}","New York","2024-03-28T00:18:15.000Z","72","E. 4th Street","NY","10009",,,,,,,,,,,,,,,,,,true,,,,,,,,,,
"2023783",2067,2067,2023783,"BRC Human Services Corporation","317 Bowery, New York, NY 10003","Other","JK",,,,40.72527608,-73.99192034,,"Yes","Opened",,,,"Survey Only do not fill
","2023-11-14",,40.72527608,-73.99192034,,,,"{""id"":""usrSSqhKNrK05i823"",""email"":""Director@evccnyc.org"",""name"":""Laura Sewell""}","New York","2024-03-28T00:18:15.000Z","317","Bowery","NY","10003",,,,," (212) 228-2718",,,,,,,,,,,,,true,,,,,,,,,,
"2023519",2066,2066,2023519,"Ukrainian Congress Committee of America","203 2nd Avenue, New York, NY 10003","Community Services",,,,,40.73148362,-73.98581394,,"Yes","Opened",,,,"Website is current.
","2024-01-05",,40.73148362,-73.98581394,,,,"{""id"":""usrSSqhKNrK05i823"",""email"":""Director@evccnyc.org"",""name"":""Laura Sewell""}","New York","2024-03-28T00:18:15.000Z","203","2nd Avenue","NY","10003",,,,,"(212) 228-6840",,"https://ucca.org/",,,,,,,,"ucca@ucca.org",,,,,,,,,,true,,,
"2023504",2065,2065,2023504,"Mt. Sinai New York Eye and Ear Infirmary ","218 2nd Avenue, New York, NY 10003","Health","JK",,,,40.73176689,-73.98508356,,"Yes","Opened","8:00 AM","4:00 PM",,"FILL. Skip TBD what is this entrance for? 
","2024-06-05",,40.73176689,-73.98508356,,"Medical",,"{""id"":""usrSSqhKNrK05i823"",""email"":""Director@evccnyc.org"",""name"":""Laura Sewell""}","New York","2024-06-05T18:13:16.000Z","218","2nd Avenue","NY","10003",,,,,"(212) 979-4253",,,,,,,,,,,,,,,,,,,,,,,
"2023467",2064,2064,2023467,"The Brownstone","224 E. 12th Street, New York, NY 10003","Nonprofits, Houses of Worship, & Education",,,,,40.73134758,-73.98699172,,"Yes","Opened",,,,"Survey Only do not fill
","2023-11-14",,40.73134758,-73.98699172,,,,"{""id"":""usrSSqhKNrK05i823"",""email"":""Director@evccnyc.org"",""name"":""Laura Sewell""}","New York","2024-03-28T00:18:15.000Z","224","E. 12th Street","NY","10003",,,,,,,,,,,,,,,,,,true,,,,,,,,,,
"2023149",2063,2063,2023149,"VACANT","23 3rd Avenue, New York, NY 10009","Vacant","EVCC",,,,40.72950459,-73.98956738,,"No","Closed",,,,"Huge empty lot, stalled development. 
","2023-11-14",,40.72950459,-73.98956738,,,,"{""id"":""usrSSqhKNrK05i823"",""email"":""Director@evccnyc.org"",""name"":""Laura Sewell""}","New York","2024-07-29T17:51:06.000Z","23","3rd Avenue","NY","10009",,,,,,,,,,true,,,,,,,,true,,,,,,,,,,
"2023122",2062,2062,2023122,"VACANT","511 E. 6th Street, New York, NY 10009",,,,,,40.72524958,-73.98318945,,,"Unknown",,,,"\*\*\*\*\*VACANT? Long-vacant former Identity Lounge location
","2023-11-14",,40.72524958,-73.98318945,,,,"{""id"":""usrSSqhKNrK05i823"",""email"":""Director@evccnyc.org"",""name"":""Laura Sewell""}","New York","2024-08-06T22:58:30.000Z","511","E. 6th Street","NY","10009",,,,,,,,,,,,,,,,,,,,,,,,,,,,
"2235",2061,2061,2235,"Angels on A","66 Avenue A, New York, NY 10009","Retail","EVCC","66","Avenue A","10009",40.724419,-73.984537,"https://www.instagram.com/downtownthreadsnyc/","Yes","Opened","11:00 AM","8:00 PM",,"Evolved into Angels on A winter 2024. Downtown Threads opened 10/10/2023 in Whim Golf pop-up location (formerly Lancelotti). Operated by Angel Rameriez, owner of Cafe Social 68 and Halloween pop-up.
","2024-05-03","2023-10-10",40.724585614920535,-73.98459116091409,"recc9CvAxJ7ujEhYP","Fashion,Records,Vintage","North","{""id"":""usrSSqhKNrK05i823"",""email"":""Director@evccnyc.org"",""name"":""Laura Sewell""}","New York","2024-06-29T22:11:05.000Z","66","Avenue A","NY","10009","https://evgrieve.com/2023/12/a-new-name-and-expanded-space-for.html?fbclid=IwAR2vsiBC5qmQUi6t6m7XVd5xfiDxi8DSsmum7GU9is-8H3eLL8yIz9gOL4U",,,,"(646) 901-8289",,"https://www.angelsonanyc.com/",true,,,,,,,"INFO@ANGELSONANYC.COM",,,,,,,,,,,,,
"2233",2060,2060,2233,"The Avenue Cafe","102 St. Mark's Place, New York, NY 10009","Cafes and Desserts","EVCC","102","St. Mark's Place","10009",40.72708,-73.98469,"https://www.instagram.com/theavenuecafenyc/","No","Closed","7:30 PM","4:00 PM","MON: Closed
","PERMANENTLY CLOSED soon after opening10/24/2023 in former Baked Cravings location (briefly occupied by Compilation Coffee in fall 2022).
","2023-10-31","2023-10-24",40.72737431522261,-73.98479616830832,"recFlpFnEKYxJ7DLC","Cafe","West","{""id"":""usrSSqhKNrK05i823"",""email"":""Director@evccnyc.org"",""name"":""Laura Sewell""}","New York","2024-04-15T19:32:21.000Z","102","St. Mark's Place","NY","10009","https://evgrieve.com/2022/11/compilation-coffee-has-closed-for-now.html",,,,,,,true,,,,,,,,,"2024-03-30",,,,,,,,,,,
"2232",2059,2059,2232,"Instant Noodle Factory","130 E. 7th Street, New York, NY, 10009","Restaurants","EVCC","130","E. 7th Street","10009",40.726123,-73.983976,"https://www.instagram.com/instantnoodlefactory/","Yes","Opened","12:00 PM","10:00 PM","FRI & SAT: 12:00 PM - 12:00 AM
","Google says biz updated hours on 1/1/24. Opened December 2023 in former Avant Garden location	
","2023-12-28","2023-12-01",40.72618570946921,-73.98386921710511,"rec2O0d2C9Bt2V63g","Asian",,"{""id"":""usrSSqhKNrK05i823"",""email"":""Director@evccnyc.org"",""name"":""Laura Sewell""}","New York","2024-04-08T20:16:32.000Z","130","E. 7th Street",,"10009","https://evgrieve.com/2023/12/openings-instant-noodle-factory-on-7th.html",,,," (914) 510-2407",,"https://inoodlefactory.com/",,"Yes",,,true,,,"inoodlefactory@gmail.com",,,,,,,,,,,,,
"2231",2058,2058,2231,"Thai for Thought","32 E. 7th Street, New York, NY 10003","Restaurants","EVCC","32","E. 7th Street","10003",40.728222,-73.9892,"https://www.instagram.com/thaiforthought/","Yes","Opened","12:00 PM","8:30 PM","SAT & SUN: 4:00 PM - 8:30 PM
","PERMANENTLY CLOSED as per 9/15/2023 IG post. IG and website are current. Google hours updated by business 03/2023. Relatives opened 1/1/2023 in former Makinny location after owner retired. 
","2023-10-30","2023-10-15",40.72831074809751,-73.98892348858928,"recYPDsK0mtZY0VGt","Thai",,"{""id"":""usrSSqhKNrK05i823"",""email"":""Director@evccnyc.org"",""name"":""Laura Sewell""}","New York","2024-04-08T20:17:07.000Z","32","E. 7th Street","NY","10003","https://www.instagram.com/itteast/",,,,"(212) 673-4610",,"https://www.thaiforthought.com/",,"Yes",,,true,,,"thaiforthought@gmail.com",,,,true,,,,,,,,,
"2230",2057,2057,2230,"The Izakaya on 4th","215 E. 4th Street, New York, NY 10003","Restaurants",,"215","E. 4th Street","10003",40.723801,-73.983498,"https://www.instagram.com/theizakaya_e4/","Yes","Opened","6:00 PM","10:00 PM","TUE: Closed
","Longstanding business observed in 2019 survey
","2023-10-30",,40.72371537891677,-73.98352347243359,"recs2IM3FdAMeISjG","Japanese,Sandwich",,"{""id"":""usrSSqhKNrK05i823"",""email"":""Director@evccnyc.org"",""name"":""Laura Sewell""}","New York","2024-04-08T20:17:56.000Z","215","E. 4th Street","NY","10003",,,,,"(646) 524-5251","Yes","https://www.theizakaya.nyc/4th",,,,,true,,,,,,,,,,,,,,,,
"2229",2056,2056,2229,"The Izakaya on 6th","326 E. 6th Street, New York, NY 10003","Restaurants",,"326","E. 6th Street","10003",40.72668,-73.98739,"https://www.instagram.com/izakayanyc/","Yes","Opened","6:00 PM","10:00 PM","MON - FRI Lunch: Noon - 3:00 PM
","Longstanding business observed in 2019 survey. Website and IG are current, lunch hours from sign on door.
","2023-10-30",,40.727056275347415,-73.98774751639284,"reck7PWqo7Lm1iJiZ","Japanese,Sandwich",,"{""id"":""usrSSqhKNrK05i823"",""email"":""Director@evccnyc.org"",""name"":""Laura Sewell""}","New York","2024-04-08T20:17:26.000Z","326","E. 6th Street","NY","10003",,,,,"(917) 697-7162","Yes","https://www.theizakaya.nyc/6th",,,,,true,,,,,,,,,,,,,,,,
"2228",2055,2055,2228,"New Up & Up Laundry","124 Avenue C, New York, NY 10009","Laundry","TN","124","Avenue C","10009",40.7245,-73.97824,,"Yes","Opened",,,,"Opened Spring 2023 (banner signage on location briefly occupied by Here to Clean), licensed to Chen family of 185 Ave C Up & Up location on 4/18/2023.
","2024-07-31","2023-05-01",40.724601101347304,-73.97846874889112,"recApv3DU2EhKXB7U","Cleaners,Laundromat",,"{""id"":""usrSSqhKNrK05i823"",""email"":""Director@evccnyc.org"",""name"":""Laura Sewell""}","New York","2024-07-31T17:48:12.000Z","124","Avenue C","NY","10009","https://www.nycompanyregistry.com/companies/up-up-laundry-inc/",,,,"(917) 639-3083",,,,,,,true,,,,,,,,,,,,,,,,
"2227",2054,2054,2227,"Upright Citizens Brigade UCB","239 E. 14th Street, New York, NY 10003","Arts & Culture","OB","439","E. 14th Street","10003",,,,,"Unknown",,,"Check out our [Comedy Classes](https://ucbcomedy.com/ny-class-shows/)!
","Satellite location for comedy classes opened spring 2024 in former 7/11 location.
","2024-07-18","2024-05-01",40.732857,-73.985379,"recGGarE6dn7ltTqq","Comedy",,"{""id"":""usrSSqhKNrK05i823"",""email"":""Director@evccnyc.org"",""name"":""Laura Sewell""}","New York","2024-07-18T17:25:40.000Z","239","E. 14th Street","NY","10003","https://evgrieve.com/2024/07/did-you-hear-one-about-upright-citizens.html ",,,,,,,,,,,,,,,,,,,,,,,,,,,
"2226",2053,2053,2226,"Venhue","21 Avenue B, New York, NY 10009","Restaurants","SB","21","Avenue B","10009",40.722099,-73.983063,"https://www.instagram.com/venhuenyc/","Yes","Opened",,,"Fast-paced chaotic communal dining tasting menu by [reservation](https://resy.com/cities/new-york-ny/venues/venhue?date=2024-04-26&seats=2) only.
","Soft-opened 9/14/23 in newly renovated building. IG and website are current.
","2024-02-19","2023-09-14",40.72221396251049,-73.98328934610372,"recLhdJ62uUESGYE4",,"South,Rear","{""id"":""usrSSqhKNrK05i823"",""email"":""Director@evccnyc.org"",""name"":""Laura Sewell""}","New York","2024-04-26T16:11:50.000Z","21","Avenue B","NY","10009",,,,,,"No","https://www.venhue.com/",,,,,,,,,,,,,,,,,,,,,
"2225",2052,2052,2225,"Memory Hotel ","106 3rd Avenue, New York, NY 10003","Restaurants",,"106","3rd Avenue","10003",40.732804,-73.987855,"https://www.instagram.com/memorymotelnyc/","Yes","Opened","4:00 PM","12:00 AM",,"Common Ground Pop-up opened 10/27/23 in briefly Blue Bird formerly Ugly Duckling Location, IG and website are current
","2023-10-30","2023-10-27",40.732710457583536,-73.9876165807211,"recEMItFGpUYU9qQi","Bar",,"{""id"":""usrSSqhKNrK05i823"",""email"":""Director@evccnyc.org"",""name"":""Laura Sewell""}","New York","2024-03-28T00:18:15.000Z","106","3rd Avenue","NY","10003","https://evgrieve.com/2023/10/montauks-memory-motel-is-popping-up-on.html",,,,"(212) 254-3825",,"https://memorymotelnyc.com/",,"Yes",,,,,,,,,,,,,,,,,,,
"2224",2051,2051,2224,"Sunflower East Village","88 2nd Avenue, New York, NY 10003","Restaurants","EVCC","88","2nd Avenue","10003",40.726812,-73.988628,"https://www.instagram.com/p/C7AVXJiusUv/","Yes","Opened","8:00 AM","8:00 PM",,"IG is current, website is for Sunflower Gramercy. Opened 5/15/2024: rebrand by Eros / Kitchen Sink owner. 
","2024-05-22","2024-05-15",40.726869749665575,-73.98890929647672,"recpGxJOS9QQVqF4p","Greek","South","{""id"":""usrSSqhKNrK05i823"",""email"":""Director@evccnyc.org"",""name"":""Laura Sewell""}","New York","2024-05-23T00:19:42.000Z","88","2nd Avenue","NY","10003","https://www.instagram.com/p/C7AVXJiusUv/",,,,"(917) 522-3355",,,,"Yes",,,,,,,,,,,,,,,,,,,
"2223",2050,2050,2223,"Bar Miller","620 E. 6th Street, New York, NY, 10009","Restaurants","EVCC","620","E. 6th Street","10009",40.723965,-73.980829,"https://www.instagram.com/barmillernyc/?hl=en","Yes","Opened","6:00 PM","12:00 AM","MON & TUE: Closed
","Opened late September 2023 in former Mayanoki location (owners are partners w chef from Rosella)
","2024-06-19","2023-09-26",40.724066259304934,-73.98064078988001,"recG1z8RGdLiFDv2R","Japanese,Omakase","East","{""id"":""usrSSqhKNrK05i823"",""email"":""Director@evccnyc.org"",""name"":""Laura Sewell""}","New York","2024-06-19T23:29:06.000Z","620","E. 6th Street",,"10009","https://evgrieve.com/2023/09/openings-bar-miller-on-6th-street.html",,,,"N/A",,"https://www.barmiller.com/",,"Yes",,,,,,,,,,,,,,,,,,,
"2222",2049,2049,2222,"The Market at Cure Thrift","91 3rd Avenue, New York, NY 10003","Retail","SB","91","3rd Avenue","10003",40.73209,-73.987999,"https://www.instagram.com/curethrift/","Yes","Opened",,,"Follow our [Instagram](https://www.instagram.com/curethrift/) for market info!
","Pop-up opened November 2023 in former reduced footprint Basics Plus location.
","2023-09-26","2023-11-01",40.73215605768121,-73.98799915214488,"recHHRurdjc6UJmsH","Vintage,Gifts & Home","North","{""id"":""usrSSqhKNrK05i823"",""email"":""Director@evccnyc.org"",""name"":""Laura Sewell""}","New York","2024-07-08T23:11:46.000Z","91","3rd Avenue","NY","10003","https://evgrieve.com/2023/09/about-cure-thrift-shops-community.html",,,,,,"http://www.curethriftshop.com/",,,,,,,,,,,,true,,,,,,,,,
"2221",2048,2048,2221,"Psychic","304 E. 5th Street, New York, NY 10003","Services","EVCC","304","E. 5th Street","10003",40.726501,-73.98851,,"Yes","Opened",,,,"Opened September 2023 in former Tamam location.
","2023-09-26","2023-09-01",40.726592495725725,-73.98856659295794,"recZwlXbnkv3f7s6b","Psychic","Center","{""id"":""usrSSqhKNrK05i823"",""email"":""Director@evccnyc.org"",""name"":""Laura Sewell""}","New York","2024-05-03T20:12:45.000Z","304","E. 5th Street","NY","10003","https://evgrieve.com/2023/09/a-psychic-for-this-block-of-5th-street.html",,,,"(914) 346-2504",,,,,,,,,,,,,,,,,,,,,,,
"2219",2047,2047,2219,"Conor's Goat","23 Avenue A, New York, NY 10009","Restaurants","EVCC","23","Avenue A","10009",40.722929,-73.985997,"https://www.instagram.com/conorsgoatnyc/?hl=en","Yes","Opened","4:00 PM","12:00 AM","THU - SAT: 4:00 PM - 1:00 AM
","Hours from Opened February 2024  in former Brooklyn Bean Roastery.
","2024-03-19","2024-02-19",40.72287030474904,-73.98586507196684,"recVUlum1246dYDdx","Bar",,"{""id"":""usrSSqhKNrK05i823"",""email"":""Director@evccnyc.org"",""name"":""Laura Sewell""}","New York","2024-03-28T00:18:15.000Z","23","Avenue A","NY","10009","https://evgrieve.com/2024/02/openings-ygf-malatang-on-3rd-avenue.html",,,,"(646) 410-0040",,"https://www.conorsgoat.com/",,,,,,,,"conorsgoatnyc@gmail.com",,,,,,,,,,,,,
"2218",2046,2046,2218,"Casa Bond","334 Bowery, New York, NY 10003","Restaurants",,"334","Bowery","10003",,,"https://www.instagram.com/casabondnoho/?hl=en",,"Unknown",,,,,"2023-09-26",,40.725890126812544,-73.99198695823036,"recmSpUFa5jtwHXoe",,,"{""id"":""usrSSqhKNrK05i823"",""email"":""Director@evccnyc.org"",""name"":""Laura Sewell""}","New York","2024-03-28T00:18:15.000Z","334","Bowery","NY","10003","https://evgrieve.com/2023/09/casa-bond-next-for-334-bowery.html",,,,,,,,,,,,,,"casabondnyc@gmail.com",,,,,,,,,,,,,
"2217",2045,2045,2217,"Kolachi","130 1st Avenue, New York, NY 10009","Restaurants","EVCC","130","1st Avenue","10009",40.727349,-73.98519,"https://www.instagram.com/kolachirolls/?hl=en","Yes","Opened","4:00 PM","12:00 AM","SAT & SUN: 11:00 AM - Midnight
","Quick-serve spot opened 11/2/2023 in former Sweet Generation location (vacant since 2020).
","2023-11-05","2023-11-02",40.72743477738561,-73.98539507202098,"rectzAbHP8UhNfMni","Pakistani",,"{""id"":""usrSSqhKNrK05i823"",""email"":""Director@evccnyc.org"",""name"":""Laura Sewell""}","New York","2024-04-08T20:23:08.000Z","130","1st Avenue","NY","10009","https://evgrieve.com/2023/11/openings-kolachi-on-1st-avenue.html",,,,,,"https://www.kolachirolls.com/",,,,,true,,,,,,,,,,,,,,,,
"2216",2044,2044,2216,"Curry Flavor","324 E. 6th Street, New York, NY 10003","Restaurants","SB","324","E. 6th Street","10003",40.726785,-73.987385,"https://www.instagram.com/curryflavorny/","Yes","Opened","11:00 AM","11:00 PM","FRI & SAT: 11:00 AM - 11:30 PM
","Hours from website. Opened October 2023 in former Kook Korean location. (Kook Rebrand? kept phone number).
","2024-05-30","2023-10-01",40.727072747336905,-73.98777998461887,"recnKEjrAYwKBOIDJ","Indian",,"{""id"":""usrSSqhKNrK05i823"",""email"":""Director@evccnyc.org"",""name"":""Laura Sewell""}","New York","2024-05-30T15:34:25.000Z","324","E. 6th Street","NY","10003","https://evgrieve.com/2023/09/signage-alert-curry-flavor-on-6th-street.html",,,"<https://www.makeitbutter.com/curry-flavor/egift-cards>
","(212) 254-0600","Yes","https://www.curryflavornyc.com/",,"Yes",,,true,"Yes",,"curryflavornyc@gmail.com",,,,,,,,,,,,,
"2215",2043,2043,2215,"FTC NYC","216 Avenue A, New York, NY 10009","Retail",,"216","Avenue A","10009",40.72993,-73.98053,"https://www.instagram.com/ftc_skateboarding/?hl=en","Yes","Opened","12:00 PM","7:00 PM","Check out our NYC-exclusive merch!
","SF pop-up considering lease opened September 2023 in former AAA Cleaners location.
","2023-09-22","2023-09-08",40.729959256841816,-73.98067155053641,"recigNLxao1rM3JAa","Skateboard Shop","North","{""id"":""usrSSqhKNrK05i823"",""email"":""Director@evccnyc.org"",""name"":""Laura Sewell""}","New York","2024-06-29T22:11:09.000Z","216","Avenue A","NY","10009","https://www.instagram.com/p/Cw5amvVLTNp/?hl=en",,,,,,"https://shop.ftcsf.com/",,,,,,,,,,,,,,,,"Yes",,,,,
"2214",2042,2042,2214,"Wegmans","770 Broadway, New York, NY 10003","Groceries","EVCC","770","Broadway","10003",40.73015,-73.991071,,,"Unknown",,,,"Opening October 18 in former Kmart location.
","2023-09-16","2023-10-18",40.730841624457994,-73.9914018471774,"reclClnOsX1Wi9Qxo","Supermarket",,"{""id"":""usrSSqhKNrK05i823"",""email"":""Director@evccnyc.org"",""name"":""Laura Sewell""}","New York","2024-03-28T00:18:15.000Z","770","Broadway","NY","10003","https://www.wegmans.com/news-media/press-releases/wegmans-astor-place-to-open-wednesday-october-18-2023/",,true,,,,,,,,,,,,,,,,,,,,,,,,,
"2213",2041,2041,2213,"Anytime Street","34 St. Mark's Place, New York, NY 10003","Restaurants","EVCC","34","St. Mark's Place","10003",40.6671,-73.69566,"https://www.instagram.com/anytime_street.stmarks/","Yes","Opened",,,,"Anytime Street/Cupbop Opened August 2022 in former Afternoon location (rebrand?) fast-food branch of K-town restaurant, karaoke & billiards club.
","2023-09-15","2022-08-01",40.728771785765865,-73.98810800188751,"recTFvkoVU2t1gE4g","Korean","West","{""id"":""usrSSqhKNrK05i823"",""email"":""Director@evccnyc.org"",""name"":""Laura Sewell""}","New York","2024-08-07T16:18:42.000Z","34","St. Mark's Place","NY","10003","https://evgrieve.com/2021/10/more-prominent-coming-soon-signage-for.html",,,,,,"https://www.anytimestreet.com",,,,,true,,,,,,,,,,,,,,,,
"2212",2040,2040,2212,"EVC Caff","317 E. 5th Street, New York, NY 10003","Cafes and Desserts","EVCC","317","E. 5th Street","10003",40.72665,-73.98802,,"Yes","Opened","7:30 AM","6:00 PM",,"Opened September 2023. 
","2023-09-15","2023-09-01",40.726521110354,-73.98835013196718,"rec8tHZzf0dzX5VWB","Cafe","East","{""id"":""usrSSqhKNrK05i823"",""email"":""Director@evccnyc.org"",""name"":""Laura Sewell""}","New York","2024-07-03T20:36:48.000Z","317","E. 5th Street","NY","10003","https://evgrieve.com/2023/09/openings-evc-caffe-on-5th-street.html",,,,"(929) 462-7272",,,,,,,,,,,,,,,,,,,,,,,
"2211",2039,2039,2211,"Potenza Centrale","38 Avenue B, New York, NY 10009","Restaurants","JK","38","Avenue B","10009",40.72281,-73.983091,"https://www.instagram.com/potenzacentrale/","Yes","Opened","11:00 AM","10:00 PM","FRI & SAT: 11:00 AM - 211:00 PM
SUN: 11:00 AM - 9:00 PM
MON: Closed	
","Website and IG are current, winter hours from website. Opened 11/21/2023 in former KC Gourmet Empanadas location by former Max Restaurant owner Luigi Iasilli.
","2023-11-21","2023-11-21",40.72276834751787,-73.98290679257309,"rec8iHa9NCIqfeuie","Italian",,"{""id"":""usrSSqhKNrK05i823"",""email"":""Director@evccnyc.org"",""name"":""Laura Sewell""}","New York","2024-03-28T00:18:15.000Z","38","Avenue B","NY","10009","https://evgrieve.com/2023/11/openings-potenza-centrale-on-avenue-b.html",,,,"(646) 852-6995","Yes","https://potenzacentrale.com/",,"Yes",,,,,,,,,,,,,,,,,,,
"2210",2038,2038,2210,"Mr. Kim","22 St. Mark's Place, New York, NY 10003","Services","JK","22","St. Mark's Place","10003",40.728836,-73.988899,,"No","Closed","11:00 AM","11:00 PM",,"PERMANENTLY CLOSED after only a few months at this location. Relocated to former Waga location from 22 St. Mark's Place September 2023, after taking over Aria Piercing by July 2022.
","2024-01-09","2023-09-01",40.729010635917255,-73.98866720268715,"reckIOkdk7kMcYOxh","Piercing,Tattoo",,"{""id"":""usrSSqhKNrK05i823"",""email"":""Director@evccnyc.org"",""name"":""Laura Sewell""}","New York","2024-03-28T00:18:15.000Z","22","St. Mark's Place","NY","10003","https://evgrieve.com/2024/01/mr-kim-quickly-leaves-st-marks-place.html",,,," (646) 649-4910",,,,,,,,,,,,"2024-01-09",,,,,,,,,,,
"2209",2037,2037,2209,"Hello Yam!","443 E. 9th Street, New York, NY 10009","Cafes and Desserts","JK","443","E. 9th Street","10009",40.7275,-73.98293,"https://www.instagram.com/helloyam_eastvillage/","Yes","Opened","1:00 PM","9:00 PM","TUE: Closed
FRI & SAT: 1:00 PM - 10:00 PM
","Opened 10/06/2023 in former Anine Eyelash location.
","2023-10-10","2023-10-06",40.72742347329955,-73.9830246604257,"recHhRiatIRZDryp5","Cafe,Japanese",,"{""id"":""usrSSqhKNrK05i823"",""email"":""Director@evccnyc.org"",""name"":""Laura Sewell""}","New York","2024-04-08T20:15:19.000Z","443","E. 9th Street","NY","10009","https://evgrieve.com/2023/09/hello-to-hello-yam-on-9th-street.html",,,," (347) 222-6434",,,,,,,true,,,,,,,,,,,,,,,,
"2208",2036,2036,2208,"East Village Mini Market","153 Avenue A, New York, NY 10009","Groceries","EVCC","153","Avenue A","10009",40.72775,-73.982449,,"Yes","Opened",,,,"Opened 9/21/2023  in former Tompkins Finest Deli & Grocery location.	
","2023-09-22","2023-09-21",40.72758806937302,-73.98242930755517,"rec3Qv95my3tCnD8Q","Deli",,"{""id"":""usrSSqhKNrK05i823"",""email"":""Director@evccnyc.org"",""name"":""Laura Sewell""}","New York","2024-03-28T00:18:15.000Z","153","Avenue A","NY","10009","https://evgrieve.com/2023/09/east-village-mini-market-debuts-on.html",,,,,,,,,,,,,,,,,,,,,,,,,,,
"2207",2035,2035,2207,"Cafe La Fe","70 E. 1st Street, New York, NY 10003","Cafes and Desserts","EVCC","70","E. 1st Street","10003",40.7236,-73.98879,"https://www.instagram.com/cafelafenyc/","Yes","Opened","8:00 AM","8:00 PM","SAT & SUN: 9:00 AM - 8:00 PM
","Opened 9/1/2023 in former Pinky's Space location.
","2023-09-10","2023-09-01",40.72341408707991,-73.9887727782318,"recCwkXm6dl4SUhKI","Cafe,Latin",,"{""id"":""usrSSqhKNrK05i823"",""email"":""Director@evccnyc.org"",""name"":""Laura Sewell""}","New York","2024-04-08T20:19:03.000Z","70","E. 1st Street","NY","10003","https://evgrieve.com/2023/09/openings-cafe-la-fe-on-1st-street.html",,,,,,,true,,,,,,,"info@pinkys.space",,,,true,,,,,,,,,
"2206",2034,2034,2206,"Smoke House / Mjay's Dispensary / Mjay Convenience","42 Avenue A, New York, NY 10009","Retail","EVCC","42","Avenue A","10009",,,,"Yes","Opened",,,"21+
","UNLICENSED. Located between O'Flaherty's (44) and Two Boots (42). Hours updated by business 7/3/2023, Mjay Convenience observed 10/6/2023 in southern third of store (enter through Smoke House). 
","2024-07-26","2023-07-03",40.72373756575096,-73.98520827995736,"reci0fPCdKV0dNlQm","Cannabis",,"{""id"":""usrSSqhKNrK05i823"",""email"":""Director@evccnyc.org"",""name"":""Laura Sewell""}","New York","2024-07-31T04:54:11.000Z","42","Avenue A","NY","10009",,,,,,,,,,true,"Two Boots reduced footprint in . . . ",,,,,,,,,,,,,,,,,
"2205",2033,2033,2205,"East Village Smoke Shop","89 Avenue A, New York, NY 10009","Retail","EVCC","89","Avenue A","10009",,,,"Yes","Opened",,,,"LICENSED for tobacco. Online presence is for store at 177 1st Avenue. Observed closed with new signage July 2022; observed in 2019 storefront survey, marked vacant in 2021 storefront survey. 
","2023-08-28","2022-01-01",40.725277229029025,-73.98411476876258,"recU6R0AnLOWjXZ8H","Smoke Shop",,"{""id"":""usrSSqhKNrK05i823"",""email"":""Director@evccnyc.org"",""name"":""Laura Sewell""}","New York","2024-07-31T04:54:39.000Z","89","Avenue A","NY","10009",,,,,,,,,,,"Longstanding business",,,,,,,,,,,,,,,,,
"2204",2032,2032,2204,"Rainbow Box Convenience","206 E. 6th Street, New York, NY 10003","Retail","EVCC","206","E. 6th Street","10003",40.72794,-73.990387,,"No","Closed",,,,"PERMANENTLY CLOSED. Observed under construction spring 2024. First observed signage 8/26/23.
","2024-05-01","2023-09-01",40.72805592,-73.99033427,"recHv3jzw7WEr6RyQ","Smoke Shop","East","{""id"":""usrSSqhKNrK05i823"",""email"":""Director@evccnyc.org"",""name"":""Laura Sewell""}","New York","2024-07-31T18:48:33.000Z","206","E. 6th Street","NY","10003",,,,,,,,,,,,,,,,,"2024-04-30",,,,,,,,,,,
"2203",2031,2031,2203,"Qik Nez Convenience","32 St. Mark's Place, New York, NY 10003","Retail","EVCC","32","St. Mark's Place","10003",40.728674,-73.988473,,,"Unknown",,,,"Opening soon in former Suki location (previously Min Sushi).
","2023-09-14",,40.7288129667531,-73.98820180283464,"recv08ORGQSFoVhNM","Smoke Shop","West","{""id"":""usrSSqhKNrK05i823"",""email"":""Director@evccnyc.org"",""name"":""Laura Sewell""}","New York","2024-07-31T18:48:58.000Z","32","St. Mark's Place","NY","10003","https://evgrieve.com/2023/08/noted_25.html",,,,,,,,,,"Suki closed June 2023",,,,,,,,,,,,,,,,,
"2202",2030,2030,2202,"Brix NYC","170 Avenue B, New York, NY 10009","Retail","EVCC","170","Avenue B","10009",40.727297,-73.979776,"https://www.instagram.com/brixwineshopnyc/?hl=en","Yes","Opened","12:00 PM","8:00 PM","FRI & SAT: 12:00 PM - 9:00 PM
","RELOCATED back to South Storefront in September 2023. Hours from website, IG is intermittent.
RELOCATED one storefront north in February 2021, into former Rue St. Denis location. Occupied South Storefront since 2016, after relocating from E. 9th Street (2008-2016).
","2023-09-01","2008-01-01",40.72727744936625,-73.97962242123432,"recFMOguVvaZxwu4a","Wine","South","{""id"":""usrSSqhKNrK05i823"",""email"":""Director@evccnyc.org"",""name"":""Laura Sewell""}","New York","2024-04-08T20:19:55.000Z","170","Avenue B","NY","10009","https://evgrieve.com/2023/08/barnyard-express-will-return-to-avenue-b.html",,,,"(212) 777-0691",,"http://www.brixwines.com/",true,,,,,,,"info@brixwines.com",,,,true,,,,,,,,,
"2201",2029,2029,2201,"Barnyard Express","170 Avenue B, New York, NY 10009","Restaurants","EVCC","170","Avenue B","10009",40.727297,-73.979776,"https://www.instagram.com/barnyardcheese/?hl=en","Yes","Opened","12:00 PM",,,"Soft-opened December 2023 in former latest Brix Wines location.
","2024-05-09",,40.72727744936625,-73.97962242123432,"rec1zHirFEDHBLOQw","Sandwich","North","{""id"":""usrSSqhKNrK05i823"",""email"":""Director@evccnyc.org"",""name"":""Laura Sewell""}","New York","2024-05-09T23:53:19.000Z","170","Avenue B","NY","10009","https://evgrieve.com/2023/08/barnyard-express-will-return-to-avenue-b.html",,,,,,,true,,,,,,,,,,,true,,,,,,,,,
"2200",2028,2028,2200,"Quest Realty Group","280 E. 10th Street, New York, NY 10009","Services","EVCC","280","E. 10th Street","10009",40.72797,-73.98309,,"No","Closed",,,,"Location PERMANENTLY CLOSED. Observed for rent 4/2/2024 after being papered over in early 2024. Observed in 2019 storefront survey in former Thirstea location.
","2024-04-03","2019-01-01",40.72820024990821,-73.98309662211865,"recF2a4sWHp0empAZ","Realtor","West","{""id"":""usrSSqhKNrK05i823"",""email"":""Director@evccnyc.org"",""name"":""Laura Sewell""}","New York","2024-04-03T22:59:18.000Z","280","E. 10th Street","NY","10009",,,,,,"No",,,,,,,,,,,"2024-01-01",,,,,,,,,,,
"2199",2027,2027,2199,"Hokkaido Baked Cheese Tart","166 2nd Avenue, New York, NY 10003","Cafes and Desserts","OB","166","2nd Avenue","10003",40.73016,-73.98644,,"Yes","Opened","9:00 AM","9:00 PM","FRI & SAT: 9:00 AM - 10:00 PM
","Opened in former Luna Cafe location (latest of several rebrands). Do not list IG, is for K-Town shop. Large Asian chain expanding to US, does not yet meet NYS chain standards. Hours on website.
","2023-10-16",,40.73007263259476,-73.98658516015117,"recPgQInTtuA0KhUN","Bakery",,"{""id"":""usrSSqhKNrK05i823"",""email"":""Director@evccnyc.org"",""name"":""Laura Sewell""}","New York","2024-07-15T20:00:41.000Z","166","2nd Avenue","NY","10003","https://evgrieve.com/2023/06/signage-alert-hokkaido-baked-cheese.html",,,,"(212) 614-1507

","Yes","https://www.hokkaidobakedcheesetart.com/location-hours ",,,,,true,,,,,,,,,,,,,,,,
"2198",2026,2026,2198,"Dumpling N Dips","5 St. Mark's Place, New York, NY 10003","Restaurants","OB","5","St. Mark's Place","10003",40.729528,-73.989262,"https://www.instagram.com/dumplingndips/","Yes","Opened","12:00 PM","10:00 PM","FRI & SAT: Noon - 11:00 PM		
","Opened January 2022 in former Spot Dessert Shoppe location. IG and website are current, hours from website.
","2024-08-07","2022-01-01",40.72940835,-73.98931055,"recCUHHHHYvemCy3X","Thai","East","{""id"":""usrSSqhKNrK05i823"",""email"":""Director@evccnyc.org"",""name"":""Laura Sewell""}","New York","2024-08-07T16:25:31.000Z","5","St. Mark's Place","NY","10003",,,,,"(929) 429-4656","Yes","https://www.dumplingndips.com",,,,,true,,,"contact@dumplingndips.com",,,,,,,,,,,,,
"2197",2025,2025,2197,"Cozmos","280 E. 10th Street, New York, NY 10009","Retail","EVCC","280","E. 10th Street","10009",40.727983,,"https://www.instagram.com/cozmosretail","Yes","Opened","11:00 AM","7:00 PM","MON: Closed
","Laura accepted hours from Google. Opened 8/1/2023. Observed 8/19/23.			
","2023-08-21","2023-08-01",40.72820024990821,-73.98309662211865,"rec3whwIMaCxIYLT0","Gallery","East","{""id"":""usrSSqhKNrK05i823"",""email"":""Director@evccnyc.org"",""name"":""Laura Sewell""}","New York","2024-03-28T00:18:15.000Z","280","E. 10th Street","NY","10009","https://www.instagram.com/p/CumqntTx5xl/",,,,,,"https://www.cozmosretail.com/",,,,,,,,"explore@cozmosretail.com",,,,,,,,,,,,,
"2196",2024,2024,2196,"My Sunny Laundry","69 Avenue C, New York, NY 10009","Laundry","TN","69","Avenue C","10009",40.72288,-73.98006,,"Yes","Opened","6:00 AM","10:00 PM","Last wash 9:00 PM!
","CHAIN. Opened Summer 2023 in former Avenue C Laundromat location.  New Hours posted on door 8/2/2024
","2024-08-02","2023-07-01",40.72282273773028,-73.97978973693624,"recXW6aFvmM14l6N8","Laundromat",,"{""id"":""usrSSqhKNrK05i823"",""email"":""Director@evccnyc.org"",""name"":""Laura Sewell""}","New York","2024-08-05T17:44:44.000Z","69","Avenue C","NY","10009",,,true,,"(646) 370 - 1845",,"https://www.mysunnylaundry.com/laundromat-new-york-city ",,,,,,,,"info@mysunnylaundry.com",,,,,,,,,,,,,
"2195",2023,2023,2195,"To Eat Sushi","241 E. 10th Street, New York, NY 10003","Restaurants",,"241","E. 10th Street","10003",40.72901,-73.9847,"https://www.instagram.com/toeat.sushi/","Yes","Opened","4:00 PM","1:00 AM","[Order online](https://pos.chowbus.com/online-ordering/store/14060) for pickup!
SAT & SUN: 11:30 AM - 1:00 AM
","Opened in former The Braised Shop location July 2023. Hours from IG profile
","2023-10-30","2023-07-01",40.72896079324266,-73.9848643587161,"recrBVNRnAjRK9ogC","Japanese","Center","{""id"":""usrSSqhKNrK05i823"",""email"":""Director@evccnyc.org"",""name"":""Laura Sewell""}","New York","2024-05-30T20:12:42.000Z","241","E. 10th Street","NY","10003",,,,,"(516) 853-3838",,,,,,,true,,,,,,,,,,,,,,,,
"2194",2022,2022,2194,"Hay Hay Roasted","167 1st Avenue, New York, NY 10003","Restaurants","EVCC","167","1st Avenue","10003",40.729132,-73.984599,"https://www.instagram.com/hayhayroastednyc/","No","Closed","12:00 PM","10:00 PM","FRI - SAT: 12:00 PM - 11:00 PM
","PERMANENTLY CLOSED, adding EV favorites to Chinatown shop menu. IG is current. Opened 12/16/2023.
","2024-05-20","2023-12-16",40.72898267445254,-73.98429067847096,"recUHutZaS3Rl0OTz","Chinese",,"{""id"":""usrSSqhKNrK05i823"",""email"":""Director@evccnyc.org"",""name"":""Laura Sewell""}","New York","2024-05-29T19:14:55.000Z","167","1st Avenue","NY","10003","https://www.instagram.com/p/C7g4vpJu8_R/j",,,,"(212) 381-1612",,"https://www.hayhayroasted.com/",,,,,true,,,"Hayhayroasted167@gmail.com",,"2024-05-28",,,,,,,,,,,
"2193",2021,2021,2193,"Roasted NYC","128 2nd Avenue, New York, NY 10003","Cafes and Desserts","EVCC","128","2nd Avenue","10003",40.728321,-73.987619,"https://www.instagram.com/roasted.nyc/","No","Closed",,,,"PERMANENTLY CLOSED spring 2024. Opened 8/15/2023 in former NYC Kind Cafe, a cannabis related business. (formerly Paint Puff n Peace)
","2024-06-10","2023-08-15",40.7284259125301,-73.98778334447101,"recgOOKKuNnMYhC4m","Cafe","North","{""id"":""usrSSqhKNrK05i823"",""email"":""Director@evccnyc.org"",""name"":""Laura Sewell""}","New York","2024-07-29T19:20:17.000Z","128","2nd Avenue","NY","10003","https://evgrieve.com/2024/06/what-might-be-next-for-this-2nd-avenue.html",,,,,,,,,,,,,,,,"2024-05-01",,,,,,,,,,,
"2192",2020,2020,2192,"Raj Mahal","322 E. 6th Street, New York, NY 10009","Restaurants","EVCC","322","E. 6th Street","10009",,,,,"Unknown",,,,"Temporarily closed? since summer 2023.Observed open in 2022 after temporary closure March 2020.
","2023-08-25",,40.72708647456071,-73.9878124533629,"recZsmGfEt9BfhXpC","Indian",,"{""id"":""usrSSqhKNrK05i823"",""email"":""Director@evccnyc.org"",""name"":""Laura Sewell""}","New York","2024-05-23T00:26:34.000Z","322","E. 6th Street","NY","10009","https://evgrieve.com/2023/08/reader-report-kook-has-closed-on-6th.html",,,,,,,,,,,true,,,,,,,,,,,,,,,,
"2191",2019,2019,2191,"El Primo Red Tacos / Tacos El Porky","151 Avenue A,  New York, NY 10009","Restaurants","EVCC","151","Avenue A","10009",40.727657,-73.982589,"https://www.instagram.com/elprimoredtacos/","No","Closed",,,,"PERMANENTLY CLOSED after temporary winter closure. Opened September 2023 in former Mamani Pizza location. IG is also for Miami location.
","2024-06-10","2023-09-07",40.72752769133403,-73.98247261877688,"rec29kHYCGuAvkB13","Mexican",,"{""id"":""usrSSqhKNrK05i823"",""email"":""Director@evccnyc.org"",""name"":""Laura Sewell""}","New York","2024-06-20T00:16:27.000Z","151","Avenue A","NY","10009","https://evgrieve.com/2024/06/thats-all-folks-tacos-el-porky-closes.html",,,,"(212) 863-9391",,"http://elprimoredtacos.com/",,,,,,,,,,"2024-06-10",,,,,,,,,,,
"2190",2018,2018,2190,"VACANT ","325 E. 5th Street, New York, NY 10009",,"EVCC","325","E. 5th Street","10009",,,,,"Unknown",,,,"For rent signs observed August 2023 in east and west storefronts formerly used by Interfaith Center 
","2023-08-10",,40.726463456510764,-73.98821304244703,"rec4gaiScnOpiDCK8",,,"{""id"":""usrSSqhKNrK05i823"",""email"":""Director@evccnyc.org"",""name"":""Laura Sewell""}","New York","2024-08-06T22:57:36.000Z","325","E. 5th Street","NY","10009",,,,,,,,,,,,,,,,,,,,,,,,,,,,
"2189",2017,2017,2189,"VACANT","118 E. 1st Street, New York, NY 10009",,,"118","E. 1st Street","10009",,,,,"Unknown",,,,"New Commercial Space in newly-constructed building.
","2023-08-10",,40.72234614897766,-73.98664443797722,"rechguFifcj51apPJ",,,"{""id"":""usrSSqhKNrK05i823"",""email"":""Director@evccnyc.org"",""name"":""Laura Sewell""}","New York","2024-08-06T22:27:14.000Z","118","E. 1st Street","NY","10009",,,,,,,,,,,,,,,,,,,,,,,,,,,,
"2188",2016,2016,2188,"Convenience Tobacco","14 1st Avenue, New York, NY 10009","Retail","OB","14","1st Avenue","10009",40.723335,-73.988072,,"No","Closed",,,,"PERMANENTLY CLOSED. Store for rent sign observed 5/1/24 on Google. UNLICENSED for tobacco & e-cigarettes (licensed for general food services only). Opened late April 2023 in former Runtz tobacco location (rebrand?)
","2024-05-01","2023-04-01",40.7234140411245,-73.9883109901953,"recX54tMtrjCzVeqN","Smoke Shop","North","{""id"":""usrSSqhKNrK05i823"",""email"":""Director@evccnyc.org"",""name"":""Laura Sewell""}","New York","2024-07-30T20:47:35.000Z","14","1st Avenue","NY","10009","https://evgrieve.com/2023/04/convenience-tobacco-rises-from-ashes-of.html",,,,"(718) 522-0228",,,,,true,"Runtz Tobacco",,,,,,"2024-05-01",,,,,,,,,,,
"2187",2015,2015,2187,"Hidden Tiger","212 Avenue A, New York, NY 10009","Restaurants","OB","212","Avenue A","10009",40.72973,-73.9808,"https://www.instagram.com/hiddentigernyc/","Yes","Opened","5:00 PM","11:00 PM","FRI & SAT: 5:00 PM - 1:00 AM
","Still using Fat Buddha IG. Changed name from ""Fat Tiger."" Speakeasy from Fat Buddha operators opened March 2023.
","2023-03-27","2023-03-24",40.72986594664642,-73.98074013090198,"rec2satFCwO5LMbmQ","Bar,Korean",,"{""id"":""usrSSqhKNrK05i823"",""email"":""Director@evccnyc.org"",""name"":""Laura Sewell""}","New York","2024-07-12T18:24:42.000Z","212","Avenue A","NY","10009","https://ny.eater.com/2023/4/6/23663865/nyc-restaurant-openings-april-2023",,,,,,"https://hiddentigernyc.com/ ",,"Yes",,,true,,,"info@cafejoah.com",,,,,,,,,,,,,
"2186",2014,2014,2186,"MOI","250 E. Houston Street, New York, NY 10002","Services","EVCC","250","E. Houston Street","10002",40.7221,-73.98491,,"Yes","Opened","10:00 AM","8:00 PM","SAT: 9:00 AM - 7:00 PM
SUN: 10:00 AM - 6:00 PM
MON: 11:00 AM - 8:00 PM
Book your appointment [here](https://go.booker.com/location/matterofinstinct/contact)!
","Opened summer 2023 in former Neighborhood Cut and Shave location. Hours from booking link
","2023-08-10","2023-07-01",40.72193701879758,-73.98532051639553,"recrHFM1FbFugpjtN","Hair",,"{""id"":""usrSSqhKNrK05i823"",""email"":""Director@evccnyc.org"",""name"":""Laura Sewell""}","New York","2024-05-16T21:11:40.000Z","250","E. Houston Street","NY","10002",,,,,"(212) 390-1880",,"https://moibarber.com/",,,,,,,,"info@moibarber.com",,,,,,,,,,,,,
"2185",2013,2013,2185,"Decorazon Gallery","250 E. Houston Street, New York, NY 10009","Arts & Culture","PG","250","E. Houston Street","10009",40.722073,-73.984836,"https://www.instagram.com/decorazongallery/","Yes","Opened","11:00 AM","6:00 PM","Visit NYC pop-up website for [current exhibition](https://www.decorazongallery.com/exhibitions-home)!
SUN: Closed
","Pop-up in newly renovated store front. Opened June 2023. Hours from NYC pop-up website.
","2023-08-10","2023-06-01",40.72193701879758,-73.98532051639553,"recAhqNP8nt96MMUN","Gallery",,"{""id"":""usrSSqhKNrK05i823"",""email"":""Director@evccnyc.org"",""name"":""Laura Sewell""}","New York","2024-06-29T22:12:37.000Z","250","E. Houston Street","NY","10009",,,,,,,"https://www.decorazongallery.com/",,,,,,,,,,,,,,,,,,,,,
"2184",2012,2012,2184,"East Side Story","265 E. 10th Street, New York, NY 10009","Restaurants","EVCC","265","E. 10th Street","10009",40.728505,-73.983187,"https://www.instagram.com/eastsidestory10th/?hl=en","Yes","Opened","12:00 PM","4:00 AM",,"Opened July 2023 in former Ahimsa Garden location. Laura observed name on sandwich board, no website or IG posts yet, Google hours confirmed by business mid-July 2023.
","2023-08-30",,40.72835674872927,-73.98342490921335,"recSY45sgKIB4R8dM","Middle Eastern,Hookah Bar",,"{""id"":""usrSSqhKNrK05i823"",""email"":""Director@evccnyc.org"",""name"":""Laura Sewell""}","New York","2024-03-28T00:18:15.000Z","265","E. 10th Street","NY","10009",,,,,"(646) 386-7897",,,,"Yes",,,,"Yes",,,,,,,,,,,,,,,
"2183",2011,2011,2183,"Rice Bird","334 E. 9th Street, New York, NY 10003","Restaurants","OB","334","E. 9th Street","10003",40.728542,-73.985988,"https://www.instagram.com/rice_bird_nyc/","Yes","Opened","3:00 PM","9:30 PM","FRI - SUN: 12:00 PM - 9:30 PM
TUE: Closed
","IG & Website are current. Opened in long-vacant location (looked like an office)
","2024-07-15","2023-12-01",40.728782565633615,-73.98631481911944,"recxjobMBfJFAdiXy","Chinese","West","{""id"":""usrSSqhKNrK05i823"",""email"":""Director@evccnyc.org"",""name"":""Laura Sewell""}","New York","2024-07-15T21:40:08.000Z","334","E. 9th Street","NY","10003","https://evgrieve.com/2023/08/signage-alert-anjelly-on-st-marks-place.html",,,,,"Yes","https://www.ricebirdnyc.com/ ",,"Yes",,,true,,,,,,,,,,,,,,,,
"2182",2010,2010,2182,"Anjelly","103 St. Mark's Place, New York, NY 10009","Cafes and Desserts","EVCC","103","St. Mark's Place","10009",40.727338,-73.984239,"https://www.instagram.com/anjellynyc/?hl=en","Yes","Opened","2:00 PM","9:00 PM","FRI & SAT: 1:00 PM - 10:00 PM
SUN: 1:00 PM - 9:00 PM
","Opened August 2023 in former CJ Tattoo location. IG is current, biz updated Google hours 8/10/2023.					
","2023-08-07","2023-08-01",40.72736058045396,-73.98471318898808,"recAK3D4xkKe2dFB7","Vietnamese",,"{""id"":""usrSSqhKNrK05i823"",""email"":""Director@evccnyc.org"",""name"":""Laura Sewell""}","New York","2024-06-29T22:15:24.000Z","103","St. Mark's Place","NY","10009",,,,,,,,,,,,true,,,,,,,,,,,,,,,,
"2181",2009,2009,2181,"Urban Air Convenience","149 1st Avenue, New York, NY 10003","Retail","TN","149","1st Avenue","10003",40.728449,-73.985,,"No","Closed",,,,"PERMANENTLY CLOSED. Observed papered over July 2024. Tobacco and e-cig licenses look active but no details. Opening soon in former Beer & Smoke Shop location as of August 2023.
","2023-08-15",,40.72832674083874,-73.98475987116,"recHerIsVWOhNnX8J","Smoke Shop","North","{""id"":""usrSSqhKNrK05i823"",""email"":""Director@evccnyc.org"",""name"":""Laura Sewell""}","New York","2024-07-29T18:34:41.000Z","149","1st Avenue","NY","10003","https://evgrieve.com/2023/08/like-breath-of-fresh-urban-air-on-1st.html",,,,"(646) 590-2070",,,,,,"Beer & Smoke shop closed 2023.",,,,,,"2024-07-25",,,,,,,,,,,
"2180",2008,2008,2180,"Buffalo Wild Wings GO","225 1st Avenue, New York, NY 10003","Restaurants","EVCC","225","1st Avenue","10003",40.73203,-73.98241,,"Yes","Opened","11:00 AM","12:00 AM",,"CHAIN. Opened spring 2024 in former (briefly) Crab du Jour location
","2024-06-19",,40.73092301591849,-73.98288305203276,"recjC1c9tBHPhbHo5","Wings",,"{""id"":""usrSSqhKNrK05i823"",""email"":""Director@evccnyc.org"",""name"":""Laura Sewell""}","New York","2024-06-19T22:25:19.000Z","225","1st Avenue","NY","10003",,,true,,"(646) 837-5747",,"https://www.buffalowildwings.com/locations/us/ny/new-york/225-1st-avenue/sports-bar-1736/",,"Yes",,,,,,,,,,,,,,,,,,,
"2179",2007,2007,2179,"Motel No Tell","210 Avenue A, New York, NY 10009","Restaurants",,"210","Avenue A","10009",40.7298,-73.98061,"https://www.instagram.com/motelnotellnyc/","Yes","Opened","4:00 PM",,"MON - WED: 4:00 PM - Midnight
THU: 4:00 PM - 1:00 AM
FRI: 4:00 PM - 2:00 AM
SAT: 10:00 AM - 2:00 AM
SUN: 10:00 AM - Midnight
","Opened 9/2/2023 in long-vacant former Percy's location with never-opened Relax at Blondie's stips.
","2023-09-22","2023-09-02",40.72981929123175,-73.98077261697986,"recZusx8w6TafKpej","Bar",,"{""id"":""usrSSqhKNrK05i823"",""email"":""Director@evccnyc.org"",""name"":""Laura Sewell""}","New York","2024-03-28T00:18:15.000Z","210","Avenue A","NY","10009","https://evgrieve.com/2023/09/openings-motel-no-tell-on-avenue-a.html",,,,,,,,"Yes",,,,"Yes",,,,,,,,,,,,,,,
"2178",2006,2006,2178,"Olde Brooklyn Bagel Shoppe","118 2nd Avenue, New York, NY 10009","Cafes and Desserts","EVCC","118","2nd Avenue","10009",40.72794,-73.9877,,,"Unknown",,,,"Opening soon in former Sanshi Noodle House location (formerly Bar Virage)
","2024-07-15",,40.72806363200326,-73.98804318478493,"recKXYGUtjjZBi9gm","Cafe",,"{""id"":""usrSSqhKNrK05i823"",""email"":""Director@evccnyc.org"",""name"":""Laura Sewell""}","New York","2024-07-15T15:57:12.000Z","118","2nd Avenue","NY","10009","https://evgrieve.com/2023/08/olde-brooklyn-bagel-shoppe-coming-to.html",,,,,,,,,,,,,,,,,,,,,,,,,,,
"2177",2005,2005,2177,"Relative Arts ","367 E. 10th Street, New York, NY 10009","Retail",,"367","E. 10th Street","10009",40.72655,-73.97868,"https://www.instagram.com/relativeartsnyc/","Yes","Opened","12:00 PM","6:00 PM","THU - SUN only
Incubator for Indigenous Futurism
","Opened April 1 2023. 	
","2024-05-30","2023-04-01",40.72645938329324,-73.97890831034563,"recPzY7AOik9nVqbD","Fashion",,"{""id"":""usrSSqhKNrK05i823"",""email"":""Director@evccnyc.org"",""name"":""Laura Sewell""}","New York","2024-05-30T16:23:15.000Z","367","E. 10th Street","NY","10009",,,,,,,"https://www.relativeartsnyc.com/",,,,,,,,"info@relativeartsnyc.com",,,,true,,,"<https://www.gofundme.com/f/help-grow-the-relative-arts-community-center>
",,,,,,
"2176",2004,2004,2176,"Nuovo Pizza","105 E. 9th Street, New York, NY 10009","Groceries",,"105","E. 9th Street","10009",40.73055,-73.99002,,,"Unknown","6:00 AM","6:00 PM",,"PERMANENTLY CLOSED late 2022. Phone not in service.
Confirmed hours by phone 8/2/2022
","2023-02-01",,40.73046275594458,-73.99024369573766,"recasreTeKBTdJ1Fo","Deli",,"{""id"":""usrSSqhKNrK05i823"",""email"":""Director@evccnyc.org"",""name"":""Laura Sewell""}","New York","2024-03-28T00:18:15.000Z","105","E. 9th Street","NY","10009","https://evgrieve.com/2023/07/pizza-signage-update-on-9th-street.html",,,,"(646) 490-6620",,,,,,,,,,,,,,,,,,,,,,,
"2175",2003,2003,2175,"First Avenue Convenience & More","199 1st Avenue, New York, NY 10009","Retail","OB","199","1st Avenue","10009",40.730279,-73.983689,,"Yes","Opened",,,,"UNLICENSED for tobacco and e-cigarettes. Opened July 2023 in former New Phoenix Laundry location. Laura observed opened
","2024-07-25",,40.730151821499824,-73.98344250313386,"rec7tv7BO1hmb98Cx","Smoke Shop",,"{""id"":""usrSSqhKNrK05i823"",""email"":""Director@evccnyc.org"",""name"":""Laura Sewell""}","New York","2024-07-31T04:48:31.000Z","199","1st Avenue","NY","10009",,,,,,,,,,true,"New Phoenix Laundry closed . . . ",,,,,,,,,,,,,,,,,
"2174",2002,2002,2174,"Deer Gallery","287 E. 10th Street, New York, NY 10009","Arts & Culture",,"287","E 10th Street","10009",40.72803,-73.98239,,"Yes","Opened","12:00 PM","5:00 PM","SAT Only or by appointment
","Project of Joyce Theater. Leasing with plans to purchase former Boys Club location. 
","2023-08-02","2023-05-25",40.728049227754084,-73.98268895980785,"recHftHUjqa1Sx2Gy","Gallery",,"{""id"":""usrSSqhKNrK05i823"",""email"":""Director@evccnyc.org"",""name"":""Laura Sewell""}","New York","2024-04-03T20:59:32.000Z","287","E. 10th Street","NY","10009",,,,,"(646) 450-7750",,,,,,,,,,"deergallery@myyahoo.com",,,,,,,,,,,,,
"2173",2001,2001,2173,"Horus dining room ","293 E. 10th Street, New York, NY 10009","Restaurants","EVCC","293","E. 10th Street","10009",40.72792,-73.98195,,,"Unknown",,,,"Horus hookahbar expanded dining room summer 2023 in former Redge Annex location (Laura observed)
","2023-07-31","2023-07-01",40.727706007763885,-73.98187365192827,"recvnGPMCuUJgWpdG",,,"{""id"":""usrSSqhKNrK05i823"",""email"":""Director@evccnyc.org"",""name"":""Laura Sewell""}","New York","2024-03-28T00:18:15.000Z","293","E. 10th Street","NY","10009",,,,,,,,,,,,,,,,,,,,,,,,,,,,
"2169",1999,1999,2169,"Dora's","40 Avenue B, New York, NY 10009","Restaurants",,"40","Avenue B","10009",40.722912,-73.983078,"https://www.instagram.com/doras_restaurant/?hl=en","Yes","Opened","3:00 PM","11:00 PM","SAT & SUN: 11:00 AM - 11:00 PM
","Opened 07/28/23 in former Carnaval location 
","2023-10-30","2023-07-28",40.72282049255885,-73.98287070232877,"reccGVjwreJPKLqBG","Ceviche",,"{""id"":""usrSSqhKNrK05i823"",""email"":""Director@evccnyc.org"",""name"":""Laura Sewell""}","New York","2024-04-08T20:20:11.000Z","40","Avenue B","NY","10009","https://evgrieve.com/2023/07/openings-doras-restaurant-on-avenue-b.html",,,,"(646) 484-5684",,,true,"Yes",,,,,,,,,,true,,,,,,,,,
"2168",1998,1998,2168,"8-Bit Bites","77 2nd Avenue, New York, NY 10003","Restaurants","EVCC","77","2nd Avenue","10003",40.72666,-73.98949,"https://www.instagram.com/8bitbitesusa/","Yes","Opened","11:00 AM","12:00 AM","FRI & SAT: 11:00 AM - 4:00 AM
","Opened 8/1/2023 in former Sauced Up location. 5th location for growing local chain. IG for several locations, Hours from Google 
","2024-07-08","2023-08-01",40.72648551286973,-73.9892160306798,"recJ4oXRWbmrSTgcU","American,Halal,Games",,"{""id"":""usrSSqhKNrK05i823"",""email"":""Director@evccnyc.org"",""name"":""Laura Sewell""}","New York","2024-07-08T23:20:03.000Z","77","2nd Avenue","NY","10003","https://www.instagram.com/p/CvbKE1fPqIZ/",,,,"(646) 398-8385",,"https://order.toasttab.com/online/8bit-bites-east-village-77-2nd-avenue",,"Yes",,,,,,,,,,,,,,,,,,,
"2167",1997,1997,2167,"Rainbow Spa","654 E. 12th Street, New York, NY 10009","Health",,"654","E. 12th Street","10009",40.73405,-73.99377,,"Yes","Opened",,,,,"2023-07-31",,40.72727148304762,-73.9770860496702,"rec1NXF66IvgoNi94","Natural & Alternative",,"{""id"":""usrSSqhKNrK05i823"",""email"":""Director@evccnyc.org"",""name"":""Laura Sewell""}","New York","2024-03-28T00:18:15.000Z","654","E. 12th Street","NY","10009",,,,,"(929) 300-1863",,,,,,,,,,,,,,,,,,,,,,,
"2166",1996,1996,2166,"Rosemary Home","315 E. 9th Street, New York, NY 10003","Retail","EVCC","315","E. 9th Street","10003",40.72903,-73.98629,"https://www.instagram.com/shoprosemaryhome/","Yes","Opened","12:00 PM","7:00 PM","TUE - THU, By Appointment only
","IG and website are current, hours from website. Opened June 2023 in former Verameat location.
","2023-07-31","2023-06-01",40.728941800441085,-73.98664672410861,"reczoQU1apyAQUQM5","Gifts & Home,Jewelry",,"{""id"":""usrSSqhKNrK05i823"",""email"":""Director@evccnyc.org"",""name"":""Laura Sewell""}","New York","2024-04-08T20:15:57.000Z","315","E. 9th Street","NY","10003","https://evgrieve.com/2023/07/openings-rosemary-home-on-9th-street.html",,,,"(862) 389-8048",,"https://www.rosemaryhome.com/",,,,,,,,,,,,true,,,,,,,,,
"2165",1995,1995,2165,"Chrissy's Pizza","430 E. 9th Street, New York, NY 10009","Restaurants","EVCC","430","E. 9th Street","10009",40.72739,-73.98357,"https://www.instagram.com/chrissys.pizza/","No","Closed",,,"Preorders Only!
","PERMANENTLY CLOSED. Pizza on late-night menu at SB. Observed Stayover Notice 3/8/2024 after 2023 pop-up (pre-orders only) in former Superiority Burger location (briefly Salad Days). 
","2024-05-30","2023-07-06",40.7275827311411,-73.98345035734555,"recfWXtv1VfYn1qpe","Pizza",,"{""id"":""usrSSqhKNrK05i823"",""email"":""Director@evccnyc.org"",""name"":""Laura Sewell""}","New York","2024-07-30T17:19:40.000Z","430","E. 9th Street","NY","10009","https://www.instagram.com/p/C9-qa4IS4_L/?utm_source=ig_web_copy_link&igsh=MzRlODBiNWFlZA== 
https://evgrieve.com/2024/05/soft-openings-sip-co-on-9th-street.html",,,,"(212) 256-1192",,,,,,,,,,,,"2024-03-01",,,,,,,,,,,
"2164",1994,1994,2164,"Stars Pizza","35 1st Avenue, New York, NY 10003","Restaurants",,"35","1st Avenue","10003",40.72408,-73.98794,,"No","Closed",,,,"Long vacant storefront building demo permit filed 06/20/23
","2023-07-31",,40.72408097096083,-73.9878635115732,"recgF6q06MEe3uWfP","Pizza",,"{""id"":""usrSSqhKNrK05i823"",""email"":""Director@evccnyc.org"",""name"":""Laura Sewell""}","New York","2024-03-28T00:18:15.000Z","35","1st Avenue","NY","10003","https://evgrieve.com/2015/02/another-pizza-random-food-item-place.html",,,,,,,,,,,,,,,,"2015-01-01",,,,,,,,,,,
"2163",1993,1993,2163,"Kuppi Coffee","82 St. Mark's Place, New York, NY 10003","Cafes and Desserts",,"82","St. Mark's Place","10003",40.7276,-73.98564,"https://www.instagram.com/kuppicoffee/?hl=en","Yes","Opened","8:00 AM","3:00 PM",,"Soft Opened 07/26/23 in former AO Bowl location. Hours from EV Grieve post. IG is current. Website only shows NJ location 
","2023-07-27","2023-07-26",40.72782184566631,-73.985856805781,"recoK5XBm1fNWQctD","Cafe",,"{""id"":""usrSSqhKNrK05i823"",""email"":""Director@evccnyc.org"",""name"":""Laura Sewell""}","New York","2024-03-28T00:18:15.000Z","82","St. Mark's Place","NY","10003","https://evgrieve.com/search?q=kuppi",,,,,,"http://www.kuppicoffee.com/",,,,,,,,,,,,,,,,,,,,,
"2161",1991,1991,2161,"Upright Citizens Brigade UCB","242 E. 14th Street, New York, NY 10003","Arts & Culture","OB","242","E. 14th Street","10003",40.732693,-73.98577,"https://www.instagram.com/ucbtny/",,"Opened",,,"Buy tickets to shows [here](https://ucbcomedy.com/nyc/)!
","Opened April 2024 in former IG-Fit Location
","2024-07-15","2024-04-16",40.73286125568367,-73.98618047692001,"rec5sm5ETEwHvziGi","Comedy","West","{""id"":""usrSSqhKNrK05i823"",""email"":""Director@evccnyc.org"",""name"":""Laura Sewell""}","New York","2024-07-18T17:22:07.000Z","242","E. 14th Street","NY","10003","https://evgrieve.com/2024/07/did-you-hear-one-about-upright-citizens.html 
https://www.instagram.com/p/C51b-kMPNkv/?img_index=1 
https://evgrieve.com/2023/07/the-upright-citizens-brigade-is.html",,,,,,"https://ucbcomedy.com/",,,,,,,,,,,,,,,,,,,,,
"2160",1990,1990,2160,"Avant Garden","95 Avenue A, New York, NY 10009","Restaurants","EVCC","95","Avenue A","10009",40.725665,-73.984116,"https://www.instagram.com/avantgardennyc/","Yes","Opened","5:00 PM","11:00 PM","Check out our new location!
","RELOCATED into former Cafe L'Enfer location from 130 E. 7th Street July 2023. IG and website are current.
","2023-07-18","2023-07-05",40.72556265470388,-73.9839054462709,"recZvfX5aGjJShsUB","Vegan","2nd Floor","{""id"":""usrSSqhKNrK05i823"",""email"":""Director@evccnyc.org"",""name"":""Laura Sewell""}","New York","2024-03-28T00:18:15.000Z","95","Avenue A","NY","10009","https://evgrieve.com/2023/07/avant-garden-reopens-in-new-avenue-home.html",,,,"(833) 328-4588","Yes","https://www.avantgardennyc.com/",,"Yes",,,,,,"info@avantgardennyc.com",,,,,,,,,,,,,
"2158",1989,1989,2158,"Cabin on 9th ","312 E. 9th Street, New York, NY 10003","Cafes and Desserts","EVCC","312","E. 9th Street","10003",40.728844,-73.986685,"https://www.instagram.com/cabinon9th/","Yes","Opened","8:00 AM","5:00 PM","SAT & SUN 9:00 AM - 6:00 PM
Brunch all day!
","Opened July 2023 in former Meg location. IG is current, website for orders only.
","2023-07-31","2023-07-08",40.72894180545386,-73.98669002032808,"recuM8DD58YvdkuB5","Cafe",,"{""id"":""usrSSqhKNrK05i823"",""email"":""Director@evccnyc.org"",""name"":""Laura Sewell""}","New York","2024-03-28T00:18:15.000Z","312","E. 9th Street","NY","10003","https://evgrieve.com/2022/10/after-nearly-30-years-meg-has-left-east.html",,,,,,"https://www.cabinon9th.com/",,,,,,,,,,,,,,,,,,,,,
"2157",1988,1988,2157,"No Nail Salon","120 E. 7th Street,  New York, NY 10009","Services","EVCC","120","E. 7th Street","10009",40.72622,-73.98439,"https://www.instagram.com/nonailsalon/?hl=en","Yes","Opened","11:00 AM","8:00 PM","We carry Jo Malone!
","Opened May 2023 in former The Cut location. IG and website are current, hours from website. 
","2023-07-13","2023-05-01",40.72634495879535,-73.98425522148207,"recPr1nsIlV9dwhoE","Nail Salon",,"{""id"":""usrSSqhKNrK05i823"",""email"":""Director@evccnyc.org"",""name"":""Laura Sewell""}","New York","2024-03-28T00:18:15.000Z","120","E. 7th Street","NY","10009",,,,,"(929) 607-8535",,"https://www.nonailsalon.com/",,,,,,,,,,,,,"Grand Opening Special 15% OFF services! ",,,,,,,,
"2156",1987,1987,2156,"Pig & Butter","42 Avenue B, New York, NY 10009","Restaurants",,"42","Avenue B","10009",40.722969,-73.98304,"https://www.instagram.com/pigandbutter/","Yes","Opened",,,"WED: 4:00 PM - 10:00 PM
THU: 4:00 PM - 11:00 PM
FRI: 3:00 PM - Midnight
SAT: 11:00 AM - Midnight
SUN: 11:00 AM - 10:00 PM
","Hours from Ave B website, IG is for all locations. Opened 9/7/2023 in former Looker NYC location. 
","2023-09-10","2023-09-07",40.72287263705026,-73.98283100433827,"rec4RKjVCQogMEULN","Bar,American","South","{""id"":""usrSSqhKNrK05i823"",""email"":""Director@evccnyc.org"",""name"":""Laura Sewell""}","New York","2024-04-08T20:20:07.000Z","42","Avenue B","NY","10009","https://www.instagram.com/p/Cw0XXITOLG-/",,,,,,"https://www.pigandbutteraveb.com/",,"Yes",,,,,,"Cheers@pigandbutter.com",,,,true,,,,,true,,,,
"2155",1986,1986,2155,"Blue Bird","106 3rd Avenue, New York, NY 10003","Restaurants",,"106","3rd Avenue","10003",40.732804,-73.987855,"https://www.instagram.com/bluebird_nyc/",,"Unknown","4:00 PM","12:00 AM",,"Opened July 2023 in former Ugly Duckling Location, Hospitality Group rebrand, IG link no longer working
","2023-10-30","2023-07-11",40.732710457583536,-73.9876165807211,"recHwR1ZUuj43Yu82","Bar",,"{""id"":""usrSSqhKNrK05i823"",""email"":""Director@evccnyc.org"",""name"":""Laura Sewell""}","New York","2024-03-28T00:18:15.000Z","106","3rd Avenue","NY","10003","https://evgrieve.com/2023/07/on-13th-and-3rd-ugly-duckling-becomes.html",,,,"(212) 254-3825",,"https://www.bluebird-nyc.com/",,"Yes",,,,,,,,"2023-10-01",,,,,,,,,,,
"2154",1985,1985,2154,"Life, the Universe & Everything","42 Avenue B, New York, NY 10009","Arts & Culture",,"42","Avenue B","10009",40.72297,-73.98304,,"No","Closed","2:00 PM","6:00 PM","Additional hours
SUN & MON: Closed
","Pop-up gallery in former Main Event Location
","2023-06-10","2023-06-09",40.72287263705026,-73.98283100433827,"recvzYvdV4h1tnEPE","Gallery",,"{""id"":""usrSSqhKNrK05i823"",""email"":""Director@evccnyc.org"",""name"":""Laura Sewell""}","New York","2024-03-28T00:18:15.000Z","42","Avenue B","NY","10009","https://evgrieve.com/2023/06/a-pop-up-gallery-for-summer-at-42.html",,,,,,,,,,,,,,,,"2023-08-31",,,,,,,,,,,
"2153",1984,1984,2153,"Maze Smoke Shop","16 St. Mark's Place, New York, NY 10003","Retail","EVCC","16","St. Mark's Place","10003",40.728956,-73.989137,,"Yes","Opened","8:00 AM","1:00 AM","FRI: 8:00 AM - 2:00 AM
SAT: 9:00 AM - 2:00 AM
SUN: 8:30 AM - 11:30 PM
","UNLICENSED for tobacco & e-cigarettes. Cited for illegal cannabis sales in June 9 2023 crackdown. Maze convenience smoke shop and vape opened 2022 in former Hometown Village Convenience. 
","2023-08-16",,40.729128687420584,-73.98894500080362,"recRP2LC1cfvJDAeV","Smoke Shop",,"{""id"":""usrSSqhKNrK05i823"",""email"":""Director@evccnyc.org"",""name"":""Laura Sewell""}","New York","2024-07-29T21:01:10.000Z","16","St. Mark's Place","NY","10003","https://patch.com/new-york/east-village/s/ip90n/7-manhattan-pot-shops-busted-in-unlicensed-cannabis-crackdown?utm_term=article-slot-1&utm_source=newsletter-daily&utm_medium=email&utm_campaign=newsletter&utm_content=email-test_E1:v1&user_email=e2ce0e29c79f275c3005db59b7f34c5f32df46121c9c48174d1c18cdf19fe05a",,,,"(646) 767-0170",,,,,,"Hometown Village Convenience Store likely rebranded 2022.",,,,,,,,,,,,,,,,,
"2152",1983,1983,2152,"Star Team","436 E. 9th Street, New York, NY 10009","Retail","EVCC","436","E. 9th Street","10009",40.7273,-73.98334,"https://www.instagram.com/starteam.eastvillage/","Yes","Opened","12:00 PM","7:00 PM","SAT & SUN: Noon - 5:00 PM
","Opened 5/31/2023 in former Butterfly Club location.
","2023-07-25","2023-05-31",40.72755802002334,-73.98339263638682,"rec1j026Q6YUIFDkm","Fashion,Skateboard Shop",,"{""id"":""usrSSqhKNrK05i823"",""email"":""Director@evccnyc.org"",""name"":""Laura Sewell""}","New York","2024-07-26T19:01:50.000Z","436","E. 9th Street","NY","10009","https://evgrieve.com/2023/06/openings-star-team-on-9th-street.html",,,,,,"https://starteam.shop/",,,,,true,,,,,,,,,,,"Yes",,,,,
"2151",1982,1982,2151,"Food Not Bombs","E. 9th Street & Avenue B, New York, NY 10009","Free Food",,"Tompkins","Square Park","10009",40.7214,-73.98387,"https://www.instagram.com/lesfoodnotbombs/?hl=en","Yes","Opened","4:30 PM",,"SUN Only
","IG is current, Long-running vegan food distro
","2023-07-31",,40.726451628404206,-73.98171163835781,"recQBAz9aLbZIPExN","Vegan",,"{""id"":""usrSSqhKNrK05i823"",""email"":""Director@evccnyc.org"",""name"":""Laura Sewell""}","New York","2024-04-03T21:19:01.000Z",,"E. 9th Street & Avenue B","NY","10009",,,,,,,,,,,,,,,,,,,,,,,,,,,,
"2150",1981,1981,2150,"Duo Cafe","223 E. 5th Street, New York, NY 10009","Cafes and Desserts","EVCC","223","E. 5th Street","10009",40.72744,-73.98993,"https://www.instagram.com/duocafe.nyc/","Yes","Opened","12:00 PM","9:00 PM","FRI: Noon - 10:00 PM
SAT: 11:00 AM - 10:00 PM
SUN: 11:00 AM - 9:00 PM
MON: Closed
","Opened 10/17/2023 in long-vacant location. Google hours updated by business April 2024
","2024-06-19","2023-10-17",40.727427077781975,-73.99050391158681,"recuqPhOBoFv5wdjz","Tea Shop",,"{""id"":""usrSSqhKNrK05i823"",""email"":""Director@evccnyc.org"",""name"":""Laura Sewell""}","New York","2024-06-19T23:52:02.000Z","223","E. 5th Street","NY","10009","https://www.instagram.com/p/CyhD4hju5G3/?img_index=1",,,,,,,,,,,true,,,,,,,,,,,,,,,,
"2149",1980,1980,2149,"Whim Golf","66 Avenue A, New York, NY 10009","Retail","EVCC","66","Avenue A","10009",40.724419,-73.984537,"https://www.instagram.com/whimgolf/","No","Closed","12:00 PM","8:00 PM","Closing 8/31
Free putting green!
MON & TUE: Closed
","PERMANENTLY CLOSED. Pop-up opened 07/19/23 in former Lancelotti location. Biz updated hours on google 07/20/23
","2023-09-01","2023-07-19",40.724585614920535,-73.98459116091409,"recI0GcpjrrtTy6bV","Golf,Fashion","North","{""id"":""usrSSqhKNrK05i823"",""email"":""Director@evccnyc.org"",""name"":""Laura Sewell""}","New York","2024-03-28T00:18:15.000Z","66","Avenue A","NY","10009","https://evgrieve.com/2023/08/does-anyone-have-need-fore-putting-green.html",,,,"(716) 866-9421",,"https://whimgolf.com/",,,,,,,,,,"2023-08-31",,,,,,,,,,,
"2148",1979,1979,2148,"The Pastry Box","515 E. 12th Street, New York, NY 10009","Cafes and Desserts",,"515","E. 12th Street","10009",40.728931,-73.9804,"https://www.instagram.com/thepastrybox_co/","Yes","Opened","7:00 AM","7:00 PM","MON: 7:00 AM - 5:00 PM
SUN: 9:00 AM - 5:00 PM
TUE & WED: Closed 
","Opened July 2023 in former Hi Noona location. Hours from website. Laura observed sign on door: Tiara Bennett
","2023-07-24","2023-07-17",40.728847641728784,-73.98073681719882,"reclzKT6OJkxnKLij","Cafe,Bakery",,"{""id"":""usrSSqhKNrK05i823"",""email"":""Director@evccnyc.org"",""name"":""Laura Sewell""}","New York","2024-04-08T20:14:28.000Z","515","E. 12th Street","NY","10009","https://evgrieve.com/2023/06/about-pastry-box-now-open-on-12th-street.html",,,,,,"https://thepastrybox.co/",,,,,,"Yes",,,,,,true,,,,,true,,,,
"2147",1978,1978,2147,"Glizzy's","34 St. Mark's Place, New York, NY 10003","Restaurants","EVCC","34","St. Mark's Place","10003",40.6671,-73.69566,,"No","Closed",,,,"PERMANENTLY CLOSED. Opened 11/1/2023 in briefly-if-ever-opened Lucky Star location. Closed early January 2024!	
","2023-11-01","2023-11-01",40.728771785765865,-73.98810800188751,"recGfsmxbvJ0NQwKa","Hot Dogs","West","{""id"":""usrSSqhKNrK05i823"",""email"":""Director@evccnyc.org"",""name"":""Laura Sewell""}","New York","2024-04-05T23:07:51.000Z","34","St. Mark's Place","NY","10003","https://evgrieve.com/2024/01/glizzys-has-left-st-marks-place.html",,,,,,,,,,,,,,,,"2024-01-02",,,,,,,,,,,
"2146",1977,1977,2146,"Shiso","214 E. 9th Street, New York, NY 10003","Restaurants","SB","214","E. 9th Street","10003",40.7296,-73.98869,"https://www.instagram.com/shisonyc/","Yes","Opened","5:00 PM","10:00 PM","MON & TUE: Closed 
Make a [reservation](https://www.opentable.com/r/shiso-new-york?shareReferrer=ios-share)!
Available for private events, buyouts and catering!
","Opened June 2023 in former Dumpling Lab location.
","2023-06-04","2023-06-01",40.72969405819217,-73.98844699485592,"rec5Ak7ytxggHePT1","Japanese,Omakase","East","{""id"":""usrSSqhKNrK05i823"",""email"":""Director@evccnyc.org"",""name"":""Laura Sewell""}","New York","2024-05-14T21:12:20.000Z","214","E. 9th Street","NY","10003",,,,," (856) 304-6681",,,,,,,,,,,,,,,,,,,,,,,
"2145",1976,1976,2145,"Lollo Italian Restaurant","27 Avenue B, New York, NY 10009","Restaurants","EVCC","27","Avenue B","10009",40.722424,-73.982899,"https://www.instagram.com/lollo_nyc/","Yes","Opened",,,,"Opened 10/29/2023 in former Solo Pizza location, Lollo partners
","2023-11-05","2023-10-29",40.722364907926405,-73.98317747072308,"recKV3A0HZejXo74j","Pizza",,"{""id"":""usrSSqhKNrK05i823"",""email"":""Director@evccnyc.org"",""name"":""Laura Sewell""}","New York","2024-03-28T00:18:15.000Z","27","Avenue B","NY","10009","https://evgrieve.com/2023/11/openings-lollo-ristorante-pizzeria-bar.html",,,,"(212) 420-7656",,,,"Yes",,,,"Yes",,,,,,,,,,,,,,,
"2144",1975,1975,2144,"Cafe Maud","132 2nd Avenue, New York, NY 10003","Restaurants","OB","132","2nd Avenue","10003",40.72862,-73.987355,"https://www.instagram.com/cafemaud/","Yes","Opened","9:00 AM","12:00 AM","THU, FRI & SAT: 9:00 AM - 2:00 AM
","Soft-opened 6/15/2024 in former Dallas BBQ location
","2024-06-15","2024-06-15",40.72868115515968,-73.98759928946133,"recy6CG5pQKfLvyLL",,"Corner","{""id"":""usrSSqhKNrK05i823"",""email"":""Director@evccnyc.org"",""name"":""Laura Sewell""}","New York","2024-07-12T15:13:48.000Z","132","2nd Avenue","NY","10003","https://evgrieve.com/2024/05/cafe-maud-is-name-of-new-establishment.html",,,,"(212) 218-3919",,"https://cafemaud.com/",,"Yes",,,,"Yes",,,,,,,,,,,,,,,
"2143",1974,1974,2143,"Deli Convenience / Dispensary / Deli Convenience","231 1st Avenue, New York, NY 10003","Retail","JK","231","1st Avenue","10003",40.731147,-73.983024,,"No","Closed",,,,"PERMANENTLY CLOSED. Repopulated by Chick-N-Smash. Deli Convenience opened spring 2023? in former short-lived Tony's Famous Pizza location (previously Vinny Vincenz), briefly rebranded as Dispensary then switched back to Deli Convenience in May.
","2023-11-30","2023-01-01",40.73108493870012,-73.98276394200298,"recfpLCuBBSSDL4w9","Smoke Shop,Cannabis",,"{""id"":""usrSSqhKNrK05i823"",""email"":""Director@evccnyc.org"",""name"":""Laura Sewell""}","New York","2024-07-29T18:51:46.000Z","231","1st Avenue","NY","10003","https://evgrieve.com/2023/12/openings-chick-n-smash-on-1st-avenue.html",,,,,,,,,true,"Briefly Tony's Pizza, previously Vinny Vincenz ( longstanding business)",,,,,,"2023-11-30",,,,,,,,,,,
"2142",1973,1973,2142,"Penelope's East Village Salon","380 E. 10th Street, New York, NY 10009","Services","EVCC","380","E. 10th Street","10009",40.72605,-73.97851,"https://www.instagram.com/penelopeseastvillage/","No","Closed","10:00 AM","7:00 PM","SUN: Closed
","PERMANENTLY CLOSED. Observed for rent sign 5/30/2024. Penelope Salon spring 2023 (observed new sign), Rebrand? (IG post has i salon 212#)
","2024-04-01","2023-04-01",40.72620401576985,-73.97834195554522,"recN8tlsdqxhL6mdF","Hair","East","{""id"":""usrSSqhKNrK05i823"",""email"":""Director@evccnyc.org"",""name"":""Laura Sewell""}","New York","2024-06-08T00:23:45.000Z","380","E. 10th Street","NY","10009","https://www.instagram.com/p/CwBUXioth5l/",,,,"(212) 505-6400",,,,,,,,,,,,"2024-05-01",,,,,,,,,,,
"2141",1972,1972,2141,"Madeline's Martini","171 Avenue C, New York, NY 10009","Restaurants","OB","171","Avenue C","10009",40.726306,-73.977606,"https://www.instagram.com/madelinesmartini/","Yes","Opened","7:00 PM","2:00 AM","FRI & SAT: 7:00 PM - 4:00 AM
SUN-TUE: Closed
","New offering from the Wayland team. Opened April 2023 in former Lost City / Lost Lady location. Hours updated by business on Google.
","2024-08-01",,40.726203814924965,-73.97729928112015,"rectKJOGyPzH89hab","Bar",,"{""id"":""usrSSqhKNrK05i823"",""email"":""Director@evccnyc.org"",""name"":""Laura Sewell""}","New York","2024-08-01T18:54:32.000Z","171","Avenue C","NY","10009",,,,,,,"https://www.madelinesmartini.com/",,"Yes",,,,,,,,,,,,,,,,,,,
"2140",1971,1971,2140,"Target","500 E. 14th Street, New York, NY 10009","Retail","EVCC","500","E. 14th Street","10009",40.72984,-73.97985,,"Yes","Opened","8:00 AM","9:00 PM",,"CHAIN. Hours and phone from website. 
","2023-05-18",,40.73021613,-73.98030802,"recmYYmUAGiuxpkjp","Gifts & Home,Fashion,Cosmetics & Grooming",,"{""id"":""usrSSqhKNrK05i823"",""email"":""Director@evccnyc.org"",""name"":""Laura Sewell""}","New York","2024-06-29T23:08:53.000Z","500","E. 14th Street","NY","10009",,"What's Open Filled",true,,"(917) 994-3522",,"https://www.target.com/sl/manhattan-east-village/3249",,,,,,,,,,,,,,,,,,,,,
"2138",1969,1969,2138,"VACANT","224 1st Avenue, New York, NY 10009","Services","EVCC","224","1st Avenue","10009",40.73095,-73.98251,,,"Unknown",,,,"Former Sun Tan Nail location. Longstanding business with limited online presence closed during pandemic.
","2023-05-18",,40.73087561,-73.98270131,"recqW2xpf9BAPen39","Nail Salon","South","{""id"":""usrSSqhKNrK05i823"",""email"":""Director@evccnyc.org"",""name"":""Laura Sewell""}","New York","2024-08-06T22:47:28.000Z","224","1st Avenue","NY","10009",,"What's Open Filled",,,,,,,,,,,,,,,,,,,,,,,,,,
"2137",1968,1968,2137,"Avenue A Convenience Smoke & Beer","221 Avenue A, New York, NY 10009","Retail","EVCC","221","Avenue A","10009",40.730234,-73.980706,,"Yes","Opened",,,,"UNLICENSED for tobacco & e-cigarettes. No online presence. 
","2023-08-16","2016-01-01",40.73019579,-73.98068537,"recH0SRLS9UNlw3jl","Smoke Shop,CBD","South","{""id"":""usrSSqhKNrK05i823"",""email"":""Director@evccnyc.org"",""name"":""Laura Sewell""}","New York","2024-07-26T18:45:08.000Z","221","Avenue A","NY","10009",,"What's Open Filled",,,,,,,,true,,,,,,,,,,,,,,,,,,
"2136",1967,1967,2136,"Hear USA","222 1st Avenue, New York, NY 10009","Health",,"222","1st Avenue","10009",40.730759,-73.982651,,"Yes","Opened","8:30 AM","5:00 PM","SAT & SUN: Closed
","CHAIN. Hours and phone from website. 
","2023-05-18",,40.73083256,-73.98273164,"recXB6pfXSc7dSem5","Medical","North","{""id"":""usrSSqhKNrK05i823"",""email"":""Director@evccnyc.org"",""name"":""Laura Sewell""}","New York","2024-08-06T22:05:39.000Z","222","1st Avenue","NY","10009",,"What's Open Filled",true,,"(866) 391-2313",,"https://www.hearusa.com/hearing-centers/details/us/10009/new-york/hearusa-east-village/42033/?utm_source=google&utm_medium=organic&utm_campaign=businessprofile&utm_content=hearusa-east-village-website-42033",,,,,,,,,,,,,,,,,,,,,
"2135",1966,1966,2135,"Domino's Pizza","440 E. 14th Street, New York, NY 10009","Restaurants","EVCC","440","E. 14th Street","10009",40.73043,-73.98079,,"Yes","Opened","10:00 AM","2:00 AM","SAT & SUN: 10:00 AM - 3:00 AM
","CHAIN. Longstanding location. Hours and phone from website.
","2023-05-18",,40.73043661,-73.98082169,"recmCRHSE9D6pYP4o","Pizza",,"{""id"":""usrSSqhKNrK05i823"",""email"":""Director@evccnyc.org"",""name"":""Laura Sewell""}","New York","2024-06-29T23:09:10.000Z","440","E. 14th Street","NY","10009",,"What's Open Filled",true,,"(212) 473-3030",,"https://pizza.dominos.com/new-york/new-york/440-e-14th-street/",,,,,,,,,,,,,,,,,,,,,
"2134",1965,1965,2134,"The New York Center for Creativity and Dance","287 E. 10th Street, New York, NY 10009","Community Services",,"287","E 10th Street","10009",40.72803,-73.98239,,"Yes","Opened","9:00 AM","9:00 PM","SAT: 10:00 AM - 6:00 PM
SUN: Closed
","Link to rentals page of main Joyce website, hours from website. Leasing with plans to purchase former Boys Club location. Confirm okay to list phone from Broadway buddy (646) 765-4773
","2023-05-16","2023-02-01",40.728049227754084,-73.98268895980785,"recGHrrodRbIuf4VF","Dance",,"{""id"":""usrSSqhKNrK05i823"",""email"":""Director@evccnyc.org"",""name"":""Laura Sewell""}","New York","2024-04-03T20:59:26.000Z","287","E. 10th Street","NY","10009",,,,,,,"https://www.joyce.org/rentals/new-york-center-creativity-dance",,,,,,,,"e10studios@joyce.org",,,,,,,,,,,,,
"2133",1964,1964,2133,"Time's Up!","646 E. 14th Street, New York, NY 10009","Community Services",,"646","E. 14th Street","10009",40.72858,-73.97613,"https://www.instagram.com/times_up_nyc/","Yes","Opened",,,"Check out our [events](https://times-up.org/calendar/)!
",,"2023-05-16",,40.72862445130515,-73.97611864010625,"recXetUE2RO4Af1Vl",,,"{""id"":""usrSSqhKNrK05i823"",""email"":""Director@evccnyc.org"",""name"":""Laura Sewell""}","New York","2024-05-16T21:07:04.000Z","646","E. 14th Street","NY","10009",,,,,,,"https://www.times-up.org/calendar",,,,,,,,"timesup.events@gmail.com",,,,,,,,,,,,,
"2132",1963,1963,2132,"Y&D Nail Spa","248 E. 14th Street, New York, NY 10003","Services",,"248","E. 14th Street","10003",40.73237,-73.98539,,"Yes","Opened","10:00 AM","9:00 PM",,"Opened March 2023 in former Beauty Cutie location (renovation by same owners?). Hours from website
","2023-05-16","2023-03-01",40.7328200726368,-73.9860830632951,"recyuDiYyjJxNOdSU","Nail Salon",,"{""id"":""usrSSqhKNrK05i823"",""email"":""Director@evccnyc.org"",""name"":""Laura Sewell""}","New York","2024-03-28T00:18:15.000Z","248","E. 14th Street","NY","10003",,,,,"(646) 883-9663",,"https://www.ydnailspa.com/",,,,,,,,"248y.dnailspa@gmail.com <248y.dnailspa@gmail.com>;",,,,,,,,,,,,,
"2131",1962,1962,2131,"Bungalow","24 1st Avenue, New York, NY 10009","Restaurants","OB","24","1st Avenue","10009",40.72356,-73.98784,"https://www.instagram.com/bungalowny","Yes","Opened","5:00 PM","11:00 PM","THU-SAT: 5:00 PM - MIDNIGHT
MON: Closed
","Hours from website. Opened 3/23/2024 in former Lucky Cheng location (vacant during building reno), on CB 3 SLA Committee May 2023. 
","2023-03-08","2024-03-23",40.72375711105177,-73.98806921159854,"recksEuyPQpEWQOk2","Indian",,"{""id"":""usrSSqhKNrK05i823"",""email"":""Director@evccnyc.org"",""name"":""Laura Sewell""}","New York","2024-07-23T18:10:08.000Z","24","1st Avenue","NY","10009","https://evgrieve.com/2024/03/openings-bungalow-on-1st-avenue.html",,,,"N/A",,"https://www.bungalowny.com/",,,,,true,,,"info@bungalowny.com",,,,,,,,,,,,,
"2129",1960,1960,2129,"The Artery","21 Avenue B, New York, NY 10009","Arts & Culture","EVCC","21","Avenue B","10009",40.722099,-73.983063,,"Yes","Opened",,,,"Soft-opened 9/14/23. Pre-Ven Hue dining gathering spot curated by jasonperezartcollective, find out if open to the general public?
","2023-10-30","2023-09-14",40.72221396251049,-73.98328934610372,"rec4GVKzHW2LxMhk7","Bar,Gallery","South,Front","{""id"":""usrSSqhKNrK05i823"",""email"":""Director@evccnyc.org"",""name"":""Laura Sewell""}","New York","2024-06-24T21:14:31.000Z","21","Avenue B","NY","10009",,,,,,,"https://www.venhue.com/artery",,,,,,,,,,,,,,,,,,,,,
"2128",1959,1959,2128,"Wingstop","426 E. 14th Street, New York, NY 10009","Restaurants",,"426","E. 14th Street","10009",40.73051,-73.9814,,"Yes","Opened","10:30 AM","12:00 AM",,"CHAIN. Hours and phone from website. 
","2023-05-15","2022-05-01",40.73068173,-73.9813788,"recBm7wPmiLDSfBHC","Wings",,"{""id"":""usrSSqhKNrK05i823"",""email"":""Director@evccnyc.org"",""name"":""Laura Sewell""}","New York","2024-03-28T00:18:15.000Z","426","E. 14th Street","NY","10009",,"What's Open Filled",true,,"(332) 242-7100",,"https://www.wingstop.com/location/wingstop-942-new-york-ny-10009/menu",,,,,,,,,,,,,,,,,,,,,
"2127",1958,1958,2127,"McDonalds","404 E. 14th Street, New York, NY 10009","Restaurants",,"404","E. 14th Street","10009",40.7308,-73.98243,,"Yes","Opened","12:00 AM","12:00 AM","Open 24/7!
","CHAIN. Longstanding location. Hours and phone from website. 
","2023-05-15",,40.73105356,-73.98227277,"recGSU8VKukfUUQ31","American",,"{""id"":""usrSSqhKNrK05i823"",""email"":""Director@evccnyc.org"",""name"":""Laura Sewell""}","New York","2024-03-28T00:18:15.000Z","404","E. 14th Street","NY","10009",,"What's Open Filled",true,,"(212) 598-0045",,"https://www.mcdonalds.com/us/en-us/location/ny/new-york/404-e-14th-st/13064.html",,,,,,,,,,,,,,,,,,,,,
"2126",1957,1957,2126,"VACANT","310 E. 14th Street, New York, NY 10003",,,"310","E. 14th Street","10003",40.73203,-73.98464,,,"Unknown",,,,"VACANT. Former Optyx location (observed closed in 2019).
","2023-05-15",,40.73212796,-73.98487443,"rec8P1LkB090s9dXR",,,"{""id"":""usrSSqhKNrK05i823"",""email"":""Director@evccnyc.org"",""name"":""Laura Sewell""}","New York","2024-03-28T00:18:15.000Z","310","E. 14th Street","NY","10003",,"What's Open Filled",,,,,,,,,,,,,,,,,,,,,,,,,,
"2125",1956,1956,2125,"Starbucks Coffee","219 1st Avenue, New York, NY 10003","Cafes and Desserts",,"219","1st Avenue","10003",40.73088,-73.98328,,"Yes","Opened","6:00 AM","8:00 PM","SAT & SUN: 6:00 AM - 7:30 PM
","CHAIN. Longstanding business. Phone and hours from website. 
","2023-05-15",,40.73081295,-73.98317448,"reckKfi3fSZtd0RPU","Cafe",,"{""id"":""usrSSqhKNrK05i823"",""email"":""Director@evccnyc.org"",""name"":""Laura Sewell""}","New York","2024-03-28T00:18:15.000Z","219","1st Avenue","NY","10003",,"What's Open Filled",true,,"(212) 254-0358",,"https://www.starbucks.com/store-locator/store/90278/13-th-1st-219-first-avenue-new-york-ny-100033072-us",,,,,,,,,,,,,,,,,,,,,
"2123",1954,1954,2123,"Vivi Bubble Tea","226 E. 14th Street, New York, NY 10003","Cafes and Desserts",,"226","E. 14th Street","10003",40.732578,-73.986229,"https://www.instagram.com/vivibubbletea/?hl=en","Yes","Opened","12:00 PM","9:45 PM",,"CHAIN. Longstanding business. Hours and phone from google,. 
